root@lamp-ubuntu-s-1vcpu-1gb-tor1-01:~# tcpdump -i eth0 dst 138.197.158.231

Flags [P.], seq 1017456:1017660, ack 505, win 501, length 204
21:18:19.750571 IP 138.197.158.231.ssh > cpe9050ca239d63-cm9050ca239d60.cpe.net.cable.rogers.com.55891: Flags [P.], seq 1017660:1017864, ack 505, win 501, length 204
21:18:19.750626 IP 138.197.158.231.ssh > cpe9050ca239d63-cm9050ca239d60.cpe.net.cable.rogers.com.55891: Flags [P.], seq 1017864:1018068, ack 505, win 501, length 204
21:18:19.750686 IP 138.197.158.231.ssh > cpe9050ca239d63-cm9050ca239d60.cpe.net.cable.rogers.com.55891: Flags [P.], seq 1018068:1018272, ack 505, win 501, length 204
21:18:19.750739 IP 138.197.158.231.ssh > cpe9050ca239d63-cm9050ca239d60.cpe.net.cable.rogers.com.55891: Flags [P.], seq 1018272:1018476, ack 505, win 501, length 204
21:18:19.750792 IP 138.197.158.231.ssh > cpe9050ca239d63-cm9050ca239d60.cpe.net.cable.rogers.com.55891: Flags [P.], seq 1018476:1018680, ack 505, win 501, length 204
21:18:19.750891 IP 138.197.158.231.ssh > cpe9050ca239d63-cm9050ca239d60.cpe.net.cable.rogers.com.55891: Flags [P.], seq 1018680:1018884, ack 505, win 501, length 204
21:18:19.750990 IP 138.197.158.231.ssh > cpe9050ca239d63-cm9050ca239d60.cpe.net.cable.rogers.com.55891: Flags [P.], seq 1018884:1019088, ack 505, win 501, length 204
21:18:19.751075 IP 138.197.158.231.ssh > cpe9050ca239d63-cm9050ca239d60.cpe.net.cable.rogers.com.55891: Flags [P.], seq 1019088:1019292, ack 505, win 501, length 204
21:18:19.751175 IP 138.197.158.231.ssh > cpe9050ca239d63-cm9050ca239d60.cpe.net.cable.rogers.com.55891: Flags [P.], seq 1019292:1019496, ack 505, win 501, length 204
21:18:19.751291 IP 138.197.158.231.ssh > cpe9050ca239d63-cm9050ca239d60.cpe.net.cable.rogers.com.55891: Flags [P.], seq 1019496:1019700, ack 505, win 501, length 204
21:18:19.751419 IP 138.197.158.231.ssh > cpe9050ca239d63-cm9050ca239d60.cpe.net.cable.rogers.com.55891: Flags [P.], seq 1019700:1019904, ack 505, win 501, length 204
21:18:19.751503 IP 138.197.158.231.ssh > cpe9050ca239d63-cm9050ca239d60.cpe.net.cable.rogers.com.55891: Flags [P.], seq 1019904:1020108, ack 505, win 501, length 204
21:18:19.751577 IP 138.197.158.231.ssh > cpe9050ca239d63-cm9050ca239d60.cpe.net.cable.rogers.com.55891: Flags [P.], seq 1020108:1020312, ack 505, win 501, length 204
21:18:19.751632 IP 138.197.158.231.ssh > cpe9050ca239d63-cm9050ca239d60.cpe.net.cable.rogers.com.55891: Flags [P.], seq 1020312:1020516, ack 505, win 501, length 204
21:18:19.751688 IP 138.197.158.231.ssh > cpe9050ca239d63-cm9050ca239d60.cpe.net.cable.rogers.com.55891: Flags [P.], seq 1020516:1020720, ack 505, win 501, length 204
21:18:19.751742 IP 138.197.158.231.ssh > cpe9050ca239d63-cm9050ca239d60.cpe.net.cable.rogers.com.55891: Flags [P.], seq 1020720:1020924, ack 505, win 501, length 204
21:18:19.751794 IP 138.197.158.231.ssh > cpe9050ca239d63-cm9050ca239d60.cpe.net.cable.rogers.com.55891: Flags [P.], seq 1020924:1021128, ack 505, win 501, length 204
21:18:19.751864 IP 138.197.158.231.ssh > cpe9050ca239d63-cm9050ca239d60.cpe.net.cable.rogers.com.55891: Flags [P.], seq 1021128:1021332, ack 505, win 501, length 204
21:18:19.751919 IP 138.197.158.231.ssh > cpe9050ca239d63-cm9050ca239d60.cpe.net.cable.rogers.com.55891: Flags [P.], seq 1021332:1021536, ack 505, win 501, length 204
21:18:19.751972 IP 138.197.158.231.ssh > cpe9050ca239d63-cm9050ca239d60.cpe.net.cable.rogers.com.55891: Flags [P.], seq 1021536:1021740, ack 505, win 501, length 204
21:18:19.752028 IP 138.197.158.231.ssh > cpe9050ca239d63-cm9050ca239d60.cpe.net.cable.rogers.com.55891: Flags [P.], seq 1021740:1021944, ack 505, win 501, length 204
21:18:19.752140 IP 138.197.158.231.ssh > cpe9050ca239d63-cm9050ca239d60.cpe.net.cable.rogers.com.55891: Flags [P.], seq 1021944:1022148, ack 505, win 501, length 204
21:18:19.752218 IP 138.197.158.231.ssh > cpe9050ca239d63-cm9050ca239d60.cpe.net.cable.rogers.com.55891: Flags [P.], seq 1022148:1022352, ack 505, win 501, length 204
21:18:19.752275 IP 138.197.158.231.ssh > cpe9050ca239d63-cm9050ca239d60.cpe.net.cable.rogers.com.55891: Flags [P.], seq 1022352:1022556, ack 505, win 501, length 204
21:18:19.752333 IP 138.197.158.231.ssh > cpe9050ca239d63-cm9050ca239d60.cpe.net.cable.rogers.com.55891: Flags [P.], seq 1022556:1022760, ack 505, win 501, length 204
21:18:19.752388 IP 138.197.158.231.ssh > cpe9050ca239d63-cm9050ca239d60.cpe.net.cable.rogers.com.55891: Flags [P.], seq 1022760:1022964, ack 505, win 501, length 204
21:18:19.752442 IP 138.197.158.231.ssh > cpe9050ca239d63-cm9050ca239d60.cpe.net.cable.rogers.com.55891: Flags [P.], seq 1022964:1023168, ack 505, win 501, length 204
21:18:19.752522 IP 138.197.158.231.ssh > cpe9050ca239d63-cm9050ca239d60.cpe.net.cable.rogers.com.55891: Flags [P.], seq 1023168:1023372, ack 505, win 501, length 204
21:18:19.752580 IP 138.197.158.231.ssh > cpe9050ca239d63-cm9050ca239d60.cpe.net.cable.rogers.com.55891: Flags [P.], seq 1023372:1023576, ack 505, win 501, length 204
21:18:19.752634 IP 138.197.158.231.ssh > cpe9050ca239d63-cm9050ca239d60.cpe.net.cable.rogers.com.55891: Flags [P.], seq 1023576:1023780, ack 505, win 501, length 204
21:18:19.752692 IP 138.197.158.231.ssh > cpe9050ca239d63-cm9050ca239d60.cpe.net.cable.rogers.com.55891: Flags [P.], seq 1023780:1023984, ack 505, win 501, length 204
21:18:19.752748 IP 138.197.158.231.ssh > cpe9050ca239d63-cm9050ca239d60.cpe.net.cable.rogers.com.55891: Flags [P.], seq 1023984:1024188, ack 505, win 501, length 204
21:18:19.752801 IP 138.197.158.231.ssh > cpe9050ca239d63-cm9050ca239d60.cpe.net.cable.rogers.com.55891: Flags [P.], seq 1024188:1024392, ack 505, win 501, length 204
21:18:19.752858 IP 138.197.158.231.ssh > cpe9050ca239d63-cm9050ca239d60.cpe.net.cable.rogers.com.55891: Flags [P.], seq 1024392:1024596, ack 505, win 501, length 204
21:18:19.752975 IP 138.197.158.231.ssh > cpe9050ca239d63-cm9050ca239d60.cpe.net.cable.rogers.com.55891: Flags [P.], seq 1024596:1024800, ack 505, win 501, length 204
21:18:19.753058 IP 138.197.158.231.ssh > cpe9050ca239d63-cm9050ca239d60.cpe.net.cable.rogers.com.55891: Flags [P.], seq 1024800:1025004, ack 505, win 501, length 204
21:18:19.753117 IP 138.197.158.231.ssh > cpe9050ca239d63-cm9050ca239d60.cpe.net.cable.rogers.com.55891: Flags [P.], seq 1025004:1025208, ack 505, win 501, length 204
21:18:19.753174 IP 138.197.158.231.ssh > cpe9050ca239d63-cm9050ca239d60.cpe.net.cable.rogers.com.55891: Flags [P.], seq 1025208:1025412, ack 505, win 501, length 204
21:18:19.753228 IP 138.197.158.231.ssh > cpe9050ca239d63-cm9050ca239d60.cpe.net.cable.rogers.com.55891: Flags [P.], seq 1025412:1025616, ack 505, win 501, length 204
21:18:19.753285 IP 138.197.158.231.ssh > cpe9050ca239d63-cm9050ca239d60.cpe.net.cable.rogers.com.55891: Flags [P.], seq 1025616:1025820, ack 505, win 501, length 204
21:18:19.753338 IP 138.197.158.231.ssh > cpe9050ca239d63-cm9050ca239d60.cpe.net.cable.rogers.com.55891: Flags [P.], seq 1025820:1026024, ack 505, win 501, length 204
21:18:19.753391 IP 138.197.158.231.ssh > cpe9050ca239d63-cm9050ca239d60.cpe.net.cable.rogers.com.55891: Flags [P.], seq 1026024:1026228, ack 505, win 501, length 204
21:18:19.753462 IP 138.197.158.231.ssh > cpe9050ca239d63-cm9050ca239d60.cpe.net.cable.rogers.com.55891: Flags [P.], seq 1026228:1026432, ack 505, win 501, length 204
21:18:19.753547 IP 138.197.158.231.ssh > cpe9050ca239d63-cm9050ca239d60.cpe.net.cable.rogers.com.55891: Flags [P.], seq 1026432:1026636, ack 505, win 501, length 204
21:18:19.753608 IP 138.197.158.231.ssh > cpe9050ca239d63-cm9050ca239d60.cpe.net.cable.rogers.com.55891: Flags [P.], seq 1026636:1026840, ack 505, win 501, length 204
21:18:19.753667 IP 138.197.158.231.ssh > cpe9050ca239d63-cm9050ca239d60.cpe.net.cable.rogers.com.55891: Flags [P.], seq 1026840:1027044, ack 505, win 501, length 204
21:18:19.753721 IP 138.197.158.231.ssh > cpe9050ca239d63-cm9050ca239d60.cpe.net.cable.rogers.com.55891: Flags [P.], seq 1027044:1027248, ack 505, win 501, length 204
21:18:19.753778 IP 138.197.158.231.ssh > cpe9050ca239d63-cm9050ca239d60.cpe.net.cable.rogers.com.55891: Flags [P.], seq 1027248:1027452, ack 505, win 501, length 204
21:18:19.753832 IP 138.197.158.231.ssh > cpe9050ca239d63-cm9050ca239d60.cpe.net.cable.rogers.com.55891: Flags [P.], seq 1027452:1027656, ack 505, win 501, length 204
21:18:19.753889 IP 138.197.158.231.ssh > cpe9050ca239d63-cm9050ca239d60.cpe.net.cable.rogers.com.55891: Flags [P.], seq 1027656:1027860, ack 505, win 501, length 204
21:18:19.753961 IP 138.197.158.231.ssh > cpe9050ca239d63-cm9050ca239d60.cpe.net.cable.rogers.com.55891: Flags [P.], seq 1027860:1028064, ack 505, win 501, length 204
21:18:19.754017 IP 138.197.158.231.ssh > cpe9050ca239d63-cm9050ca239d60.cpe.net.cable.rogers.com.55891: Flags [P.], seq 1028064:1028268, ack 505, win 501, length 204
21:18:19.754072 IP 138.197.158.231.ssh > cpe9050ca239d63-cm9050ca239d60.cpe.net.cable.rogers.com.55891: Flags [P.], seq 1028268:1028472, ack 505, win 501, length 204
21:18:19.754125 IP 138.197.158.231.ssh > cpe9050ca239d63-cm9050ca239d60.cpe.net.cable.rogers.com.55891: Flags [P.], seq 1028472:1028676, ack 505, win 501, length 204
21:18:19.754179 IP 138.197.158.231.ssh > cpe9050ca239d63-cm9050ca239d60.cpe.net.cable.rogers.com.55891: Flags [P.], seq 1028676:1028880, ack 505, win 501, length 204
21:18:19.754233 IP 138.197.158.231.ssh > cpe9050ca239d63-cm9050ca239d60.cpe.net.cable.rogers.com.55891: Flags [P.], seq 1028880:1029084, ack 505, win 501, length 204
21:18:19.766189 IP 138.197.158.231.ssh > cpe9050ca239d63-cm9050ca239d60.cpe.net.cable.rogers.com.55891: Flags [P.], seq 1029084:1029288, ack 505, win 501, length 204
21:18:19.766500 IP 138.197.158.231.ssh > cpe9050ca239d63-cm9050ca239d60.cpe.net.cable.rogers.com.55891: Flags [P.], seq 1029288:1029492, ack 505, win 501, length 204
21:18:19.766612 IP 138.197.158.231.ssh > cpe9050ca239d63-cm9050ca239d60.cpe.net.cable.rogers.com.55891: Flags [P.], seq 1029492:1029696, ack 505, win 501, length 204
21:18:19.766691 IP 138.197.158.231.ssh > cpe9050ca239d63-cm9050ca239d60.cpe.net.cable.rogers.com.55891: Flags [P.], seq 1029696:1029900, ack 505, win 501, length 204
21:18:19.766755 IP 138.197.158.231.ssh > cpe9050ca239d63-cm9050ca239d60.cpe.net.cable.rogers.com.55891: Flags [P.], seq 1029900:1030104, ack 505, win 501, length 204
21:18:19.766812 IP 138.197.158.231.ssh > cpe9050ca239d63-cm9050ca239d60.cpe.net.cable.rogers.com.55891: Flags [P.], seq 1030104:1030308, ack 505, win 501, length 204
21:18:19.766866 IP 138.197.158.231.ssh > cpe9050ca239d63-cm9050ca239d60.cpe.net.cable.rogers.com.55891: Flags [P.], seq 1030308:1030512, ack 505, win 501, length 204
21:18:19.766954 IP 138.197.158.231.ssh > cpe9050ca239d63-cm9050ca239d60.cpe.net.cable.rogers.com.55891: Flags [P.], seq 1030512:1030716, ack 505, win 501, length 204
21:18:19.767020 IP 138.197.158.231.ssh > cpe9050ca239d63-cm9050ca239d60.cpe.net.cable.rogers.com.55891: Flags [P.], seq 1030716:1030920, ack 505, win 501, length 204
21:18:19.767074 IP 138.197.158.231.ssh > cpe9050ca239d63-cm9050ca239d60.cpe.net.cable.rogers.com.55891: Flags [P.], seq 1030920:1031124, ack 505, win 501, length 204
21:18:19.767128 IP 138.197.158.231.ssh > cpe9050ca239d63-cm9050ca239d60.cpe.net.cable.rogers.com.55891: Flags [P.], seq 1031124:1031328, ack 505, win 501, length 204
21:18:19.767181 IP 138.197.158.231.ssh > cpe9050ca239d63-cm9050ca239d60.cpe.net.cable.rogers.com.55891: Flags [P.], seq 1031328:1031532, ack 505, win 501, length 204
21:18:19.767233 IP 138.197.158.231.ssh > cpe9050ca239d63-cm9050ca239d60.cpe.net.cable.rogers.com.55891: Flags [P.], seq 1031532:1031736, ack 505, win 501, length 204
21:18:19.767309 IP 138.197.158.231.ssh > cpe9050ca239d63-cm9050ca239d60.cpe.net.cable.rogers.com.55891: Flags [P.], seq 1031736:1031940, ack 505, win 501, length 204
21:18:19.767363 IP 138.197.158.231.ssh > cpe9050ca239d63-cm9050ca239d60.cpe.net.cable.rogers.com.55891: Flags [P.], seq 1031940:1032144, ack 505, win 501, length 204
21:18:19.767418 IP 138.197.158.231.ssh > cpe9050ca239d63-cm9050ca239d60.cpe.net.cable.rogers.com.55891: Flags [P.], seq 1032144:1032348, ack 505, win 501, length 204
21:18:19.767471 IP 138.197.158.231.ssh > cpe9050ca239d63-cm9050ca239d60.cpe.net.cable.rogers.com.55891: Flags [P.], seq 1032348:1032552, ack 505, win 501, length 204
21:18:19.767523 IP 138.197.158.231.ssh > cpe9050ca239d63-cm9050ca239d60.cpe.net.cable.rogers.com.55891: Flags [P.], seq 1032552:1032756, ack 505, win 501, length 204
21:18:19.767581 IP 138.197.158.231.ssh > cpe9050ca239d63-cm9050ca239d60.cpe.net.cable.rogers.com.55891: Flags [P.], seq 1032756:1032960, ack 505, win 501, length 204
21:18:19.767636 IP 138.197.158.231.ssh > cpe9050ca239d63-cm9050ca239d60.cpe.net.cable.rogers.com.55891: Flags [P.], seq 1032960:1033164, ack 505, win 501, length 204
21:18:19.767732 IP 138.197.158.231.ssh > cpe9050ca239d63-cm9050ca239d60.cpe.net.cable.rogers.com.55891: Flags [P.], seq 1033164:1033368, ack 505, win 501, length 204
21:18:19.767806 IP 138.197.158.231.ssh > cpe9050ca239d63-cm9050ca239d60.cpe.net.cable.rogers.com.55891: Flags [P.], seq 1033368:1033572, ack 505, win 501, length 204
21:18:19.767867 IP 138.197.158.231.ssh > cpe9050ca239d63-cm9050ca239d60.cpe.net.cable.rogers.com.55891: Flags [P.], seq 1033572:1033776, ack 505, win 501, length 204
21:18:19.767923 IP 138.197.158.231.ssh > cpe9050ca239d63-cm9050ca239d60.cpe.net.cable.rogers.com.55891: Flags [P.], seq 1033776:1033980, ack 505, win 501, length 204
21:18:19.767979 IP 138.197.158.231.ssh > cpe9050ca239d63-cm9050ca239d60.cpe.net.cable.rogers.com.55891: Flags [P.], seq 1033980:1034184, ack 505, win 501, length 204
21:18:19.768034 IP 138.197.158.231.ssh > cpe9050ca239d63-cm9050ca239d60.cpe.net.cable.rogers.com.55891: Flags [P.], seq 1034184:1034388, ack 505, win 501, length 204
21:18:19.768097 IP 138.197.158.231.ssh > cpe9050ca239d63-cm9050ca239d60.cpe.net.cable.rogers.com.55891: Flags [P.], seq 1034388:1034592, ack 505, win 501, length 204
21:18:19.768154 IP 138.197.158.231.ssh > cpe9050ca239d63-cm9050ca239d60.cpe.net.cable.rogers.com.55891: Flags [P.], seq 1034592:1034796, ack 505, win 501, length 204
21:18:19.768211 IP 138.197.158.231.ssh > cpe9050ca239d63-cm9050ca239d60.cpe.net.cable.rogers.com.55891: Flags [P.], seq 1034796:1035000, ack 505, win 501, length 204
21:18:19.768265 IP 138.197.158.231.ssh > cpe9050ca239d63-cm9050ca239d60.cpe.net.cable.rogers.com.55891: Flags [P.], seq 1035000:1035204, ack 505, win 501, length 204
21:18:19.768319 IP 138.197.158.231.ssh > cpe9050ca239d63-cm9050ca239d60.cpe.net.cable.rogers.com.55891: Flags [P.], seq 1035204:1035408, ack 505, win 501, length 204
21:18:19.768376 IP 138.197.158.231.ssh > cpe9050ca239d63-cm9050ca239d60.cpe.net.cable.rogers.com.55891: Flags [P.], seq 1035408:1035612, ack 505, win 501, length 204
21:18:19.768430 IP 138.197.158.231.ssh > cpe9050ca239d63-cm9050ca239d60.cpe.net.cable.rogers.com.55891: Flags [P.], seq 1035612:1035816, ack 505, win 501, length 204
21:18:19.768482 IP 138.197.158.231.ssh > cpe9050ca239d63-cm9050ca239d60.cpe.net.cable.rogers.com.55891: Flags [P.], seq 1035816:1036020, ack 505, win 501, length 204
21:18:19.768539 IP 138.197.158.231.ssh > cpe9050ca239d63-cm9050ca239d60.cpe.net.cable.rogers.com.55891: Flags [P.], seq 1036020:1036224, ack 505, win 501, length 204
21:18:19.768593 IP 138.197.158.231.ssh > cpe9050ca239d63-cm9050ca239d60.cpe.net.cable.rogers.com.55891: Flags [P.], seq 1036224:1036428, ack 505, win 501, length 204
21:18:19.768650 IP 138.197.158.231.ssh > cpe9050ca239d63-cm9050ca239d60.cpe.net.cable.rogers.com.55891: Flags [P.], seq 1036428:1036632, ack 505, win 501, length 204
21:18:19.768710 IP 138.197.158.231.ssh > cpe9050ca239d63-cm9050ca239d60.cpe.net.cable.rogers.com.55891: Flags [P.], seq 1036632:1036836, ack 505, win 501, length 204
21:18:19.768768 IP 138.197.158.231.ssh > cpe9050ca239d63-cm9050ca239d60.cpe.net.cable.rogers.com.55891: Flags [P.], seq 1036836:1037040, ack 505, win 501, length 204
21:18:19.768830 IP 138.197.158.231.ssh > cpe9050ca239d63-cm9050ca239d60.cpe.net.cable.rogers.com.55891: Flags [P.], seq 1037040:1037244, ack 505, win 501, length 204
21:18:19.768905 IP 138.197.158.231.ssh > cpe9050ca239d63-cm9050ca239d60.cpe.net.cable.rogers.com.55891: Flags [P.], seq 1037244:1037448, ack 505, win 501, length 204
21:18:19.768960 IP 138.197.158.231.ssh > cpe9050ca239d63-cm9050ca239d60.cpe.net.cable.rogers.com.55891: Flags [P.], seq 1037448:1037652, ack 505, win 501, length 204
21:18:19.769013 IP 138.197.158.231.ssh > cpe9050ca239d63-cm9050ca239d60.cpe.net.cable.rogers.com.55891: Flags [P.], seq 1037652:1037856, ack 505, win 501, length 204
21:18:19.769070 IP 138.197.158.231.ssh > cpe9050ca239d63-cm9050ca239d60.cpe.net.cable.rogers.com.55891: Flags [P.], seq 1037856:1038060, ack 505, win 501, length 204
21:18:19.769122 IP 138.197.158.231.ssh > cpe9050ca239d63-cm9050ca239d60.cpe.net.cable.rogers.com.55891: Flags [P.], seq 1038060:1038264, ack 505, win 501, length 204
21:18:19.769186 IP 138.197.158.231.ssh > cpe9050ca239d63-cm9050ca239d60.cpe.net.cable.rogers.com.55891: Flags [P.], seq 1038264:1038468, ack 505, win 501, length 204
21:18:19.769242 IP 138.197.158.231.ssh > cpe9050ca239d63-cm9050ca239d60.cpe.net.cable.rogers.com.55891: Flags [P.], seq 1038468:1038672, ack 505, win 501, length 204
21:18:19.769298 IP 138.197.158.231.ssh > cpe9050ca239d63-cm9050ca239d60.cpe.net.cable.rogers.com.55891: Flags [P.], seq 1038672:1038876, ack 505, win 501, length 204
21:18:19.769354 IP 138.197.158.231.ssh > cpe9050ca239d63-cm9050ca239d60.cpe.net.cable.rogers.com.55891: Flags [P.], seq 1038876:1039080, ack 505, win 501, length 204
21:18:19.769410 IP 138.197.158.231.ssh > cpe9050ca239d63-cm9050ca239d60.cpe.net.cable.rogers.com.55891: Flags [P.], seq 1039080:1039284, ack 505, win 501, length 204
21:18:19.769464 IP 138.197.158.231.ssh > cpe9050ca239d63-cm9050ca239d60.cpe.net.cable.rogers.com.55891: Flags [P.], seq 1039284:1039488, ack 505, win 501, length 204
21:18:19.769518 IP 138.197.158.231.ssh > cpe9050ca239d63-cm9050ca239d60.cpe.net.cable.rogers.com.55891: Flags [P.], seq 1039488:1039692, ack 505, win 501, length 204
21:18:19.769578 IP 138.197.158.231.ssh > cpe9050ca239d63-cm9050ca239d60.cpe.net.cable.rogers.com.55891: Flags [P.], seq 1039692:1039896, ack 505, win 501, length 204
21:18:19.769630 IP 138.197.158.231.ssh > cpe9050ca239d63-cm9050ca239d60.cpe.net.cable.rogers.com.55891: Flags [P.], seq 1039896:1040100, ack 505, win 501, length 204
21:18:19.769685 IP 138.197.158.231.ssh > cpe9050ca239d63-cm9050ca239d60.cpe.net.cable.rogers.com.55891: Flags [P.], seq 1040100:1040304, ack 505, win 501, length 204
21:18:19.769741 IP 138.197.158.231.ssh > cpe9050ca239d63-cm9050ca239d60.cpe.net.cable.rogers.com.55891: Flags [P.], seq 1040304:1040508, ack 505, win 501, length 204
21:18:19.769794 IP 138.197.158.231.ssh > cpe9050ca239d63-cm9050ca239d60.cpe.net.cable.rogers.com.55891: Flags [P.], seq 1040508:1040712, ack 505, win 501, length 204
21:18:19.769852 IP 138.197.158.231.ssh > cpe9050ca239d63-cm9050ca239d60.cpe.net.cable.rogers.com.55891: Flags [P.], seq 1040712:1040916, ack 505, win 501, length 204
21:18:19.769907 IP 138.197.158.231.ssh > cpe9050ca239d63-cm9050ca239d60.cpe.net.cable.rogers.com.55891: Flags [P.], seq 1040916:1041120, ack 505, win 501, length 204
21:18:19.770047 IP 138.197.158.231.ssh > cpe9050ca239d63-cm9050ca239d60.cpe.net.cable.rogers.com.55891: Flags [P.], seq 1041120:1041324, ack 505, win 501, length 204
21:18:19.770168 IP 138.197.158.231.ssh > cpe9050ca239d63-cm9050ca239d60.cpe.net.cable.rogers.com.55891: Flags [P.], seq 1041324:1041528, ack 505, win 501, length 204
21:18:19.770236 IP 138.197.158.231.ssh > cpe9050ca239d63-cm9050ca239d60.cpe.net.cable.rogers.com.55891: Flags [P.], seq 1041528:1041732, ack 505, win 501, length 204
21:18:19.770296 IP 138.197.158.231.ssh > cpe9050ca239d63-cm9050ca239d60.cpe.net.cable.rogers.com.55891: Flags [P.], seq 1041732:1041936, ack 505, win 501, length 204
21:18:19.770356 IP 138.197.158.231.ssh > cpe9050ca239d63-cm9050ca239d60.cpe.net.cable.rogers.com.55891: Flags [P.], seq 1041936:1042140, ack 505, win 501, length 204
21:18:19.770412 IP 138.197.158.231.ssh > cpe9050ca239d63-cm9050ca239d60.cpe.net.cable.rogers.com.55891: Flags [P.], seq 1042140:1042344, ack 505, win 501, length 204
21:18:19.770481 IP 138.197.158.231.ssh > cpe9050ca239d63-cm9050ca239d60.cpe.net.cable.rogers.com.55891: Flags [P.], seq 1042344:1042548, ack 505, win 501, length 204
21:18:19.770564 IP 138.197.158.231.ssh > cpe9050ca239d63-cm9050ca239d60.cpe.net.cable.rogers.com.55891: Flags [P.], seq 1042548:1042752, ack 505, win 501, length 204
21:18:19.770633 IP 138.197.158.231.ssh > cpe9050ca239d63-cm9050ca239d60.cpe.net.cable.rogers.com.55891: Flags [P.], seq 1042752:1042956, ack 505, win 501, length 204
21:18:19.770714 IP 138.197.158.231.ssh > cpe9050ca239d63-cm9050ca239d60.cpe.net.cable.rogers.com.55891: Flags [P.], seq 1042956:1043160, ack 505, win 501, length 204
21:18:19.770787 IP 138.197.158.231.ssh > cpe9050ca239d63-cm9050ca239d60.cpe.net.cable.rogers.com.55891: Flags [P.], seq 1043160:1043364, ack 505, win 501, length 204
21:18:19.770857 IP 138.197.158.231.ssh > cpe9050ca239d63-cm9050ca239d60.cpe.net.cable.rogers.com.55891: Flags [P.], seq 1043364:1043568, ack 505, win 501, length 204
21:18:19.770930 IP 138.197.158.231.ssh > cpe9050ca239d63-cm9050ca239d60.cpe.net.cable.rogers.com.55891: Flags [P.], seq 1043568:1043772, ack 505, win 501, length 204
21:18:19.770994 IP 138.197.158.231.ssh > cpe9050ca239d63-cm9050ca239d60.cpe.net.cable.rogers.com.55891: Flags [P.], seq 1043772:1043976, ack 505, win 501, length 204
21:18:19.771069 IP 138.197.158.231.ssh > cpe9050ca239d63-cm9050ca239d60.cpe.net.cable.rogers.com.55891: Flags [P.], seq 1043976:1044180, ack 505, win 501, length 204
21:18:19.771853 IP 138.197.158.231.ssh > cpe9050ca239d63-cm9050ca239d60.cpe.net.cable.rogers.com.55891: Flags [P.], seq 1044180:1044384, ack 505, win 501, length 204
21:18:19.772118 IP 138.197.158.231.ssh > cpe9050ca239d63-cm9050ca239d60.cpe.net.cable.rogers.com.55891: Flags [P.], seq 1044384:1044588, ack 541, win 501, length 204
21:18:19.772184 IP 138.197.158.231.ssh > cpe9050ca239d63-cm9050ca239d60.cpe.net.cable.rogers.com.55891: Flags [P.], seq 1044588:1044792, ack 541, win 501, length 204
21:18:19.772246 IP 138.197.158.231.ssh > cpe9050ca239d63-cm9050ca239d60.cpe.net.cable.rogers.com.55891: Flags [P.], seq 1044792:1044996, ack 541, win 501, length 204
21:18:19.772302 IP 138.197.158.231.ssh > cpe9050ca239d63-cm9050ca239d60.cpe.net.cable.rogers.com.55891: Flags [P.], seq 1044996:1045200, ack 541, win 501, length 204
21:18:19.772368 IP 138.197.158.231.ssh > cpe9050ca239d63-cm9050ca239d60.cpe.net.cable.rogers.com.55891: Flags [P.], seq 1045200:1045404, ack 541, win 501, length 204
21:18:19.772420 IP 138.197.158.231.ssh > cpe9050ca239d63-cm9050ca239d60.cpe.net.cable.rogers.com.55891: Flags [P.], seq 1045404:1045608, ack 541, win 501, length 204
21:18:19.772492 IP 138.197.158.231.ssh > cpe9050ca239d63-cm9050ca239d60.cpe.net.cable.rogers.com.55891: Flags [P.], seq 1045608:1045812, ack 541, win 501, length 204
21:18:19.772580 IP 138.197.158.231.ssh > cpe9050ca239d63-cm9050ca239d60.cpe.net.cable.rogers.com.55891: Flags [P.], seq 1045812:1046016, ack 541, win 501, length 204
21:18:19.772639 IP 138.197.158.231.ssh > cpe9050ca239d63-cm9050ca239d60.cpe.net.cable.rogers.com.55891: Flags [P.], seq 1046016:1046220, ack 541, win 501, length 204
21:18:19.772697 IP 138.197.158.231.ssh > cpe9050ca239d63-cm9050ca239d60.cpe.net.cable.rogers.com.55891: Flags [P.], seq 1046220:1046424, ack 541, win 501, length 204
21:18:19.772754 IP 138.197.158.231.ssh > cpe9050ca239d63-cm9050ca239d60.cpe.net.cable.rogers.com.55891: Flags [P.], seq 1046424:1046628, ack 541, win 501, length 204
21:18:19.772822 IP 138.197.158.231.ssh > cpe9050ca239d63-cm9050ca239d60.cpe.net.cable.rogers.com.55891: Flags [P.], seq 1046628:1046832, ack 541, win 501, length 204
21:18:19.772892 IP 138.197.158.231.ssh > cpe9050ca239d63-cm9050ca239d60.cpe.net.cable.rogers.com.55891: Flags [P.], seq 1046832:1047036, ack 541, win 501, length 204
21:18:19.773002 IP 138.197.158.231.ssh > cpe9050ca239d63-cm9050ca239d60.cpe.net.cable.rogers.com.55891: Flags [P.], seq 1047036:1047240, ack 541, win 501, length 204
21:18:19.773077 IP 138.197.158.231.ssh > cpe9050ca239d63-cm9050ca239d60.cpe.net.cable.rogers.com.55891: Flags [P.], seq 1047240:1047444, ack 541, win 501, length 204
21:18:19.773136 IP 138.197.158.231.ssh > cpe9050ca239d63-cm9050ca239d60.cpe.net.cable.rogers.com.55891: Flags [P.], seq 1047444:1047648, ack 541, win 501, length 204
21:18:19.773191 IP 138.197.158.231.ssh > cpe9050ca239d63-cm9050ca239d60.cpe.net.cable.rogers.com.55891: Flags [P.], seq 1047648:1047852, ack 541, win 501, length 204
21:18:19.773243 IP 138.197.158.231.ssh > cpe9050ca239d63-cm9050ca239d60.cpe.net.cable.rogers.com.55891: Flags [P.], seq 1047852:1048056, ack 541, win 501, length 204
21:18:19.773296 IP 138.197.158.231.ssh > cpe9050ca239d63-cm9050ca239d60.cpe.net.cable.rogers.com.55891: Flags [P.], seq 1048056:1048260, ack 541, win 501, length 204
21:18:19.773361 IP 138.197.158.231.ssh > cpe9050ca239d63-cm9050ca239d60.cpe.net.cable.rogers.com.55891: Flags [P.], seq 1048260:1048464, ack 541, win 501, length 204
21:18:19.773415 IP 138.197.158.231.ssh > cpe9050ca239d63-cm9050ca239d60.cpe.net.cable.rogers.com.55891: Flags [P.], seq 1048464:1048668, ack 541, win 501, length 204
21:18:19.773470 IP 138.197.158.231.ssh > cpe9050ca239d63-cm9050ca239d60.cpe.net.cable.rogers.com.55891: Flags [P.], seq 1048668:1048872, ack 541, win 501, length 204
21:18:19.773526 IP 138.197.158.231.ssh > cpe9050ca239d63-cm9050ca239d60.cpe.net.cable.rogers.com.55891: Flags [P.], seq 1048872:1049076, ack 541, win 501, length 204
21:18:19.773579 IP 138.197.158.231.ssh > cpe9050ca239d63-cm9050ca239d60.cpe.net.cable.rogers.com.55891: Flags [P.], seq 1049076:1049280, ack 541, win 501, length 204
21:18:19.773634 IP 138.197.158.231.ssh > cpe9050ca239d63-cm9050ca239d60.cpe.net.cable.rogers.com.55891: Flags [P.], seq 1049280:1049484, ack 541, win 501, length 204
21:18:19.773686 IP 138.197.158.231.ssh > cpe9050ca239d63-cm9050ca239d60.cpe.net.cable.rogers.com.55891: Flags [P.], seq 1049484:1049688, ack 541, win 501, length 204
21:18:19.773740 IP 138.197.158.231.ssh > cpe9050ca239d63-cm9050ca239d60.cpe.net.cable.rogers.com.55891: Flags [P.], seq 1049688:1049892, ack 541, win 501, length 204
21:18:19.773793 IP 138.197.158.231.ssh > cpe9050ca239d63-cm9050ca239d60.cpe.net.cable.rogers.com.55891: Flags [P.], seq 1049892:1050096, ack 541, win 501, length 204
21:18:19.773855 IP 138.197.158.231.ssh > cpe9050ca239d63-cm9050ca239d60.cpe.net.cable.rogers.com.55891: Flags [P.], seq 1050096:1050300, ack 541, win 501, length 204
21:18:19.773923 IP 138.197.158.231.ssh > cpe9050ca239d63-cm9050ca239d60.cpe.net.cable.rogers.com.55891: Flags [P.], seq 1050300:1050504, ack 541, win 501, length 204
21:18:19.773981 IP 138.197.158.231.ssh > cpe9050ca239d63-cm9050ca239d60.cpe.net.cable.rogers.com.55891: Flags [P.], seq 1050504:1050708, ack 541, win 501, length 204
21:18:19.774047 IP 138.197.158.231.ssh > cpe9050ca239d63-cm9050ca239d60.cpe.net.cable.rogers.com.55891: Flags [P.], seq 1050708:1050912, ack 541, win 501, length 204
21:18:19.774103 IP 138.197.158.231.ssh > cpe9050ca239d63-cm9050ca239d60.cpe.net.cable.rogers.com.55891: Flags [P.], seq 1050912:1051116, ack 541, win 501, length 204
21:18:19.774155 IP 138.197.158.231.ssh > cpe9050ca239d63-cm9050ca239d60.cpe.net.cable.rogers.com.55891: Flags [P.], seq 1051116:1051320, ack 541, win 501, length 204
21:18:19.774207 IP 138.197.158.231.ssh > cpe9050ca239d63-cm9050ca239d60.cpe.net.cable.rogers.com.55891: Flags [P.], seq 1051320:1051524, ack 541, win 501, length 204
21:18:19.774264 IP 138.197.158.231.ssh > cpe9050ca239d63-cm9050ca239d60.cpe.net.cable.rogers.com.55891: Flags [P.], seq 1051524:1051728, ack 541, win 501, length 204
21:18:19.774317 IP 138.197.158.231.ssh > cpe9050ca239d63-cm9050ca239d60.cpe.net.cable.rogers.com.55891: Flags [P.], seq 1051728:1051932, ack 541, win 501, length 204
21:18:19.774370 IP 138.197.158.231.ssh > cpe9050ca239d63-cm9050ca239d60.cpe.net.cable.rogers.com.55891: Flags [P.], seq 1051932:1052136, ack 541, win 501, length 204
21:18:19.774428 IP 138.197.158.231.ssh > cpe9050ca239d63-cm9050ca239d60.cpe.net.cable.rogers.com.55891: Flags [P.], seq 1052136:1052340, ack 541, win 501, length 204
21:18:19.774480 IP 138.197.158.231.ssh > cpe9050ca239d63-cm9050ca239d60.cpe.net.cable.rogers.com.55891: Flags [P.], seq 1052340:1052544, ack 541, win 501, length 204
21:18:19.774532 IP 138.197.158.231.ssh > cpe9050ca239d63-cm9050ca239d60.cpe.net.cable.rogers.com.55891: Flags [P.], seq 1052544:1052748, ack 541, win 501, length 204
21:18:19.774591 IP 138.197.158.231.ssh > cpe9050ca239d63-cm9050ca239d60.cpe.net.cable.rogers.com.55891: Flags [P.], seq 1052748:1052952, ack 541, win 501, length 204
21:18:19.774645 IP 138.197.158.231.ssh > cpe9050ca239d63-cm9050ca239d60.cpe.net.cable.rogers.com.55891: Flags [P.], seq 1052952:1053156, ack 541, win 501, length 204
21:18:19.774700 IP 138.197.158.231.ssh > cpe9050ca239d63-cm9050ca239d60.cpe.net.cable.rogers.com.55891: Flags [P.], seq 1053156:1053360, ack 541, win 501, length 204
21:18:19.774755 IP 138.197.158.231.ssh > cpe9050ca239d63-cm9050ca239d60.cpe.net.cable.rogers.com.55891: Flags [P.], seq 1053360:1053564, ack 541, win 501, length 204
21:18:19.774810 IP 138.197.158.231.ssh > cpe9050ca239d63-cm9050ca239d60.cpe.net.cable.rogers.com.55891: Flags [P.], seq 1053564:1053768, ack 541, win 501, length 204
21:18:19.774864 IP 138.197.158.231.ssh > cpe9050ca239d63-cm9050ca239d60.cpe.net.cable.rogers.com.55891: Flags [P.], seq 1053768:1053972, ack 541, win 501, length 204
21:18:19.774960 IP 138.197.158.231.ssh > cpe9050ca239d63-cm9050ca239d60.cpe.net.cable.rogers.com.55891: Flags [P.], seq 1053972:1054176, ack 541, win 501, length 204
21:18:19.775043 IP 138.197.158.231.ssh > cpe9050ca239d63-cm9050ca239d60.cpe.net.cable.rogers.com.55891: Flags [P.], seq 1054176:1054380, ack 541, win 501, length 204
21:18:19.775105 IP 138.197.158.231.ssh > cpe9050ca239d63-cm9050ca239d60.cpe.net.cable.rogers.com.55891: Flags [P.], seq 1054380:1054584, ack 541, win 501, length 204
21:18:19.775160 IP 138.197.158.231.ssh > cpe9050ca239d63-cm9050ca239d60.cpe.net.cable.rogers.com.55891: Flags [P.], seq 1054584:1054788, ack 541, win 501, length 204
21:18:19.775212 IP 138.197.158.231.ssh > cpe9050ca239d63-cm9050ca239d60.cpe.net.cable.rogers.com.55891: Flags [P.], seq 1054788:1054992, ack 541, win 501, length 204
21:18:19.775294 IP 138.197.158.231.ssh > cpe9050ca239d63-cm9050ca239d60.cpe.net.cable.rogers.com.55891: Flags [P.], seq 1054992:1055196, ack 541, win 501, length 204
21:18:19.775352 IP 138.197.158.231.ssh > cpe9050ca239d63-cm9050ca239d60.cpe.net.cable.rogers.com.55891: Flags [P.], seq 1055196:1055400, ack 541, win 501, length 204
21:18:19.775406 IP 138.197.158.231.ssh > cpe9050ca239d63-cm9050ca239d60.cpe.net.cable.rogers.com.55891: Flags [P.], seq 1055400:1055604, ack 541, win 501, length 204
21:18:19.775496 IP 138.197.158.231.ssh > cpe9050ca239d63-cm9050ca239d60.cpe.net.cable.rogers.com.55891: Flags [P.], seq 1055604:1055808, ack 541, win 501, length 204
21:18:19.775596 IP 138.197.158.231.ssh > cpe9050ca239d63-cm9050ca239d60.cpe.net.cable.rogers.com.55891: Flags [P.], seq 1055808:1056012, ack 541, win 501, length 204
21:18:19.775667 IP 138.197.158.231.ssh > cpe9050ca239d63-cm9050ca239d60.cpe.net.cable.rogers.com.55891: Flags [P.], seq 1056012:1056216, ack 541, win 501, length 204
21:18:19.775749 IP 138.197.158.231.ssh > cpe9050ca239d63-cm9050ca239d60.cpe.net.cable.rogers.com.55891: Flags [P.], seq 1056216:1056420, ack 541, win 501, length 204
21:18:19.775813 IP 138.197.158.231.ssh > cpe9050ca239d63-cm9050ca239d60.cpe.net.cable.rogers.com.55891: Flags [P.], seq 1056420:1056624, ack 541, win 501, length 204
21:18:19.775870 IP 138.197.158.231.ssh > cpe9050ca239d63-cm9050ca239d60.cpe.net.cable.rogers.com.55891: Flags [P.], seq 1056624:1056828, ack 541, win 501, length 204
21:18:19.775949 IP 138.197.158.231.ssh > cpe9050ca239d63-cm9050ca239d60.cpe.net.cable.rogers.com.55891: Flags [P.], seq 1056828:1057032, ack 541, win 501, length 204
21:18:19.776034 IP 138.197.158.231.ssh > cpe9050ca239d63-cm9050ca239d60.cpe.net.cable.rogers.com.55891: Flags [P.], seq 1057032:1057236, ack 541, win 501, length 204
21:18:19.776109 IP 138.197.158.231.ssh > cpe9050ca239d63-cm9050ca239d60.cpe.net.cable.rogers.com.55891: Flags [P.], seq 1057236:1057440, ack 541, win 501, length 204
21:18:19.776164 IP 138.197.158.231.ssh > cpe9050ca239d63-cm9050ca239d60.cpe.net.cable.rogers.com.55891: Flags [P.], seq 1057440:1057644, ack 541, win 501, length 204
21:18:19.776217 IP 138.197.158.231.ssh > cpe9050ca239d63-cm9050ca239d60.cpe.net.cable.rogers.com.55891: Flags [P.], seq 1057644:1057848, ack 541, win 501, length 204
21:18:19.776273 IP 138.197.158.231.ssh > cpe9050ca239d63-cm9050ca239d60.cpe.net.cable.rogers.com.55891: Flags [P.], seq 1057848:1058052, ack 541, win 501, length 204
21:18:19.776327 IP 138.197.158.231.ssh > cpe9050ca239d63-cm9050ca239d60.cpe.net.cable.rogers.com.55891: Flags [P.], seq 1058052:1058256, ack 541, win 501, length 204
21:18:19.776380 IP 138.197.158.231.ssh > cpe9050ca239d63-cm9050ca239d60.cpe.net.cable.rogers.com.55891: Flags [P.], seq 1058256:1058460, ack 541, win 501, length 204
21:18:19.776437 IP 138.197.158.231.ssh > cpe9050ca239d63-cm9050ca239d60.cpe.net.cable.rogers.com.55891: Flags [P.], seq 1058460:1058664, ack 541, win 501, length 204
21:18:19.776515 IP 138.197.158.231.ssh > cpe9050ca239d63-cm9050ca239d60.cpe.net.cable.rogers.com.55891: Flags [P.], seq 1058664:1058868, ack 541, win 501, length 204
21:18:19.776607 IP 138.197.158.231.ssh > cpe9050ca239d63-cm9050ca239d60.cpe.net.cable.rogers.com.55891: Flags [P.], seq 1058868:1059072, ack 541, win 501, length 204
21:18:19.776699 IP 138.197.158.231.ssh > cpe9050ca239d63-cm9050ca239d60.cpe.net.cable.rogers.com.55891: Flags [P.], seq 1059072:1059276, ack 541, win 501, length 204
21:18:19.776937 IP 138.197.158.231.ssh > cpe9050ca239d63-cm9050ca239d60.cpe.net.cable.rogers.com.55891: Flags [P.], seq 1059276:1059480, ack 541, win 501, length 204
21:18:19.777035 IP 138.197.158.231.ssh > cpe9050ca239d63-cm9050ca239d60.cpe.net.cable.rogers.com.55891: Flags [P.], seq 1059480:1059684, ack 541, win 501, length 204
21:18:19.777095 IP 138.197.158.231.ssh > cpe9050ca239d63-cm9050ca239d60.cpe.net.cable.rogers.com.55891: Flags [P.], seq 1059684:1059888, ack 541, win 501, length 204
21:18:19.777149 IP 138.197.158.231.ssh > cpe9050ca239d63-cm9050ca239d60.cpe.net.cable.rogers.com.55891: Flags [P.], seq 1059888:1060092, ack 541, win 501, length 204
21:18:19.777202 IP 138.197.158.231.ssh > cpe9050ca239d63-cm9050ca239d60.cpe.net.cable.rogers.com.55891: Flags [P.], seq 1060092:1060296, ack 541, win 501, length 204
21:18:19.777255 IP 138.197.158.231.ssh > cpe9050ca239d63-cm9050ca239d60.cpe.net.cable.rogers.com.55891: Flags [P.], seq 1060296:1060500, ack 541, win 501, length 204
21:18:19.777308 IP 138.197.158.231.ssh > cpe9050ca239d63-cm9050ca239d60.cpe.net.cable.rogers.com.55891: Flags [P.], seq 1060500:1060704, ack 541, win 501, length 204
21:18:19.777361 IP 138.197.158.231.ssh > cpe9050ca239d63-cm9050ca239d60.cpe.net.cable.rogers.com.55891: Flags [P.], seq 1060704:1060908, ack 541, win 501, length 204
21:18:19.777418 IP 138.197.158.231.ssh > cpe9050ca239d63-cm9050ca239d60.cpe.net.cable.rogers.com.55891: Flags [P.], seq 1060908:1061112, ack 541, win 501, length 204
21:18:19.777472 IP 138.197.158.231.ssh > cpe9050ca239d63-cm9050ca239d60.cpe.net.cable.rogers.com.55891: Flags [P.], seq 1061112:1061316, ack 541, win 501, length 204
21:18:19.777525 IP 138.197.158.231.ssh > cpe9050ca239d63-cm9050ca239d60.cpe.net.cable.rogers.com.55891: Flags [P.], seq 1061316:1061520, ack 541, win 501, length 204
21:18:19.777580 IP 138.197.158.231.ssh > cpe9050ca239d63-cm9050ca239d60.cpe.net.cable.rogers.com.55891: Flags [P.], seq 1061520:1061724, ack 541, win 501, length 204
21:18:19.777634 IP 138.197.158.231.ssh > cpe9050ca239d63-cm9050ca239d60.cpe.net.cable.rogers.com.55891: Flags [P.], seq 1061724:1061928, ack 541, win 501, length 204
21:18:19.777687 IP 138.197.158.231.ssh > cpe9050ca239d63-cm9050ca239d60.cpe.net.cable.rogers.com.55891: Flags [P.], seq 1061928:1062132, ack 541, win 501, length 204
21:18:19.777745 IP 138.197.158.231.ssh > cpe9050ca239d63-cm9050ca239d60.cpe.net.cable.rogers.com.55891: Flags [P.], seq 1062132:1062336, ack 541, win 501, length 204
21:18:19.777799 IP 138.197.158.231.ssh > cpe9050ca239d63-cm9050ca239d60.cpe.net.cable.rogers.com.55891: Flags [P.], seq 1062336:1062540, ack 541, win 501, length 204
21:18:19.777866 IP 138.197.158.231.ssh > cpe9050ca239d63-cm9050ca239d60.cpe.net.cable.rogers.com.55891: Flags [P.], seq 1062540:1062744, ack 541, win 501, length 204
21:18:19.777922 IP 138.197.158.231.ssh > cpe9050ca239d63-cm9050ca239d60.cpe.net.cable.rogers.com.55891: Flags [P.], seq 1062744:1062948, ack 541, win 501, length 204
21:18:19.777976 IP 138.197.158.231.ssh > cpe9050ca239d63-cm9050ca239d60.cpe.net.cable.rogers.com.55891: Flags [P.], seq 1062948:1063152, ack 541, win 501, length 204
21:18:19.778030 IP 138.197.158.231.ssh > cpe9050ca239d63-cm9050ca239d60.cpe.net.cable.rogers.com.55891: Flags [P.], seq 1063152:1063356, ack 541, win 501, length 204
21:18:19.778083 IP 138.197.158.231.ssh > cpe9050ca239d63-cm9050ca239d60.cpe.net.cable.rogers.com.55891: Flags [P.], seq 1063356:1063560, ack 541, win 501, length 204
21:18:19.778139 IP 138.197.158.231.ssh > cpe9050ca239d63-cm9050ca239d60.cpe.net.cable.rogers.com.55891: Flags [P.], seq 1063560:1063764, ack 541, win 501, length 204
21:18:19.778192 IP 138.197.158.231.ssh > cpe9050ca239d63-cm9050ca239d60.cpe.net.cable.rogers.com.55891: Flags [P.], seq 1063764:1063968, ack 541, win 501, length 204
21:18:19.778244 IP 138.197.158.231.ssh > cpe9050ca239d63-cm9050ca239d60.cpe.net.cable.rogers.com.55891: Flags [P.], seq 1063968:1064172, ack 541, win 501, length 204
21:18:19.778300 IP 138.197.158.231.ssh > cpe9050ca239d63-cm9050ca239d60.cpe.net.cable.rogers.com.55891: Flags [P.], seq 1064172:1064376, ack 541, win 501, length 204
21:18:19.778353 IP 138.197.158.231.ssh > cpe9050ca239d63-cm9050ca239d60.cpe.net.cable.rogers.com.55891: Flags [P.], seq 1064376:1064580, ack 541, win 501, length 204
21:18:19.778409 IP 138.197.158.231.ssh > cpe9050ca239d63-cm9050ca239d60.cpe.net.cable.rogers.com.55891: Flags [P.], seq 1064580:1064784, ack 541, win 501, length 204
21:18:19.778463 IP 138.197.158.231.ssh > cpe9050ca239d63-cm9050ca239d60.cpe.net.cable.rogers.com.55891: Flags [P.], seq 1064784:1064988, ack 541, win 501, length 204
21:18:19.778515 IP 138.197.158.231.ssh > cpe9050ca239d63-cm9050ca239d60.cpe.net.cable.rogers.com.55891: Flags [P.], seq 1064988:1065192, ack 541, win 501, length 204
21:18:19.778571 IP 138.197.158.231.ssh > cpe9050ca239d63-cm9050ca239d60.cpe.net.cable.rogers.com.55891: Flags [P.], seq 1065192:1065396, ack 541, win 501, length 204
21:18:19.778624 IP 138.197.158.231.ssh > cpe9050ca239d63-cm9050ca239d60.cpe.net.cable.rogers.com.55891: Flags [P.], seq 1065396:1065600, ack 541, win 501, length 204
21:18:19.778676 IP 138.197.158.231.ssh > cpe9050ca239d63-cm9050ca239d60.cpe.net.cable.rogers.com.55891: Flags [P.], seq 1065600:1065804, ack 541, win 501, length 204
21:18:19.778731 IP 138.197.158.231.ssh > cpe9050ca239d63-cm9050ca239d60.cpe.net.cable.rogers.com.55891: Flags [P.], seq 1065804:1066008, ack 541, win 501, length 204
21:18:19.778786 IP 138.197.158.231.ssh > cpe9050ca239d63-cm9050ca239d60.cpe.net.cable.rogers.com.55891: Flags [P.], seq 1066008:1066212, ack 541, win 501, length 204
