root@lamp-ubuntu-s-1vcpu-1gb-tor1-01:~# tcpdump -i eth0 tcp

 Flags [P.], seq 2710868:2711072, ack 1513, win 501, length 204
21:11:53.663364 IP 138.197.158.231.ssh > cpe9050ca239d63-cm9050ca239d60.cpe.net.cable.rogers.com.55891: Flags [P.], seq 2711072:2711276, ack 1513, win 501, length 204
21:11:53.663420 IP 138.197.158.231.ssh > cpe9050ca239d63-cm9050ca239d60.cpe.net.cable.rogers.com.55891: Flags [P.], seq 2711276:2711480, ack 1513, win 501, length 204
21:11:53.663476 IP 138.197.158.231.ssh > cpe9050ca239d63-cm9050ca239d60.cpe.net.cable.rogers.com.55891: Flags [P.], seq 2711480:2711684, ack 1513, win 501, length 204
21:11:53.663532 IP 138.197.158.231.ssh > cpe9050ca239d63-cm9050ca239d60.cpe.net.cable.rogers.com.55891: Flags [P.], seq 2711684:2711888, ack 1513, win 501, length 204
21:11:53.663592 IP 138.197.158.231.ssh > cpe9050ca239d63-cm9050ca239d60.cpe.net.cable.rogers.com.55891: Flags [P.], seq 2711888:2712092, ack 1513, win 501, length 204
21:11:53.663649 IP 138.197.158.231.ssh > cpe9050ca239d63-cm9050ca239d60.cpe.net.cable.rogers.com.55891: Flags [P.], seq 2712092:2712296, ack 1513, win 501, length 204
21:11:53.663704 IP 138.197.158.231.ssh > cpe9050ca239d63-cm9050ca239d60.cpe.net.cable.rogers.com.55891: Flags [P.], seq 2712296:2712500, ack 1513, win 501, length 204
21:11:53.663768 IP 138.197.158.231.ssh > cpe9050ca239d63-cm9050ca239d60.cpe.net.cable.rogers.com.55891: Flags [P.], seq 2712500:2712704, ack 1513, win 501, length 204
21:11:53.663868 IP 138.197.158.231.ssh > cpe9050ca239d63-cm9050ca239d60.cpe.net.cable.rogers.com.55891: Flags [P.], seq 2712704:2712908, ack 1513, win 501, length 204
21:11:53.663932 IP 138.197.158.231.ssh > cpe9050ca239d63-cm9050ca239d60.cpe.net.cable.rogers.com.55891: Flags [P.], seq 2712908:2713112, ack 1513, win 501, length 204
21:11:53.663987 IP 138.197.158.231.ssh > cpe9050ca239d63-cm9050ca239d60.cpe.net.cable.rogers.com.55891: Flags [P.], seq 2713112:2713316, ack 1513, win 501, length 204
21:11:53.664041 IP 138.197.158.231.ssh > cpe9050ca239d63-cm9050ca239d60.cpe.net.cable.rogers.com.55891: Flags [P.], seq 2713316:2713520, ack 1513, win 501, length 204
21:11:53.664094 IP 138.197.158.231.ssh > cpe9050ca239d63-cm9050ca239d60.cpe.net.cable.rogers.com.55891: Flags [P.], seq 2713520:2713724, ack 1513, win 501, length 204
21:11:53.664149 IP 138.197.158.231.ssh > cpe9050ca239d63-cm9050ca239d60.cpe.net.cable.rogers.com.55891: Flags [P.], seq 2713724:2713928, ack 1513, win 501, length 204
21:11:53.664201 IP 138.197.158.231.ssh > cpe9050ca239d63-cm9050ca239d60.cpe.net.cable.rogers.com.55891: Flags [P.], seq 2713928:2714132, ack 1513, win 501, length 204
21:11:53.664255 IP 138.197.158.231.ssh > cpe9050ca239d63-cm9050ca239d60.cpe.net.cable.rogers.com.55891: Flags [P.], seq 2714132:2714336, ack 1513, win 501, length 204
21:11:53.664307 IP 138.197.158.231.ssh > cpe9050ca239d63-cm9050ca239d60.cpe.net.cable.rogers.com.55891: Flags [P.], seq 2714336:2714540, ack 1513, win 501, length 204
21:11:53.664394 IP 138.197.158.231.ssh > cpe9050ca239d63-cm9050ca239d60.cpe.net.cable.rogers.com.55891: Flags [P.], seq 2714540:2714744, ack 1513, win 501, length 204
21:11:53.664469 IP 138.197.158.231.ssh > cpe9050ca239d63-cm9050ca239d60.cpe.net.cable.rogers.com.55891: Flags [P.], seq 2714744:2714948, ack 1513, win 501, length 204
21:11:53.664531 IP 138.197.158.231.ssh > cpe9050ca239d63-cm9050ca239d60.cpe.net.cable.rogers.com.55891: Flags [P.], seq 2714948:2715152, ack 1513, win 501, length 204
21:11:53.664585 IP 138.197.158.231.ssh > cpe9050ca239d63-cm9050ca239d60.cpe.net.cable.rogers.com.55891: Flags [P.], seq 2715152:2715356, ack 1513, win 501, length 204
21:11:53.664642 IP 138.197.158.231.ssh > cpe9050ca239d63-cm9050ca239d60.cpe.net.cable.rogers.com.55891: Flags [P.], seq 2715356:2715560, ack 1513, win 501, length 204
21:11:53.664695 IP 138.197.158.231.ssh > cpe9050ca239d63-cm9050ca239d60.cpe.net.cable.rogers.com.55891: Flags [P.], seq 2715560:2715764, ack 1513, win 501, length 204
21:11:53.664763 IP 138.197.158.231.ssh > cpe9050ca239d63-cm9050ca239d60.cpe.net.cable.rogers.com.55891: Flags [P.], seq 2715764:2715968, ack 1513, win 501, length 204
21:11:53.664818 IP 138.197.158.231.ssh > cpe9050ca239d63-cm9050ca239d60.cpe.net.cable.rogers.com.55891: Flags [P.], seq 2715968:2716172, ack 1513, win 501, length 204
21:11:53.664874 IP 138.197.158.231.ssh > cpe9050ca239d63-cm9050ca239d60.cpe.net.cable.rogers.com.55891: Flags [P.], seq 2716172:2716376, ack 1513, win 501, length 204
21:11:53.664930 IP 138.197.158.231.ssh > cpe9050ca239d63-cm9050ca239d60.cpe.net.cable.rogers.com.55891: Flags [P.], seq 2716376:2716580, ack 1513, win 501, length 204
21:11:53.664988 IP 138.197.158.231.ssh > cpe9050ca239d63-cm9050ca239d60.cpe.net.cable.rogers.com.55891: Flags [P.], seq 2716580:2716784, ack 1513, win 501, length 204
21:11:53.665045 IP 138.197.158.231.ssh > cpe9050ca239d63-cm9050ca239d60.cpe.net.cable.rogers.com.55891: Flags [P.], seq 2716784:2716988, ack 1513, win 501, length 204
21:11:53.665097 IP 138.197.158.231.ssh > cpe9050ca239d63-cm9050ca239d60.cpe.net.cable.rogers.com.55891: Flags [P.], seq 2716988:2717192, ack 1513, win 501, length 204
21:11:53.665149 IP 138.197.158.231.ssh > cpe9050ca239d63-cm9050ca239d60.cpe.net.cable.rogers.com.55891: Flags [P.], seq 2717192:2717396, ack 1513, win 501, length 204
21:11:53.665205 IP 138.197.158.231.ssh > cpe9050ca239d63-cm9050ca239d60.cpe.net.cable.rogers.com.55891: Flags [P.], seq 2717396:2717600, ack 1513, win 501, length 204
21:11:53.665257 IP 138.197.158.231.ssh > cpe9050ca239d63-cm9050ca239d60.cpe.net.cable.rogers.com.55891: Flags [P.], seq 2717600:2717804, ack 1513, win 501, length 204
21:11:53.665312 IP 138.197.158.231.ssh > cpe9050ca239d63-cm9050ca239d60.cpe.net.cable.rogers.com.55891: Flags [P.], seq 2717804:2718008, ack 1513, win 501, length 204
21:11:53.665365 IP 138.197.158.231.ssh > cpe9050ca239d63-cm9050ca239d60.cpe.net.cable.rogers.com.55891: Flags [P.], seq 2718008:2718212, ack 1513, win 501, length 204
21:11:53.665427 IP 138.197.158.231.ssh > cpe9050ca239d63-cm9050ca239d60.cpe.net.cable.rogers.com.55891: Flags [P.], seq 2718212:2718416, ack 1513, win 501, length 204
21:11:53.665505 IP 138.197.158.231.ssh > cpe9050ca239d63-cm9050ca239d60.cpe.net.cable.rogers.com.55891: Flags [P.], seq 2718416:2718620, ack 1513, win 501, length 204
21:11:53.665569 IP 138.197.158.231.ssh > cpe9050ca239d63-cm9050ca239d60.cpe.net.cable.rogers.com.55891: Flags [P.], seq 2718620:2718824, ack 1513, win 501, length 204
21:11:53.665623 IP 138.197.158.231.ssh > cpe9050ca239d63-cm9050ca239d60.cpe.net.cable.rogers.com.55891: Flags [P.], seq 2718824:2719028, ack 1513, win 501, length 204
21:11:53.665676 IP 138.197.158.231.ssh > cpe9050ca239d63-cm9050ca239d60.cpe.net.cable.rogers.com.55891: Flags [P.], seq 2719028:2719232, ack 1513, win 501, length 204
21:11:53.665728 IP 138.197.158.231.ssh > cpe9050ca239d63-cm9050ca239d60.cpe.net.cable.rogers.com.55891: Flags [P.], seq 2719232:2719436, ack 1513, win 501, length 204
21:11:53.665793 IP 138.197.158.231.ssh > cpe9050ca239d63-cm9050ca239d60.cpe.net.cable.rogers.com.55891: Flags [P.], seq 2719436:2719640, ack 1513, win 501, length 204
21:11:53.665848 IP 138.197.158.231.ssh > cpe9050ca239d63-cm9050ca239d60.cpe.net.cable.rogers.com.55891: Flags [P.], seq 2719640:2719844, ack 1513, win 501, length 204
21:11:53.665900 IP 138.197.158.231.ssh > cpe9050ca239d63-cm9050ca239d60.cpe.net.cable.rogers.com.55891: Flags [P.], seq 2719844:2720048, ack 1513, win 501, length 204
21:11:53.665987 IP 138.197.158.231.ssh > cpe9050ca239d63-cm9050ca239d60.cpe.net.cable.rogers.com.55891: Flags [P.], seq 2720048:2720252, ack 1513, win 501, length 204
21:11:53.666053 IP 138.197.158.231.ssh > cpe9050ca239d63-cm9050ca239d60.cpe.net.cable.rogers.com.55891: Flags [P.], seq 2720252:2720456, ack 1513, win 501, length 204
21:11:53.666105 IP 138.197.158.231.ssh > cpe9050ca239d63-cm9050ca239d60.cpe.net.cable.rogers.com.55891: Flags [P.], seq 2720456:2720660, ack 1513, win 501, length 204
21:11:53.666156 IP 138.197.158.231.ssh > cpe9050ca239d63-cm9050ca239d60.cpe.net.cable.rogers.com.55891: Flags [P.], seq 2720660:2720864, ack 1513, win 501, length 204
21:11:53.666212 IP 138.197.158.231.ssh > cpe9050ca239d63-cm9050ca239d60.cpe.net.cable.rogers.com.55891: Flags [P.], seq 2720864:2721068, ack 1513, win 501, length 204
21:11:53.666266 IP 138.197.158.231.ssh > cpe9050ca239d63-cm9050ca239d60.cpe.net.cable.rogers.com.55891: Flags [P.], seq 2721068:2721272, ack 1513, win 501, length 204
21:11:53.666317 IP 138.197.158.231.ssh > cpe9050ca239d63-cm9050ca239d60.cpe.net.cable.rogers.com.55891: Flags [P.], seq 2721272:2721476, ack 1513, win 501, length 204
21:11:53.666373 IP 138.197.158.231.ssh > cpe9050ca239d63-cm9050ca239d60.cpe.net.cable.rogers.com.55891: Flags [P.], seq 2721476:2721680, ack 1513, win 501, length 204
21:11:53.666426 IP 138.197.158.231.ssh > cpe9050ca239d63-cm9050ca239d60.cpe.net.cable.rogers.com.55891: Flags [P.], seq 2721680:2721884, ack 1513, win 501, length 204
21:11:53.666478 IP 138.197.158.231.ssh > cpe9050ca239d63-cm9050ca239d60.cpe.net.cable.rogers.com.55891: Flags [P.], seq 2721884:2722088, ack 1513, win 501, length 204
21:11:53.666538 IP 138.197.158.231.ssh > cpe9050ca239d63-cm9050ca239d60.cpe.net.cable.rogers.com.55891: Flags [P.], seq 2722088:2722292, ack 1513, win 501, length 204
21:11:53.666621 IP 138.197.158.231.ssh > cpe9050ca239d63-cm9050ca239d60.cpe.net.cable.rogers.com.55891: Flags [P.], seq 2722292:2722496, ack 1513, win 501, length 204
21:11:53.666689 IP 138.197.158.231.ssh > cpe9050ca239d63-cm9050ca239d60.cpe.net.cable.rogers.com.55891: Flags [P.], seq 2722496:2722700, ack 1513, win 501, length 204
21:11:53.666745 IP 138.197.158.231.ssh > cpe9050ca239d63-cm9050ca239d60.cpe.net.cable.rogers.com.55891: Flags [P.], seq 2722700:2722904, ack 1513, win 501, length 204
21:11:53.666843 IP 138.197.158.231.ssh > cpe9050ca239d63-cm9050ca239d60.cpe.net.cable.rogers.com.55891: Flags [P.], seq 2722904:2723108, ack 1513, win 501, length 204
21:11:53.666915 IP 138.197.158.231.ssh > cpe9050ca239d63-cm9050ca239d60.cpe.net.cable.rogers.com.55891: Flags [P.], seq 2723108:2723312, ack 1513, win 501, length 204
21:11:53.666970 IP 138.197.158.231.ssh > cpe9050ca239d63-cm9050ca239d60.cpe.net.cable.rogers.com.55891: Flags [P.], seq 2723312:2723516, ack 1513, win 501, length 204
21:11:53.667029 IP 138.197.158.231.ssh > cpe9050ca239d63-cm9050ca239d60.cpe.net.cable.rogers.com.55891: Flags [P.], seq 2723516:2723720, ack 1513, win 501, length 204
21:11:53.667085 IP 138.197.158.231.ssh > cpe9050ca239d63-cm9050ca239d60.cpe.net.cable.rogers.com.55891: Flags [P.], seq 2723720:2723924, ack 1513, win 501, length 204
21:11:53.667142 IP 138.197.158.231.ssh > cpe9050ca239d63-cm9050ca239d60.cpe.net.cable.rogers.com.55891: Flags [P.], seq 2723924:2724128, ack 1513, win 501, length 204
21:11:53.667195 IP 138.197.158.231.ssh > cpe9050ca239d63-cm9050ca239d60.cpe.net.cable.rogers.com.55891: Flags [P.], seq 2724128:2724332, ack 1513, win 501, length 204
21:11:53.667269 IP 138.197.158.231.ssh > cpe9050ca239d63-cm9050ca239d60.cpe.net.cable.rogers.com.55891: Flags [P.], seq 2724332:2724536, ack 1513, win 501, length 204
21:11:53.667328 IP 138.197.158.231.ssh > cpe9050ca239d63-cm9050ca239d60.cpe.net.cable.rogers.com.55891: Flags [P.], seq 2724536:2724740, ack 1513, win 501, length 204
21:11:53.667383 IP 138.197.158.231.ssh > cpe9050ca239d63-cm9050ca239d60.cpe.net.cable.rogers.com.55891: Flags [P.], seq 2724740:2724944, ack 1513, win 501, length 204
21:11:53.667439 IP 138.197.158.231.ssh > cpe9050ca239d63-cm9050ca239d60.cpe.net.cable.rogers.com.55891: Flags [P.], seq 2724944:2725148, ack 1513, win 501, length 204
21:11:53.667492 IP 138.197.158.231.ssh > cpe9050ca239d63-cm9050ca239d60.cpe.net.cable.rogers.com.55891: Flags [P.], seq 2725148:2725352, ack 1513, win 501, length 204
21:11:53.667544 IP 138.197.158.231.ssh > cpe9050ca239d63-cm9050ca239d60.cpe.net.cable.rogers.com.55891: Flags [P.], seq 2725352:2725556, ack 1513, win 501, length 204
21:11:53.667599 IP 138.197.158.231.ssh > cpe9050ca239d63-cm9050ca239d60.cpe.net.cable.rogers.com.55891: Flags [P.], seq 2725556:2725760, ack 1513, win 501, length 204
21:11:53.667651 IP 138.197.158.231.ssh > cpe9050ca239d63-cm9050ca239d60.cpe.net.cable.rogers.com.55891: Flags [P.], seq 2725760:2725964, ack 1513, win 501, length 204
21:11:53.667704 IP 138.197.158.231.ssh > cpe9050ca239d63-cm9050ca239d60.cpe.net.cable.rogers.com.55891: Flags [P.], seq 2725964:2726168, ack 1513, win 501, length 204
21:11:53.667759 IP 138.197.158.231.ssh > cpe9050ca239d63-cm9050ca239d60.cpe.net.cable.rogers.com.55891: Flags [P.], seq 2726168:2726372, ack 1513, win 501, length 204
21:11:53.667816 IP 138.197.158.231.ssh > cpe9050ca239d63-cm9050ca239d60.cpe.net.cable.rogers.com.55891: Flags [P.], seq 2726372:2726576, ack 1513, win 501, length 204
21:11:53.667870 IP 138.197.158.231.ssh > cpe9050ca239d63-cm9050ca239d60.cpe.net.cable.rogers.com.55891: Flags [P.], seq 2726576:2726780, ack 1513, win 501, length 204
21:11:53.667922 IP 138.197.158.231.ssh > cpe9050ca239d63-cm9050ca239d60.cpe.net.cable.rogers.com.55891: Flags [P.], seq 2726780:2726984, ack 1513, win 501, length 204
21:11:53.667975 IP 138.197.158.231.ssh > cpe9050ca239d63-cm9050ca239d60.cpe.net.cable.rogers.com.55891: Flags [P.], seq 2726984:2727188, ack 1513, win 501, length 204
21:11:53.668031 IP 138.197.158.231.ssh > cpe9050ca239d63-cm9050ca239d60.cpe.net.cable.rogers.com.55891: Flags [P.], seq 2727188:2727392, ack 1513, win 501, length 204
21:11:53.668083 IP 138.197.158.231.ssh > cpe9050ca239d63-cm9050ca239d60.cpe.net.cable.rogers.com.55891: Flags [P.], seq 2727392:2727596, ack 1513, win 501, length 204
21:11:53.668137 IP 138.197.158.231.ssh > cpe9050ca239d63-cm9050ca239d60.cpe.net.cable.rogers.com.55891: Flags [P.], seq 2727596:2727800, ack 1513, win 501, length 204
21:11:53.668189 IP 138.197.158.231.ssh > cpe9050ca239d63-cm9050ca239d60.cpe.net.cable.rogers.com.55891: Flags [P.], seq 2727800:2728004, ack 1513, win 501, length 204
21:11:53.668241 IP 138.197.158.231.ssh > cpe9050ca239d63-cm9050ca239d60.cpe.net.cable.rogers.com.55891: Flags [P.], seq 2728004:2728208, ack 1513, win 501, length 204
21:11:53.668301 IP 138.197.158.231.ssh > cpe9050ca239d63-cm9050ca239d60.cpe.net.cable.rogers.com.55891: Flags [P.], seq 2728208:2728412, ack 1513, win 501, length 204
21:11:53.668354 IP 138.197.158.231.ssh > cpe9050ca239d63-cm9050ca239d60.cpe.net.cable.rogers.com.55891: Flags [P.], seq 2728412:2728616, ack 1513, win 501, length 204
21:11:53.668408 IP 138.197.158.231.ssh > cpe9050ca239d63-cm9050ca239d60.cpe.net.cable.rogers.com.55891: Flags [P.], seq 2728616:2728820, ack 1513, win 501, length 204
21:11:53.668460 IP 138.197.158.231.ssh > cpe9050ca239d63-cm9050ca239d60.cpe.net.cable.rogers.com.55891: Flags [P.], seq 2728820:2729024, ack 1513, win 501, length 204
21:11:53.668512 IP 138.197.158.231.ssh > cpe9050ca239d63-cm9050ca239d60.cpe.net.cable.rogers.com.55891: Flags [P.], seq 2729024:2729228, ack 1513, win 501, length 204
21:11:53.668568 IP 138.197.158.231.ssh > cpe9050ca239d63-cm9050ca239d60.cpe.net.cable.rogers.com.55891: Flags [P.], seq 2729228:2729432, ack 1513, win 501, length 204
21:11:53.668624 IP 138.197.158.231.ssh > cpe9050ca239d63-cm9050ca239d60.cpe.net.cable.rogers.com.55891: Flags [P.], seq 2729432:2729636, ack 1513, win 501, length 204
21:11:53.668682 IP 138.197.158.231.ssh > cpe9050ca239d63-cm9050ca239d60.cpe.net.cable.rogers.com.55891: Flags [P.], seq 2729636:2729840, ack 1513, win 501, length 204
21:11:53.668750 IP 138.197.158.231.ssh > cpe9050ca239d63-cm9050ca239d60.cpe.net.cable.rogers.com.55891: Flags [P.], seq 2729840:2730044, ack 1513, win 501, length 204
21:11:53.668805 IP 138.197.158.231.ssh > cpe9050ca239d63-cm9050ca239d60.cpe.net.cable.rogers.com.55891: Flags [P.], seq 2730044:2730248, ack 1513, win 501, length 204
21:11:53.668862 IP 138.197.158.231.ssh > cpe9050ca239d63-cm9050ca239d60.cpe.net.cable.rogers.com.55891: Flags [P.], seq 2730248:2730452, ack 1513, win 501, length 204
21:11:53.668915 IP 138.197.158.231.ssh > cpe9050ca239d63-cm9050ca239d60.cpe.net.cable.rogers.com.55891: Flags [P.], seq 2730452:2730656, ack 1513, win 501, length 204
21:11:53.668970 IP 138.197.158.231.ssh > cpe9050ca239d63-cm9050ca239d60.cpe.net.cable.rogers.com.55891: Flags [P.], seq 2730656:2730860, ack 1513, win 501, length 204
21:11:53.669024 IP 138.197.158.231.ssh > cpe9050ca239d63-cm9050ca239d60.cpe.net.cable.rogers.com.55891: Flags [P.], seq 2730860:2731064, ack 1513, win 501, length 204
21:11:53.669075 IP 138.197.158.231.ssh > cpe9050ca239d63-cm9050ca239d60.cpe.net.cable.rogers.com.55891: Flags [P.], seq 2731064:2731268, ack 1513, win 501, length 204
21:11:53.669132 IP 138.197.158.231.ssh > cpe9050ca239d63-cm9050ca239d60.cpe.net.cable.rogers.com.55891: Flags [P.], seq 2731268:2731472, ack 1513, win 501, length 204
21:11:53.669185 IP 138.197.158.231.ssh > cpe9050ca239d63-cm9050ca239d60.cpe.net.cable.rogers.com.55891: Flags [P.], seq 2731472:2731676, ack 1513, win 501, length 204
21:11:53.669240 IP 138.197.158.231.ssh > cpe9050ca239d63-cm9050ca239d60.cpe.net.cable.rogers.com.55891: Flags [P.], seq 2731676:2731880, ack 1513, win 501, length 204
21:11:53.669292 IP 138.197.158.231.ssh > cpe9050ca239d63-cm9050ca239d60.cpe.net.cable.rogers.com.55891: Flags [P.], seq 2731880:2732084, ack 1513, win 501, length 204
21:11:53.669347 IP 138.197.158.231.ssh > cpe9050ca239d63-cm9050ca239d60.cpe.net.cable.rogers.com.55891: Flags [P.], seq 2732084:2732288, ack 1513, win 501, length 204
21:11:53.669399 IP 138.197.158.231.ssh > cpe9050ca239d63-cm9050ca239d60.cpe.net.cable.rogers.com.55891: Flags [P.], seq 2732288:2732492, ack 1513, win 501, length 204
21:11:53.669451 IP 138.197.158.231.ssh > cpe9050ca239d63-cm9050ca239d60.cpe.net.cable.rogers.com.55891: Flags [P.], seq 2732492:2732696, ack 1513, win 501, length 204
21:11:53.669507 IP 138.197.158.231.ssh > cpe9050ca239d63-cm9050ca239d60.cpe.net.cable.rogers.com.55891: Flags [P.], seq 2732696:2732900, ack 1513, win 501, length 204
21:11:53.669562 IP 138.197.158.231.ssh > cpe9050ca239d63-cm9050ca239d60.cpe.net.cable.rogers.com.55891: Flags [P.], seq 2732900:2733104, ack 1513, win 501, length 204
21:11:53.669615 IP 138.197.158.231.ssh > cpe9050ca239d63-cm9050ca239d60.cpe.net.cable.rogers.com.55891: Flags [P.], seq 2733104:2733308, ack 1513, win 501, length 204
21:11:53.669671 IP 138.197.158.231.ssh > cpe9050ca239d63-cm9050ca239d60.cpe.net.cable.rogers.com.55891: Flags [P.], seq 2733308:2733512, ack 1513, win 501, length 204
21:11:53.669722 IP 138.197.158.231.ssh > cpe9050ca239d63-cm9050ca239d60.cpe.net.cable.rogers.com.55891: Flags [P.], seq 2733512:2733716, ack 1513, win 501, length 204
21:11:53.669781 IP 138.197.158.231.ssh > cpe9050ca239d63-cm9050ca239d60.cpe.net.cable.rogers.com.55891: Flags [P.], seq 2733716:2733920, ack 1513, win 501, length 204
21:11:53.669877 IP 138.197.158.231.ssh > cpe9050ca239d63-cm9050ca239d60.cpe.net.cable.rogers.com.55891: Flags [P.], seq 2733920:2734124, ack 1513, win 501, length 204
21:11:53.669950 IP 138.197.158.231.ssh > cpe9050ca239d63-cm9050ca239d60.cpe.net.cable.rogers.com.55891: Flags [P.], seq 2734124:2734328, ack 1513, win 501, length 204
21:11:53.670006 IP 138.197.158.231.ssh > cpe9050ca239d63-cm9050ca239d60.cpe.net.cable.rogers.com.55891: Flags [P.], seq 2734328:2734532, ack 1513, win 501, length 204
21:11:53.670063 IP 138.197.158.231.ssh > cpe9050ca239d63-cm9050ca239d60.cpe.net.cable.rogers.com.55891: Flags [P.], seq 2734532:2734736, ack 1513, win 501, length 204
21:11:53.670117 IP 138.197.158.231.ssh > cpe9050ca239d63-cm9050ca239d60.cpe.net.cable.rogers.com.55891: Flags [P.], seq 2734736:2734940, ack 1513, win 501, length 204
21:11:53.670173 IP 138.197.158.231.ssh > cpe9050ca239d63-cm9050ca239d60.cpe.net.cable.rogers.com.55891: Flags [P.], seq 2734940:2735144, ack 1513, win 501, length 204
21:11:53.670225 IP 138.197.158.231.ssh > cpe9050ca239d63-cm9050ca239d60.cpe.net.cable.rogers.com.55891: Flags [P.], seq 2735144:2735348, ack 1513, win 501, length 204
21:11:53.670279 IP 138.197.158.231.ssh > cpe9050ca239d63-cm9050ca239d60.cpe.net.cable.rogers.com.55891: Flags [P.], seq 2735348:2735552, ack 1513, win 501, length 204
21:11:53.670335 IP 138.197.158.231.ssh > cpe9050ca239d63-cm9050ca239d60.cpe.net.cable.rogers.com.55891: Flags [P.], seq 2735552:2735756, ack 1513, win 501, length 204
21:11:53.670403 IP 138.197.158.231.ssh > cpe9050ca239d63-cm9050ca239d60.cpe.net.cable.rogers.com.55891: Flags [P.], seq 2735756:2735960, ack 1513, win 501, length 204
21:11:53.670482 IP 138.197.158.231.ssh > cpe9050ca239d63-cm9050ca239d60.cpe.net.cable.rogers.com.55891: Flags [P.], seq 2735960:2736164, ack 1513, win 501, length 204
21:11:53.670549 IP 138.197.158.231.ssh > cpe9050ca239d63-cm9050ca239d60.cpe.net.cable.rogers.com.55891: Flags [P.], seq 2736164:2736368, ack 1513, win 501, length 204
21:11:53.670625 IP 138.197.158.231.ssh > cpe9050ca239d63-cm9050ca239d60.cpe.net.cable.rogers.com.55891: Flags [P.], seq 2736368:2736572, ack 1513, win 501, length 204
21:11:53.670683 IP 138.197.158.231.ssh > cpe9050ca239d63-cm9050ca239d60.cpe.net.cable.rogers.com.55891: Flags [P.], seq 2736572:2736776, ack 1513, win 501, length 204
21:11:53.670741 IP 138.197.158.231.ssh > cpe9050ca239d63-cm9050ca239d60.cpe.net.cable.rogers.com.55891: Flags [P.], seq 2736776:2736980, ack 1513, win 501, length 204
21:11:53.670793 IP 138.197.158.231.ssh > cpe9050ca239d63-cm9050ca239d60.cpe.net.cable.rogers.com.55891: Flags [P.], seq 2736980:2737184, ack 1513, win 501, length 204
21:11:53.670848 IP 138.197.158.231.ssh > cpe9050ca239d63-cm9050ca239d60.cpe.net.cable.rogers.com.55891: Flags [P.], seq 2737184:2737388, ack 1513, win 501, length 204
21:11:53.670900 IP 138.197.158.231.ssh > cpe9050ca239d63-cm9050ca239d60.cpe.net.cable.rogers.com.55891: Flags [P.], seq 2737388:2737592, ack 1513, win 501, length 204
21:11:53.670955 IP 138.197.158.231.ssh > cpe9050ca239d63-cm9050ca239d60.cpe.net.cable.rogers.com.55891: Flags [P.], seq 2737592:2737796, ack 1513, win 501, length 204
21:11:53.671012 IP 138.197.158.231.ssh > cpe9050ca239d63-cm9050ca239d60.cpe.net.cable.rogers.com.55891: Flags [P.], seq 2737796:2738000, ack 1513, win 501, length 204
21:11:53.671065 IP 138.197.158.231.ssh > cpe9050ca239d63-cm9050ca239d60.cpe.net.cable.rogers.com.55891: Flags [P.], seq 2738000:2738204, ack 1513, win 501, length 204
21:11:53.671117 IP 138.197.158.231.ssh > cpe9050ca239d63-cm9050ca239d60.cpe.net.cable.rogers.com.55891: Flags [P.], seq 2738204:2738408, ack 1513, win 501, length 204
21:11:53.671169 IP 138.197.158.231.ssh > cpe9050ca239d63-cm9050ca239d60.cpe.net.cable.rogers.com.55891: Flags [P.], seq 2738408:2738612, ack 1513, win 501, length 204
21:11:53.671223 IP 138.197.158.231.ssh > cpe9050ca239d63-cm9050ca239d60.cpe.net.cable.rogers.com.55891: Flags [P.], seq 2738612:2738816, ack 1513, win 501, length 204
21:11:53.671305 IP 138.197.158.231.ssh > cpe9050ca239d63-cm9050ca239d60.cpe.net.cable.rogers.com.55891: Flags [P.], seq 2738816:2739020, ack 1513, win 501, length 204
21:11:53.671363 IP 138.197.158.231.ssh > cpe9050ca239d63-cm9050ca239d60.cpe.net.cable.rogers.com.55891: Flags [P.], seq 2739020:2739224, ack 1513, win 501, length 204
21:11:53.671416 IP 138.197.158.231.ssh > cpe9050ca239d63-cm9050ca239d60.cpe.net.cable.rogers.com.55891: Flags [P.], seq 2739224:2739428, ack 1513, win 501, length 204
21:11:53.671472 IP 138.197.158.231.ssh > cpe9050ca239d63-cm9050ca239d60.cpe.net.cable.rogers.com.55891: Flags [P.], seq 2739428:2739632, ack 1513, win 501, length 204
21:11:53.671525 IP 138.197.158.231.ssh > cpe9050ca239d63-cm9050ca239d60.cpe.net.cable.rogers.com.55891: Flags [P.], seq 2739632:2739836, ack 1513, win 501, length 204
21:11:53.671606 IP 138.197.158.231.ssh > cpe9050ca239d63-cm9050ca239d60.cpe.net.cable.rogers.com.55891: Flags [P.], seq 2739836:2740040, ack 1513, win 501, length 204
21:11:53.671694 IP 138.197.158.231.ssh > cpe9050ca239d63-cm9050ca239d60.cpe.net.cable.rogers.com.55891: Flags [P.], seq 2740040:2740244, ack 1513, win 501, length 204
21:11:53.671783 IP 138.197.158.231.ssh > cpe9050ca239d63-cm9050ca239d60.cpe.net.cable.rogers.com.55891: Flags [P.], seq 2740244:2740448, ack 1513, win 501, length 204
21:11:53.671866 IP 138.197.158.231.ssh > cpe9050ca239d63-cm9050ca239d60.cpe.net.cable.rogers.com.55891: Flags [P.], seq 2740448:2740652, ack 1513, win 501, length 204
21:11:53.671928 IP 138.197.158.231.ssh > cpe9050ca239d63-cm9050ca239d60.cpe.net.cable.rogers.com.55891: Flags [P.], seq 2740652:2740856, ack 1513, win 501, length 204
21:11:53.671982 IP 138.197.158.231.ssh > cpe9050ca239d63-cm9050ca239d60.cpe.net.cable.rogers.com.55891: Flags [P.], seq 2740856:2741060, ack 1513, win 501, length 204
21:11:53.672044 IP 138.197.158.231.ssh > cpe9050ca239d63-cm9050ca239d60.cpe.net.cable.rogers.com.55891: Flags [P.], seq 2741060:2741264, ack 1513, win 501, length 204
21:11:53.672100 IP 138.197.158.231.ssh > cpe9050ca239d63-cm9050ca239d60.cpe.net.cable.rogers.com.55891: Flags [P.], seq 2741264:2741468, ack 1513, win 501, length 204
21:11:53.672152 IP 138.197.158.231.ssh > cpe9050ca239d63-cm9050ca239d60.cpe.net.cable.rogers.com.55891: Flags [P.], seq 2741468:2741672, ack 1513, win 501, length 204
21:11:53.672208 IP 138.197.158.231.ssh > cpe9050ca239d63-cm9050ca239d60.cpe.net.cable.rogers.com.55891: Flags [P.], seq 2741672:2741876, ack 1513, win 501, length 204
21:11:53.672261 IP 138.197.158.231.ssh > cpe9050ca239d63-cm9050ca239d60.cpe.net.cable.rogers.com.55891: Flags [P.], seq 2741876:2742080, ack 1513, win 501, length 204
21:11:53.672315 IP 138.197.158.231.ssh > cpe9050ca239d63-cm9050ca239d60.cpe.net.cable.rogers.com.55891: Flags [P.], seq 2742080:2742284, ack 1513, win 501, length 204
21:11:53.672377 IP 138.197.158.231.ssh > cpe9050ca239d63-cm9050ca239d60.cpe.net.cable.rogers.com.55891: Flags [P.], seq 2742284:2742488, ack 1513, win 501, length 204
21:11:53.672430 IP 138.197.158.231.ssh > cpe9050ca239d63-cm9050ca239d60.cpe.net.cable.rogers.com.55891: Flags [P.], seq 2742488:2742692, ack 1513, win 501, length 204
21:11:53.672490 IP 138.197.158.231.ssh > cpe9050ca239d63-cm9050ca239d60.cpe.net.cable.rogers.com.55891: Flags [P.], seq 2742692:2742896, ack 1513, win 501, length 204
21:11:53.672543 IP 138.197.158.231.ssh > cpe9050ca239d63-cm9050ca239d60.cpe.net.cable.rogers.com.55891: Flags [P.], seq 2742896:2743100, ack 1513, win 501, length 204
21:11:53.672595 IP 138.197.158.231.ssh > cpe9050ca239d63-cm9050ca239d60.cpe.net.cable.rogers.com.55891: Flags [P.], seq 2743100:2743304, ack 1513, win 501, length 204
21:11:53.672651 IP 138.197.158.231.ssh > cpe9050ca239d63-cm9050ca239d60.cpe.net.cable.rogers.com.55891: Flags [P.], seq 2743304:2743508, ack 1513, win 501, length 204
21:11:53.672705 IP 138.197.158.231.ssh > cpe9050ca239d63-cm9050ca239d60.cpe.net.cable.rogers.com.55891: Flags [P.], seq 2743508:2743712, ack 1513, win 501, length 204
21:11:53.672790 IP 138.197.158.231.ssh > cpe9050ca239d63-cm9050ca239d60.cpe.net.cable.rogers.com.55891: Flags [P.], seq 2743712:2743916, ack 1513, win 501, length 204
21:11:53.672889 IP 138.197.158.231.ssh > cpe9050ca239d63-cm9050ca239d60.cpe.net.cable.rogers.com.55891: Flags [P.], seq 2743916:2744120, ack 1513, win 501, length 204
21:11:53.672949 IP 138.197.158.231.ssh > cpe9050ca239d63-cm9050ca239d60.cpe.net.cable.rogers.com.55891: Flags [P.], seq 2744120:2744324, ack 1513, win 501, length 204
21:11:53.673009 IP 138.197.158.231.ssh > cpe9050ca239d63-cm9050ca239d60.cpe.net.cable.rogers.com.55891: Flags [P.], seq 2744324:2744528, ack 1513, win 501, length 204
21:11:53.673063 IP 138.197.158.231.ssh > cpe9050ca239d63-cm9050ca239d60.cpe.net.cable.rogers.com.55891: Flags [P.], seq 2744528:2744732, ack 1513, win 501, length 204
21:11:53.673116 IP 138.197.158.231.ssh > cpe9050ca239d63-cm9050ca239d60.cpe.net.cable.rogers.com.55891: Flags [P.], seq 2744732:2744936, ack 1513, win 501, length 204
21:11:53.673169 IP 138.197.158.231.ssh > cpe9050ca239d63-cm9050ca239d60.cpe.net.cable.rogers.com.55891: Flags [P.], seq 2744936:2745140, ack 1513, win 501, length 204
21:11:53.673225 IP 138.197.158.231.ssh > cpe9050ca239d63-cm9050ca239d60.cpe.net.cable.rogers.com.55891: Flags [P.], seq 2745140:2745344, ack 1513, win 501, length 204
21:11:53.673277 IP 138.197.158.231.ssh > cpe9050ca239d63-cm9050ca239d60.cpe.net.cable.rogers.com.55891: Flags [P.], seq 2745344:2745548, ack 1513, win 501, length 204
21:11:53.673329 IP 138.197.158.231.ssh > cpe9050ca239d63-cm9050ca239d60.cpe.net.cable.rogers.com.55891: Flags [P.], seq 2745548:2745752, ack 1513, win 501, length 204
21:11:53.673385 IP 138.197.158.231.ssh > cpe9050ca239d63-cm9050ca239d60.cpe.net.cable.rogers.com.55891: Flags [P.], seq 2745752:2745956, ack 1513, win 501, length 204
21:11:53.673442 IP 138.197.158.231.ssh > cpe9050ca239d63-cm9050ca239d60.cpe.net.cable.rogers.com.55891: Flags [P.], seq 2745956:2746160, ack 1513, win 501, length 204
21:11:53.673499 IP 138.197.158.231.ssh > cpe9050ca239d63-cm9050ca239d60.cpe.net.cable.rogers.com.55891: Flags [P.], seq 2746160:2746364, ack 1513, win 501, length 204
21:11:53.673583 IP 138.197.158.231.ssh > cpe9050ca239d63-cm9050ca239d60.cpe.net.cable.rogers.com.55891: Flags [P.], seq 2746364:2746568, ack 1513, win 501, length 204
21:11:53.673653 IP 138.197.158.231.ssh > cpe9050ca239d63-cm9050ca239d60.cpe.net.cable.rogers.com.55891: Flags [P.], seq 2746568:2746772, ack 1513, win 501, length 204
21:11:53.673707 IP 138.197.158.231.ssh > cpe9050ca239d63-cm9050ca239d60.cpe.net.cable.rogers.com.55891: Flags [P.], seq 2746772:2746976, ack 1513, win 501, length 204
21:11:53.673770 IP 138.197.158.231.ssh > cpe9050ca239d63-cm9050ca239d60.cpe.net.cable.rogers.com.55891: Flags [P.], seq 2746976:2747180, ack 1513, win 501, length 204
21:11:53.673828 IP 138.197.158.231.ssh > cpe9050ca239d63-cm9050ca239d60.cpe.net.cable.rogers.com.55891: Flags [P.], seq 2747180:2747384, ack 1513, win 501, length 204
21:11:53.673881 IP 138.197.158.231.ssh > cpe9050ca239d63-cm9050ca239d60.cpe.net.cable.rogers.com.55891: Flags [P.], seq 2747384:2747588, ack 1513, win 501, length 204
21:11:53.673942 IP 138.197.158.231.ssh > cpe9050ca239d63-cm9050ca239d60.cpe.net.cable.rogers.com.55891: Flags [P.], seq 2747588:2747792, ack 1513, win 501, length 204
21:11:53.673998 IP 138.197.158.231.ssh > cpe9050ca239d63-cm9050ca239d60.cpe.net.cable.rogers.com.55891: Flags [P.], seq 2747792:2747996, ack 1513, win 501, length 204
21:11:53.674050 IP 138.197.158.231.ssh > cpe9050ca239d63-cm9050ca239d60.cpe.net.cable.rogers.com.55891: Flags [P.], seq 2747996:2748200, ack 1513, win 501, length 204
21:11:53.674106 IP 138.197.158.231.ssh > cpe9050ca239d63-cm9050ca239d60.cpe.net.cable.rogers.com.55891: Flags [P.], seq 2748200:2748404, ack 1513, win 501, length 204
21:11:53.674166 IP 138.197.158.231.ssh > cpe9050ca239d63-cm9050ca239d60.cpe.net.cable.rogers.com.55891: Flags [P.], seq 2748404:2748608, ack 1513, win 501, length 204
21:11:53.674224 IP 138.197.158.231.ssh > cpe9050ca239d63-cm9050ca239d60.cpe.net.cable.rogers.com.55891: Flags [P.], seq 2748608:2748812, ack 1513, win 501, length 204
21:11:53.674282 IP 138.197.158.231.ssh > cpe9050ca239d63-cm9050ca239d60.cpe.net.cable.rogers.com.55891: Flags [P.], seq 2748812:2749016, ack 1513, win 501, length 204
21:11:53.674344 IP 138.197.158.231.ssh > cpe9050ca239d63-cm9050ca239d60.cpe.net.cable.rogers.com.55891: Flags [P.], seq 2749016:2749220, ack 1513, win 501, length 204
21:11:53.674455 IP 138.197.158.231.ssh > cpe9050ca239d63-cm9050ca239d60.cpe.net.cable.rogers.com.55891: Flags [P.], seq 2749220:2749424, ack 1513, win 501, length 204
21:11:53.674521 IP 138.197.158.231.ssh > cpe9050ca239d63-cm9050ca239d60.cpe.net.cable.rogers.com.55891: Flags [P.], seq 2749424:2749628, ack 1513, win 501, length 204
21:11:53.674584 IP 138.197.158.231.ssh > cpe9050ca239d63-cm9050ca239d60.cpe.net.cable.rogers.com.55891: Flags [P.], seq 2749628:2749832, ack 1513, win 501, length 204
21:11:53.674667 IP 138.197.158.231.ssh > cpe9050ca239d63-cm9050ca239d60.cpe.net.cable.rogers.com.55891: Flags [P.], seq 2749832:2750036, ack 1513, win 501, length 204
21:11:53.674724 IP 138.197.158.231.ssh > cpe9050ca239d63-cm9050ca239d60.cpe.net.cable.rogers.com.55891: Flags [P.], seq 2750036:2750240, ack 1513, win 501, length 204
21:11:53.674781 IP 138.197.158.231.ssh > cpe9050ca239d63-cm9050ca239d60.cpe.net.cable.rogers.com.55891: Flags [P.], seq 2750240:2750444, ack 1513, win 501, length 204
21:11:53.674853 IP 138.197.158.231.ssh > cpe9050ca239d63-cm9050ca239d60.cpe.net.cable.rogers.com.55891: Flags [P.], seq 2750444:2750648, ack 1513, win 501, length 204
21:11:53.674935 IP 138.197.158.231.ssh > cpe9050ca239d63-cm9050ca239d60.cpe.net.cable.rogers.com.55891: Flags [P.], seq 2750648:2750852, ack 1513, win 501, length 204
21:11:53.675001 IP 138.197.158.231.ssh > cpe9050ca239d63-cm9050ca239d60.cpe.net.cable.rogers.com.55891: Flags [P.], seq 2750852:2751056, ack 1513, win 501, length 204
21:11:53.675060 IP 138.197.158.231.ssh > cpe9050ca239d63-cm9050ca239d60.cpe.net.cable.rogers.com.55891: Flags [P.], seq 2751056:2751260, ack 1513, win 501, length 204
21:11:53.675116 IP 138.197.158.231.ssh > cpe9050ca239d63-cm9050ca239d60.cpe.net.cable.rogers.com.55891: Flags [P.], seq 2751260:2751464, ack 1513, win 501, length 204
21:11:53.675169 IP 138.197.158.231.ssh > cpe9050ca239d63-cm9050ca239d60.cpe.net.cable.rogers.com.55891: Flags [P.], seq 2751464:2751668, ack 1513, win 501, length 204
21:11:53.675222 IP 138.197.158.231.ssh > cpe9050ca239d63-cm9050ca239d60.cpe.net.cable.rogers.com.55891: Flags [P.], seq 2751668:2751872, ack 1513, win 501, length 204
21:11:53.675248 IP cpe9050ca239d63-cm9050ca239d60.cpe.net.cable.rogers.com.55891 > 138.197.158.231.ssh: Flags [.], ack 2641880, win 4138, length 0
21:11:53.675264 IP cpe9050ca239d63-cm9050ca239d60.cpe.net.cable.rogers.com.55891 > 138.197.158.231.ssh: Flags [.], ack 2647184, win 4140, length 0
21:11:53.675269 IP cpe9050ca239d63-cm9050ca239d60.cpe.net.cable.rogers.com.55891 > 138.197.158.231.ssh: Flags [.], ack 2648448, win 4135, length 0
21:11:53.675272 IP cpe9050ca239d63-cm9050ca239d60.cpe.net.cable.rogers.com.55891 > 138.197.158.231.ssh: Flags [.], ack 2649060, win 4140, length 0
21:11:53.675273 IP cpe9050ca239d63-cm9050ca239d60.cpe.net.cable.rogers.com.55891 > 138.197.158.231.ssh: Flags [.], ack 2651980, win 4140, length 0
21:11:53.675275 IP cpe9050ca239d63-cm9050ca239d60.cpe.net.cable.rogers.com.55891 > 138.197.158.231.ssh: Flags [.], ack 2652376, win 4138, length 0
21:11:53.675277 IP cpe9050ca239d63-cm9050ca239d60.cpe.net.cable.rogers.com.55891 > 138.197.158.231.ssh: Flags [.], ack 2655436, win 4140, length 0
21:11:53.675279 IP cpe9050ca239d63-cm9050ca239d60.cpe.net.cable.rogers.com.55891 > 138.197.158.231.ssh: Flags [P.], seq 1513:1549, ack 2655436, win 4140, length 36
21:11:53.675281 IP cpe9050ca239d63-cm9050ca239d60.cpe.net.cable.rogers.com.55891 > 138.197.158.231.ssh: Flags [.], ack 2661148, win 4140, length 0
21:11:53.675283 IP cpe9050ca239d63-cm9050ca239d60.cpe.net.cable.rogers.com.55891 > 138.197.158.231.ssh: Flags [.], ack 2662984, win 4140, length 0
21:11:53.675497 IP 138.197.158.231.ssh > cpe9050ca239d63-cm9050ca239d60.cpe.net.cable.rogers.com.55891: Flags [P.], seq 2751872:2753572, ack 1549, win 501, length 1700
21:11:53.675605 IP 138.197.158.231.ssh > cpe9050ca239d63-cm9050ca239d60.cpe.net.cable.rogers.com.55891: Flags [P.], seq 2753572:2753776, ack 1549, win 501, length 204
21:11:53.675669 IP 138.197.158.231.ssh > cpe9050ca239d63-cm9050ca239d60.cpe.net.cable.rogers.com.55891: Flags [P.], seq 2753776:2753980, ack 1549, win 501, length 204
21:11:53.675723 IP 138.197.158.231.ssh > cpe9050ca239d63-cm9050ca239d60.cpe.net.cable.rogers.com.55891: Flags [P.], seq 2753980:2754184, ack 1549, win 501, length 204
21:11:53.675776 IP 138.197.158.231.ssh > cpe9050ca239d63-cm9050ca239d60.cpe.net.cable.rogers.com.55891: Flags [P.], seq 2754184:2754388, ack 1549, win 501, length 204
21:11:53.675834 IP 138.197.158.231.ssh > cpe9050ca239d63-cm9050ca239d60.cpe.net.cable.rogers.com.55891: Flags [P.], seq 2754388:2754592, ack 1549, win 501, length 204
21:11:53.675890 IP 138.197.158.231.ssh > cpe9050ca239d63-cm9050ca239d60.cpe.net.cable.rogers.com.55891: Flags [P.], seq 2754592:2754796, ack 1549, win 501, length 204
21:11:53.675963 IP 138.197.158.231.ssh > cpe9050ca239d63-cm9050ca239d60.cpe.net.cable.rogers.com.55891: Flags [P.], seq 2754796:2755000, ack 1549, win 501, length 204
21:11:53.676025 IP 138.197.158.231.ssh > cpe9050ca239d63-cm9050ca239d60.cpe.net.cable.rogers.com.55891: Flags [P.], seq 2755000:2755204, ack 1549, win 501, length 204
21:11:53.676079 IP 138.197.158.231.ssh > cpe9050ca239d63-cm9050ca239d60.cpe.net.cable.rogers.com.55891: Flags [P.], seq 2755204:2755408, ack 1549, win 501, length 204
21:11:53.676135 IP 138.197.158.231.ssh > cpe9050ca239d63-cm9050ca239d60.cpe.net.cable.rogers.com.55891: Flags [P.], seq 2755408:2755612, ack 1549, win 501, length 204
21:11:53.676187 IP 138.197.158.231.ssh > cpe9050ca239d63-cm9050ca239d60.cpe.net.cable.rogers.com.55891: Flags [P.], seq 2755612:2755816, ack 1549, win 501, length 204
21:11:53.676243 IP 138.197.158.231.ssh > cpe9050ca239d63-cm9050ca239d60.cpe.net.cable.rogers.com.55891: Flags [P.], seq 2755816:2756020, ack 1549, win 501, length 204
21:11:53.676295 IP 138.197.158.231.ssh > cpe9050ca239d63-cm9050ca239d60.cpe.net.cable.rogers.com.55891: Flags [P.], seq 2756020:2756224, ack 1549, win 501, length 204
21:11:53.676348 IP 138.197.158.231.ssh > cpe9050ca239d63-cm9050ca239d60.cpe.net.cable.rogers.com.55891: Flags [P.], seq 2756224:2756428, ack 1549, win 501, length 204
21:11:53.676400 IP 138.197.158.231.ssh > cpe9050ca239d63-cm9050ca239d60.cpe.net.cable.rogers.com.55891: Flags [P.], seq 2756428:2756632, ack 1549, win 501, length 204
21:11:53.676456 IP 138.197.158.231.ssh > cpe9050ca239d63-cm9050ca239d60.cpe.net.cable.rogers.com.55891: Flags [P.], seq 2756632:2756836, ack 1549, win 501, length 204
21:11:53.676509 IP 138.197.158.231.ssh > cpe9050ca239d63-cm9050ca239d60.cpe.net.cable.rogers.com.55891: Flags [P.], seq 2756836:2757040, ack 1549, win 501, length 204
21:11:53.676570 IP 138.197.158.231.ssh > cpe9050ca239d63-cm9050ca239d60.cpe.net.cable.rogers.com.55891: Flags [P.], seq 2757040:2757244, ack 1549, win 501, length 204
21:11:53.676631 IP 138.197.158.231.ssh > cpe9050ca239d63-cm9050ca239d60.cpe.net.cable.rogers.com.55891: Flags [P.], seq 2757244:2757448, ack 1549, win 501, length 204
21:11:53.676685 IP 138.197.158.231.ssh > cpe9050ca239d63-cm9050ca239d60.cpe.net.cable.rogers.com.55891: Flags [P.], seq 2757448:2757652, ack 1549, win 501, length 204
21:11:53.676758 IP 138.197.158.231.ssh > cpe9050ca239d63-cm9050ca239d60.cpe.net.cable.rogers.com.55891: Flags [P.], seq 2757652:2757856, ack 1549, win 501, length 204
21:11:53.676813 IP 138.197.158.231.ssh > cpe9050ca239d63-cm9050ca239d60.cpe.net.cable.rogers.com.55891: Flags [P.], seq 2757856:2758060, ack 1549, win 501, length 204
21:11:53.676871 IP 138.197.158.231.ssh > cpe9050ca239d63-cm9050ca239d60.cpe.net.cable.rogers.com.55891: Flags [P.], seq 2758060:2758264, ack 1549, win 501, length 204
21:11:53.676925 IP 138.197.158.231.ssh > cpe9050ca239d63-cm9050ca239d60.cpe.net.cable.rogers.com.55891: Flags [P.], seq 2758264:2758468, ack 1549, win 501, length 204
21:11:53.676981 IP 138.197.158.231.ssh > cpe9050ca239d63-cm9050ca239d60.cpe.net.cable.rogers.com.55891: Flags [P.], seq 2758468:2758672, ack 1549, win 501, length 204
21:11:53.677038 IP 138.197.158.231.ssh > cpe9050ca239d63-cm9050ca239d60.cpe.net.cable.rogers.com.55891: Flags [P.], seq 2758672:2758876, ack 1549, win 501, length 204
21:11:53.677092 IP 138.197.158.231.ssh > cpe9050ca239d63-cm9050ca239d60.cpe.net.cable.rogers.com.55891: Flags [P.], seq 2758876:2759080, ack 1549, win 501, length 204
