root@lamp-ubuntu-s-1vcpu-1gb-tor1-01:~# tcpdump -i eth0


20:51:50.512511 IP 138.197.158.231.ssh > cpe9050ca239d63-cm9050ca239d60.cpe.net.cable.rogers.com.55891: Flags [P.], seq 2781948:2782152, ack 1513, win 501, length 204
20:51:50.512569 IP 138.197.158.231.ssh > cpe9050ca239d63-cm9050ca239d60.cpe.net.cable.rogers.com.55891: Flags [P.], seq 2782152:2782356, ack 1513, win 501, length 204
20:51:50.512623 IP 138.197.158.231.ssh > cpe9050ca239d63-cm9050ca239d60.cpe.net.cable.rogers.com.55891: Flags [P.], seq 2782356:2782560, ack 1513, win 501, length 204
20:51:50.512679 IP 138.197.158.231.ssh > cpe9050ca239d63-cm9050ca239d60.cpe.net.cable.rogers.com.55891: Flags [P.], seq 2782560:2782764, ack 1513, win 501, length 204
20:51:50.512738 IP 138.197.158.231.ssh > cpe9050ca239d63-cm9050ca239d60.cpe.net.cable.rogers.com.55891: Flags [P.], seq 2782764:2782968, ack 1513, win 501, length 204
20:51:50.512793 IP 138.197.158.231.ssh > cpe9050ca239d63-cm9050ca239d60.cpe.net.cable.rogers.com.55891: Flags [P.], seq 2782968:2783172, ack 1513, win 501, length 204
20:51:50.512850 IP 138.197.158.231.ssh > cpe9050ca239d63-cm9050ca239d60.cpe.net.cable.rogers.com.55891: Flags [P.], seq 2783172:2783376, ack 1513, win 501, length 204
20:51:50.512910 IP 138.197.158.231.ssh > cpe9050ca239d63-cm9050ca239d60.cpe.net.cable.rogers.com.55891: Flags [P.], seq 2783376:2783580, ack 1513, win 501, length 204
20:51:50.512967 IP 138.197.158.231.ssh > cpe9050ca239d63-cm9050ca239d60.cpe.net.cable.rogers.com.55891: Flags [P.], seq 2783580:2783784, ack 1513, win 501, length 204
20:51:50.513023 IP 138.197.158.231.ssh > cpe9050ca239d63-cm9050ca239d60.cpe.net.cable.rogers.com.55891: Flags [P.], seq 2783784:2783988, ack 1513, win 501, length 204
20:51:50.513078 IP 138.197.158.231.ssh > cpe9050ca239d63-cm9050ca239d60.cpe.net.cable.rogers.com.55891: Flags [P.], seq 2783988:2784192, ack 1513, win 501, length 204
20:51:50.513149 IP 138.197.158.231.ssh > cpe9050ca239d63-cm9050ca239d60.cpe.net.cable.rogers.com.55891: Flags [P.], seq 2784192:2784396, ack 1513, win 501, length 204
20:51:50.513212 IP 138.197.158.231.ssh > cpe9050ca239d63-cm9050ca239d60.cpe.net.cable.rogers.com.55891: Flags [P.], seq 2784396:2784600, ack 1513, win 501, length 204
20:51:50.513265 IP 138.197.158.231.ssh > cpe9050ca239d63-cm9050ca239d60.cpe.net.cable.rogers.com.55891: Flags [P.], seq 2784600:2784804, ack 1513, win 501, length 204
20:51:50.513322 IP 138.197.158.231.ssh > cpe9050ca239d63-cm9050ca239d60.cpe.net.cable.rogers.com.55891: Flags [P.], seq 2784804:2785008, ack 1513, win 501, length 204
20:51:50.513385 IP 138.197.158.231.ssh > cpe9050ca239d63-cm9050ca239d60.cpe.net.cable.rogers.com.55891: Flags [P.], seq 2785008:2785212, ack 1513, win 501, length 204
20:51:50.513439 IP 138.197.158.231.ssh > cpe9050ca239d63-cm9050ca239d60.cpe.net.cable.rogers.com.55891: Flags [P.], seq 2785212:2785416, ack 1513, win 501, length 204
20:51:50.513498 IP 138.197.158.231.ssh > cpe9050ca239d63-cm9050ca239d60.cpe.net.cable.rogers.com.55891: Flags [P.], seq 2785416:2785620, ack 1513, win 501, length 204
20:51:50.513557 IP 138.197.158.231.ssh > cpe9050ca239d63-cm9050ca239d60.cpe.net.cable.rogers.com.55891: Flags [P.], seq 2785620:2785824, ack 1513, win 501, length 204
20:51:50.513611 IP 138.197.158.231.ssh > cpe9050ca239d63-cm9050ca239d60.cpe.net.cable.rogers.com.55891: Flags [P.], seq 2785824:2786028, ack 1513, win 501, length 204
20:51:50.513666 IP 138.197.158.231.ssh > cpe9050ca239d63-cm9050ca239d60.cpe.net.cable.rogers.com.55891: Flags [P.], seq 2786028:2786232, ack 1513, win 501, length 204
20:51:50.513720 IP 138.197.158.231.ssh > cpe9050ca239d63-cm9050ca239d60.cpe.net.cable.rogers.com.55891: Flags [P.], seq 2786232:2786436, ack 1513, win 501, length 204
20:51:50.513776 IP 138.197.158.231.ssh > cpe9050ca239d63-cm9050ca239d60.cpe.net.cable.rogers.com.55891: Flags [P.], seq 2786436:2786640, ack 1513, win 501, length 204
20:51:50.513832 IP 138.197.158.231.ssh > cpe9050ca239d63-cm9050ca239d60.cpe.net.cable.rogers.com.55891: Flags [P.], seq 2786640:2786844, ack 1513, win 501, length 204
20:51:50.513888 IP 138.197.158.231.ssh > cpe9050ca239d63-cm9050ca239d60.cpe.net.cable.rogers.com.55891: Flags [P.], seq 2786844:2787048, ack 1513, win 501, length 204
20:51:50.513946 IP 138.197.158.231.ssh > cpe9050ca239d63-cm9050ca239d60.cpe.net.cable.rogers.com.55891: Flags [P.], seq 2787048:2787252, ack 1513, win 501, length 204
20:51:50.514000 IP 138.197.158.231.ssh > cpe9050ca239d63-cm9050ca239d60.cpe.net.cable.rogers.com.55891: Flags [P.], seq 2787252:2787456, ack 1513, win 501, length 204
20:51:50.514054 IP 138.197.158.231.ssh > cpe9050ca239d63-cm9050ca239d60.cpe.net.cable.rogers.com.55891: Flags [P.], seq 2787456:2787660, ack 1513, win 501, length 204
20:51:50.514110 IP 138.197.158.231.ssh > cpe9050ca239d63-cm9050ca239d60.cpe.net.cable.rogers.com.55891: Flags [P.], seq 2787660:2787864, ack 1513, win 501, length 204
20:51:50.514179 IP 138.197.158.231.ssh > cpe9050ca239d63-cm9050ca239d60.cpe.net.cable.rogers.com.55891: Flags [P.], seq 2787864:2788068, ack 1513, win 501, length 204
20:51:50.514297 IP 138.197.158.231.ssh > cpe9050ca239d63-cm9050ca239d60.cpe.net.cable.rogers.com.55891: Flags [P.], seq 2788068:2788272, ack 1513, win 501, length 204
20:51:50.514369 IP 138.197.158.231.ssh > cpe9050ca239d63-cm9050ca239d60.cpe.net.cable.rogers.com.55891: Flags [P.], seq 2788272:2788476, ack 1513, win 501, length 204
20:51:50.514424 IP 138.197.158.231.ssh > cpe9050ca239d63-cm9050ca239d60.cpe.net.cable.rogers.com.55891: Flags [P.], seq 2788476:2788680, ack 1513, win 501, length 204
20:51:50.514484 IP 138.197.158.231.ssh > cpe9050ca239d63-cm9050ca239d60.cpe.net.cable.rogers.com.55891: Flags [P.], seq 2788680:2788884, ack 1513, win 501, length 204
20:51:50.514540 IP 138.197.158.231.ssh > cpe9050ca239d63-cm9050ca239d60.cpe.net.cable.rogers.com.55891: Flags [P.], seq 2788884:2789088, ack 1513, win 501, length 204
20:51:50.514602 IP 138.197.158.231.ssh > cpe9050ca239d63-cm9050ca239d60.cpe.net.cable.rogers.com.55891: Flags [P.], seq 2789088:2789292, ack 1513, win 501, length 204
20:51:50.514656 IP 138.197.158.231.ssh > cpe9050ca239d63-cm9050ca239d60.cpe.net.cable.rogers.com.55891: Flags [P.], seq 2789292:2789496, ack 1513, win 501, length 204
20:51:50.514711 IP 138.197.158.231.ssh > cpe9050ca239d63-cm9050ca239d60.cpe.net.cable.rogers.com.55891: Flags [P.], seq 2789496:2789700, ack 1513, win 501, length 204
20:51:50.514765 IP 138.197.158.231.ssh > cpe9050ca239d63-cm9050ca239d60.cpe.net.cable.rogers.com.55891: Flags [P.], seq 2789700:2789904, ack 1513, win 501, length 204
20:51:50.514823 IP 138.197.158.231.ssh > cpe9050ca239d63-cm9050ca239d60.cpe.net.cable.rogers.com.55891: Flags [P.], seq 2789904:2790108, ack 1513, win 501, length 204
20:51:50.514876 IP 138.197.158.231.ssh > cpe9050ca239d63-cm9050ca239d60.cpe.net.cable.rogers.com.55891: Flags [P.], seq 2790108:2790312, ack 1513, win 501, length 204
20:51:50.514937 IP 138.197.158.231.ssh > cpe9050ca239d63-cm9050ca239d60.cpe.net.cable.rogers.com.55891: Flags [P.], seq 2790312:2790516, ack 1513, win 501, length 204
20:51:50.514994 IP 138.197.158.231.ssh > cpe9050ca239d63-cm9050ca239d60.cpe.net.cable.rogers.com.55891: Flags [P.], seq 2790516:2790720, ack 1513, win 501, length 204
20:51:50.515047 IP 138.197.158.231.ssh > cpe9050ca239d63-cm9050ca239d60.cpe.net.cable.rogers.com.55891: Flags [P.], seq 2790720:2790924, ack 1513, win 501, length 204
20:51:50.515100 IP 138.197.158.231.ssh > cpe9050ca239d63-cm9050ca239d60.cpe.net.cable.rogers.com.55891: Flags [P.], seq 2790924:2791128, ack 1513, win 501, length 204
20:51:50.515154 IP 138.197.158.231.ssh > cpe9050ca239d63-cm9050ca239d60.cpe.net.cable.rogers.com.55891: Flags [P.], seq 2791128:2791332, ack 1513, win 501, length 204
20:51:50.515214 IP 138.197.158.231.ssh > cpe9050ca239d63-cm9050ca239d60.cpe.net.cable.rogers.com.55891: Flags [P.], seq 2791332:2791536, ack 1513, win 501, length 204
20:51:50.515289 IP 138.197.158.231.ssh > cpe9050ca239d63-cm9050ca239d60.cpe.net.cable.rogers.com.55891: Flags [P.], seq 2791536:2791740, ack 1513, win 501, length 204
20:51:50.515350 IP 138.197.158.231.ssh > cpe9050ca239d63-cm9050ca239d60.cpe.net.cable.rogers.com.55891: Flags [P.], seq 2791740:2791944, ack 1513, win 501, length 204
20:51:50.515415 IP 138.197.158.231.ssh > cpe9050ca239d63-cm9050ca239d60.cpe.net.cable.rogers.com.55891: Flags [P.], seq 2791944:2792148, ack 1513, win 501, length 204
20:51:50.515480 IP 138.197.158.231.ssh > cpe9050ca239d63-cm9050ca239d60.cpe.net.cable.rogers.com.55891: Flags [P.], seq 2792148:2792352, ack 1513, win 501, length 204
20:51:50.515536 IP 138.197.158.231.ssh > cpe9050ca239d63-cm9050ca239d60.cpe.net.cable.rogers.com.55891: Flags [P.], seq 2792352:2792556, ack 1513, win 501, length 204
20:51:50.515603 IP 138.197.158.231.ssh > cpe9050ca239d63-cm9050ca239d60.cpe.net.cable.rogers.com.55891: Flags [P.], seq 2792556:2792760, ack 1513, win 501, length 204
20:51:50.515661 IP 138.197.158.231.ssh > cpe9050ca239d63-cm9050ca239d60.cpe.net.cable.rogers.com.55891: Flags [P.], seq 2792760:2792964, ack 1513, win 501, length 204
20:51:50.515715 IP 138.197.158.231.ssh > cpe9050ca239d63-cm9050ca239d60.cpe.net.cable.rogers.com.55891: Flags [P.], seq 2792964:2793168, ack 1513, win 501, length 204
20:51:50.515772 IP 138.197.158.231.ssh > cpe9050ca239d63-cm9050ca239d60.cpe.net.cable.rogers.com.55891: Flags [P.], seq 2793168:2793372, ack 1513, win 501, length 204
20:51:50.515825 IP 138.197.158.231.ssh > cpe9050ca239d63-cm9050ca239d60.cpe.net.cable.rogers.com.55891: Flags [P.], seq 2793372:2793576, ack 1513, win 501, length 204
20:51:50.515886 IP 138.197.158.231.ssh > cpe9050ca239d63-cm9050ca239d60.cpe.net.cable.rogers.com.55891: Flags [P.], seq 2793576:2793780, ack 1513, win 501, length 204
20:51:50.515940 IP 138.197.158.231.ssh > cpe9050ca239d63-cm9050ca239d60.cpe.net.cable.rogers.com.55891: Flags [P.], seq 2793780:2793984, ack 1513, win 501, length 204
20:51:50.515994 IP 138.197.158.231.ssh > cpe9050ca239d63-cm9050ca239d60.cpe.net.cable.rogers.com.55891: Flags [P.], seq 2793984:2794188, ack 1513, win 501, length 204
20:51:50.516048 IP 138.197.158.231.ssh > cpe9050ca239d63-cm9050ca239d60.cpe.net.cable.rogers.com.55891: Flags [P.], seq 2794188:2794392, ack 1513, win 501, length 204
20:51:50.516101 IP 138.197.158.231.ssh > cpe9050ca239d63-cm9050ca239d60.cpe.net.cable.rogers.com.55891: Flags [P.], seq 2794392:2794596, ack 1513, win 501, length 204
20:51:50.516161 IP 138.197.158.231.ssh > cpe9050ca239d63-cm9050ca239d60.cpe.net.cable.rogers.com.55891: Flags [P.], seq 2794596:2794800, ack 1513, win 501, length 204
20:51:50.516216 IP 138.197.158.231.ssh > cpe9050ca239d63-cm9050ca239d60.cpe.net.cable.rogers.com.55891: Flags [P.], seq 2794800:2795004, ack 1513, win 501, length 204
20:51:50.516344 IP 138.197.158.231.ssh > cpe9050ca239d63-cm9050ca239d60.cpe.net.cable.rogers.com.55891: Flags [P.], seq 2795004:2795208, ack 1513, win 501, length 204
20:51:50.516430 IP 138.197.158.231.ssh > cpe9050ca239d63-cm9050ca239d60.cpe.net.cable.rogers.com.55891: Flags [P.], seq 2795208:2795412, ack 1513, win 501, length 204
20:51:50.516494 IP 138.197.158.231.ssh > cpe9050ca239d63-cm9050ca239d60.cpe.net.cable.rogers.com.55891: Flags [P.], seq 2795412:2795616, ack 1513, win 501, length 204
20:51:50.516549 IP 138.197.158.231.ssh > cpe9050ca239d63-cm9050ca239d60.cpe.net.cable.rogers.com.55891: Flags [P.], seq 2795616:2795820, ack 1513, win 501, length 204
20:51:50.516620 IP 138.197.158.231.ssh > cpe9050ca239d63-cm9050ca239d60.cpe.net.cable.rogers.com.55891: Flags [P.], seq 2795820:2796024, ack 1513, win 501, length 204
20:51:50.516675 IP 138.197.158.231.ssh > cpe9050ca239d63-cm9050ca239d60.cpe.net.cable.rogers.com.55891: Flags [P.], seq 2796024:2796228, ack 1513, win 501, length 204
20:51:50.516730 IP 138.197.158.231.ssh > cpe9050ca239d63-cm9050ca239d60.cpe.net.cable.rogers.com.55891: Flags [P.], seq 2796228:2796432, ack 1513, win 501, length 204
20:51:50.516787 IP 138.197.158.231.ssh > cpe9050ca239d63-cm9050ca239d60.cpe.net.cable.rogers.com.55891: Flags [P.], seq 2796432:2796636, ack 1513, win 501, length 204
20:51:50.516842 IP 138.197.158.231.ssh > cpe9050ca239d63-cm9050ca239d60.cpe.net.cable.rogers.com.55891: Flags [P.], seq 2796636:2796840, ack 1513, win 501, length 204
20:51:50.516898 IP 138.197.158.231.ssh > cpe9050ca239d63-cm9050ca239d60.cpe.net.cable.rogers.com.55891: Flags [P.], seq 2796840:2797044, ack 1513, win 501, length 204
20:51:50.516954 IP 138.197.158.231.ssh > cpe9050ca239d63-cm9050ca239d60.cpe.net.cable.rogers.com.55891: Flags [P.], seq 2797044:2797248, ack 1513, win 501, length 204
20:51:50.517008 IP 138.197.158.231.ssh > cpe9050ca239d63-cm9050ca239d60.cpe.net.cable.rogers.com.55891: Flags [P.], seq 2797248:2797452, ack 1513, win 501, length 204
20:51:50.517064 IP 138.197.158.231.ssh > cpe9050ca239d63-cm9050ca239d60.cpe.net.cable.rogers.com.55891: Flags [P.], seq 2797452:2797656, ack 1513, win 501, length 204
20:51:50.517132 IP 138.197.158.231.ssh > cpe9050ca239d63-cm9050ca239d60.cpe.net.cable.rogers.com.55891: Flags [P.], seq 2797656:2797860, ack 1513, win 501, length 204
20:51:50.517189 IP 138.197.158.231.ssh > cpe9050ca239d63-cm9050ca239d60.cpe.net.cable.rogers.com.55891: Flags [P.], seq 2797860:2798064, ack 1513, win 501, length 204
20:51:50.517244 IP 138.197.158.231.ssh > cpe9050ca239d63-cm9050ca239d60.cpe.net.cable.rogers.com.55891: Flags [P.], seq 2798064:2798268, ack 1513, win 501, length 204
20:51:50.517297 IP 138.197.158.231.ssh > cpe9050ca239d63-cm9050ca239d60.cpe.net.cable.rogers.com.55891: Flags [P.], seq 2798268:2798472, ack 1513, win 501, length 204
20:51:50.517358 IP 138.197.158.231.ssh > cpe9050ca239d63-cm9050ca239d60.cpe.net.cable.rogers.com.55891: Flags [P.], seq 2798472:2798676, ack 1513, win 501, length 204
20:51:50.517412 IP 138.197.158.231.ssh > cpe9050ca239d63-cm9050ca239d60.cpe.net.cable.rogers.com.55891: Flags [P.], seq 2798676:2798880, ack 1513, win 501, length 204
20:51:50.517465 IP 138.197.158.231.ssh > cpe9050ca239d63-cm9050ca239d60.cpe.net.cable.rogers.com.55891: Flags [P.], seq 2798880:2799084, ack 1513, win 501, length 204
20:51:50.517517 IP 138.197.158.231.ssh > cpe9050ca239d63-cm9050ca239d60.cpe.net.cable.rogers.com.55891: Flags [P.], seq 2799084:2799288, ack 1513, win 501, length 204
20:51:50.517574 IP 138.197.158.231.ssh > cpe9050ca239d63-cm9050ca239d60.cpe.net.cable.rogers.com.55891: Flags [P.], seq 2799288:2799492, ack 1513, win 501, length 204
20:51:50.517627 IP 138.197.158.231.ssh > cpe9050ca239d63-cm9050ca239d60.cpe.net.cable.rogers.com.55891: Flags [P.], seq 2799492:2799696, ack 1513, win 501, length 204
20:51:50.517680 IP 138.197.158.231.ssh > cpe9050ca239d63-cm9050ca239d60.cpe.net.cable.rogers.com.55891: Flags [P.], seq 2799696:2799900, ack 1513, win 501, length 204
20:51:50.517737 IP 138.197.158.231.ssh > cpe9050ca239d63-cm9050ca239d60.cpe.net.cable.rogers.com.55891: Flags [P.], seq 2799900:2800104, ack 1513, win 501, length 204
20:51:50.517795 IP 138.197.158.231.ssh > cpe9050ca239d63-cm9050ca239d60.cpe.net.cable.rogers.com.55891: Flags [P.], seq 2800104:2800308, ack 1513, win 501, length 204
20:51:50.517853 IP 138.197.158.231.ssh > cpe9050ca239d63-cm9050ca239d60.cpe.net.cable.rogers.com.55891: Flags [P.], seq 2800308:2800512, ack 1513, win 501, length 204
20:51:50.517908 IP 138.197.158.231.ssh > cpe9050ca239d63-cm9050ca239d60.cpe.net.cable.rogers.com.55891: Flags [P.], seq 2800512:2800716, ack 1513, win 501, length 204
20:51:50.517961 IP 138.197.158.231.ssh > cpe9050ca239d63-cm9050ca239d60.cpe.net.cable.rogers.com.55891: Flags [P.], seq 2800716:2800920, ack 1513, win 501, length 204
20:51:50.518018 IP 138.197.158.231.ssh > cpe9050ca239d63-cm9050ca239d60.cpe.net.cable.rogers.com.55891: Flags [P.], seq 2800920:2801124, ack 1513, win 501, length 204
20:51:50.518071 IP 138.197.158.231.ssh > cpe9050ca239d63-cm9050ca239d60.cpe.net.cable.rogers.com.55891: Flags [P.], seq 2801124:2801328, ack 1513, win 501, length 204
20:51:50.518129 IP 138.197.158.231.ssh > cpe9050ca239d63-cm9050ca239d60.cpe.net.cable.rogers.com.55891: Flags [P.], seq 2801328:2801532, ack 1513, win 501, length 204
20:51:50.518182 IP 138.197.158.231.ssh > cpe9050ca239d63-cm9050ca239d60.cpe.net.cable.rogers.com.55891: Flags [P.], seq 2801532:2801736, ack 1513, win 501, length 204
20:51:50.518240 IP 138.197.158.231.ssh > cpe9050ca239d63-cm9050ca239d60.cpe.net.cable.rogers.com.55891: Flags [P.], seq 2801736:2801940, ack 1513, win 501, length 204
20:51:50.518299 IP 138.197.158.231.ssh > cpe9050ca239d63-cm9050ca239d60.cpe.net.cable.rogers.com.55891: Flags [P.], seq 2801940:2802144, ack 1513, win 501, length 204
20:51:50.518358 IP 138.197.158.231.ssh > cpe9050ca239d63-cm9050ca239d60.cpe.net.cable.rogers.com.55891: Flags [P.], seq 2802144:2802348, ack 1513, win 501, length 204
20:51:50.518414 IP 138.197.158.231.ssh > cpe9050ca239d63-cm9050ca239d60.cpe.net.cable.rogers.com.55891: Flags [P.], seq 2802348:2802552, ack 1513, win 501, length 204
20:51:50.518470 IP 138.197.158.231.ssh > cpe9050ca239d63-cm9050ca239d60.cpe.net.cable.rogers.com.55891: Flags [P.], seq 2802552:2802756, ack 1513, win 501, length 204
20:51:50.518527 IP 138.197.158.231.ssh > cpe9050ca239d63-cm9050ca239d60.cpe.net.cable.rogers.com.55891: Flags [P.], seq 2802756:2802960, ack 1513, win 501, length 204
20:51:50.518582 IP 138.197.158.231.ssh > cpe9050ca239d63-cm9050ca239d60.cpe.net.cable.rogers.com.55891: Flags [P.], seq 2802960:2803164, ack 1513, win 501, length 204
20:51:50.518637 IP 138.197.158.231.ssh > cpe9050ca239d63-cm9050ca239d60.cpe.net.cable.rogers.com.55891: Flags [P.], seq 2803164:2803368, ack 1513, win 501, length 204
20:51:50.518698 IP 138.197.158.231.ssh > cpe9050ca239d63-cm9050ca239d60.cpe.net.cable.rogers.com.55891: Flags [P.], seq 2803368:2803572, ack 1513, win 501, length 204
20:51:50.518752 IP 138.197.158.231.ssh > cpe9050ca239d63-cm9050ca239d60.cpe.net.cable.rogers.com.55891: Flags [P.], seq 2803572:2803776, ack 1513, win 501, length 204
20:51:50.518804 IP 138.197.158.231.ssh > cpe9050ca239d63-cm9050ca239d60.cpe.net.cable.rogers.com.55891: Flags [P.], seq 2803776:2803980, ack 1513, win 501, length 204
20:51:50.518861 IP 138.197.158.231.ssh > cpe9050ca239d63-cm9050ca239d60.cpe.net.cable.rogers.com.55891: Flags [P.], seq 2803980:2804184, ack 1513, win 501, length 204
20:51:50.518913 IP 138.197.158.231.ssh > cpe9050ca239d63-cm9050ca239d60.cpe.net.cable.rogers.com.55891: Flags [P.], seq 2804184:2804388, ack 1513, win 501, length 204
20:51:50.518965 IP 138.197.158.231.ssh > cpe9050ca239d63-cm9050ca239d60.cpe.net.cable.rogers.com.55891: Flags [P.], seq 2804388:2804592, ack 1513, win 501, length 204
20:51:50.519020 IP 138.197.158.231.ssh > cpe9050ca239d63-cm9050ca239d60.cpe.net.cable.rogers.com.55891: Flags [P.], seq 2804592:2804796, ack 1513, win 501, length 204
20:51:50.519074 IP 138.197.158.231.ssh > cpe9050ca239d63-cm9050ca239d60.cpe.net.cable.rogers.com.55891: Flags [P.], seq 2804796:2805000, ack 1513, win 501, length 204
20:51:50.519133 IP 138.197.158.231.ssh > cpe9050ca239d63-cm9050ca239d60.cpe.net.cable.rogers.com.55891: Flags [P.], seq 2805000:2805204, ack 1513, win 501, length 204
20:51:50.519191 IP 138.197.158.231.ssh > cpe9050ca239d63-cm9050ca239d60.cpe.net.cable.rogers.com.55891: Flags [P.], seq 2805204:2805408, ack 1513, win 501, length 204
20:51:50.519257 IP 138.197.158.231.ssh > cpe9050ca239d63-cm9050ca239d60.cpe.net.cable.rogers.com.55891: Flags [P.], seq 2805408:2805612, ack 1513, win 501, length 204
20:51:50.519312 IP 138.197.158.231.ssh > cpe9050ca239d63-cm9050ca239d60.cpe.net.cable.rogers.com.55891: Flags [P.], seq 2805612:2805816, ack 1513, win 501, length 204
20:51:50.519366 IP 138.197.158.231.ssh > cpe9050ca239d63-cm9050ca239d60.cpe.net.cable.rogers.com.55891: Flags [P.], seq 2805816:2806020, ack 1513, win 501, length 204
20:51:50.519423 IP 138.197.158.231.ssh > cpe9050ca239d63-cm9050ca239d60.cpe.net.cable.rogers.com.55891: Flags [P.], seq 2806020:2806224, ack 1513, win 501, length 204
20:51:50.519478 IP 138.197.158.231.ssh > cpe9050ca239d63-cm9050ca239d60.cpe.net.cable.rogers.com.55891: Flags [P.], seq 2806224:2806428, ack 1513, win 501, length 204
20:51:50.519531 IP 138.197.158.231.ssh > cpe9050ca239d63-cm9050ca239d60.cpe.net.cable.rogers.com.55891: Flags [P.], seq 2806428:2806632, ack 1513, win 501, length 204
20:51:50.519592 IP 138.197.158.231.ssh > cpe9050ca239d63-cm9050ca239d60.cpe.net.cable.rogers.com.55891: Flags [P.], seq 2806632:2806836, ack 1513, win 501, length 204
20:51:50.519648 IP 138.197.158.231.ssh > cpe9050ca239d63-cm9050ca239d60.cpe.net.cable.rogers.com.55891: Flags [P.], seq 2806836:2807040, ack 1513, win 501, length 204
20:51:50.519700 IP 138.197.158.231.ssh > cpe9050ca239d63-cm9050ca239d60.cpe.net.cable.rogers.com.55891: Flags [P.], seq 2807040:2807244, ack 1513, win 501, length 204
20:51:50.519754 IP 138.197.158.231.ssh > cpe9050ca239d63-cm9050ca239d60.cpe.net.cable.rogers.com.55891: Flags [P.], seq 2807244:2807448, ack 1513, win 501, length 204
20:51:50.519811 IP 138.197.158.231.ssh > cpe9050ca239d63-cm9050ca239d60.cpe.net.cable.rogers.com.55891: Flags [P.], seq 2807448:2807652, ack 1513, win 501, length 204
20:51:50.519865 IP 138.197.158.231.ssh > cpe9050ca239d63-cm9050ca239d60.cpe.net.cable.rogers.com.55891: Flags [P.], seq 2807652:2807856, ack 1513, win 501, length 204
20:51:50.519922 IP 138.197.158.231.ssh > cpe9050ca239d63-cm9050ca239d60.cpe.net.cable.rogers.com.55891: Flags [P.], seq 2807856:2808060, ack 1513, win 501, length 204
20:51:50.519976 IP 138.197.158.231.ssh > cpe9050ca239d63-cm9050ca239d60.cpe.net.cable.rogers.com.55891: Flags [P.], seq 2808060:2808264, ack 1513, win 501, length 204
20:51:50.520034 IP 138.197.158.231.ssh > cpe9050ca239d63-cm9050ca239d60.cpe.net.cable.rogers.com.55891: Flags [P.], seq 2808264:2808468, ack 1513, win 501, length 204
20:51:50.520093 IP 138.197.158.231.ssh > cpe9050ca239d63-cm9050ca239d60.cpe.net.cable.rogers.com.55891: Flags [P.], seq 2808468:2808672, ack 1513, win 501, length 204
20:51:50.520146 IP 138.197.158.231.ssh > cpe9050ca239d63-cm9050ca239d60.cpe.net.cable.rogers.com.55891: Flags [P.], seq 2808672:2808876, ack 1513, win 501, length 204
20:51:50.520199 IP 138.197.158.231.ssh > cpe9050ca239d63-cm9050ca239d60.cpe.net.cable.rogers.com.55891: Flags [P.], seq 2808876:2809080, ack 1513, win 501, length 204
20:51:50.520253 IP 138.197.158.231.ssh > cpe9050ca239d63-cm9050ca239d60.cpe.net.cable.rogers.com.55891: Flags [P.], seq 2809080:2809284, ack 1513, win 501, length 204
20:51:50.520309 IP 138.197.158.231.ssh > cpe9050ca239d63-cm9050ca239d60.cpe.net.cable.rogers.com.55891: Flags [P.], seq 2809284:2809488, ack 1513, win 501, length 204
20:51:50.520361 IP 138.197.158.231.ssh > cpe9050ca239d63-cm9050ca239d60.cpe.net.cable.rogers.com.55891: Flags [P.], seq 2809488:2809692, ack 1513, win 501, length 204
20:51:50.520413 IP 138.197.158.231.ssh > cpe9050ca239d63-cm9050ca239d60.cpe.net.cable.rogers.com.55891: Flags [P.], seq 2809692:2809896, ack 1513, win 501, length 204
20:51:50.520469 IP 138.197.158.231.ssh > cpe9050ca239d63-cm9050ca239d60.cpe.net.cable.rogers.com.55891: Flags [P.], seq 2809896:2810100, ack 1513, win 501, length 204
20:51:50.523575 IP cpe9050ca239d63-cm9050ca239d60.cpe.net.cable.rogers.com.55891 > 138.197.158.231.ssh: Flags [.], ack 2716076, win 4135, length 0
20:51:50.523615 IP 138.197.158.231.ssh > cpe9050ca239d63-cm9050ca239d60.cpe.net.cable.rogers.com.55891: Flags [P.], seq 2810100:2810304, ack 1513, win 501, length 204
20:51:50.523750 IP 138.197.158.231.ssh > cpe9050ca239d63-cm9050ca239d60.cpe.net.cable.rogers.com.55891: Flags [P.], seq 2810304:2810660, ack 1513, win 501, length 356
20:51:50.530633 IP cpe9050ca239d63-cm9050ca239d60.cpe.net.cable.rogers.com.55891 > 138.197.158.231.ssh: Flags [.], ack 2721788, win 4140, length 0
20:51:50.530706 IP 138.197.158.231.ssh > cpe9050ca239d63-cm9050ca239d60.cpe.net.cable.rogers.com.55891: Flags [P.], seq 2810660:2810864, ack 1513, win 501, length 204
20:51:50.530728 IP cpe9050ca239d63-cm9050ca239d60.cpe.net.cable.rogers.com.55891 > 138.197.158.231.ssh: Flags [P.], seq 1513:1549, ack 2721788, win 4140, length 36
20:51:50.530741 IP cpe9050ca239d63-cm9050ca239d60.cpe.net.cable.rogers.com.55891 > 138.197.158.231.ssh: Flags [.], ack 2728316, win 4140, length 0
20:51:50.530780 IP cpe9050ca239d63-cm9050ca239d60.cpe.net.cable.rogers.com.55891 > 138.197.158.231.ssh: Flags [.], ack 2730356, win 4140, length 0
20:51:50.530797 IP cpe9050ca239d63-cm9050ca239d60.cpe.net.cable.rogers.com.55891 > 138.197.158.231.ssh: Flags [.], ack 2735864, win 4140, length 0
20:51:50.530821 IP cpe9050ca239d63-cm9050ca239d60.cpe.net.cable.rogers.com.55891 > 138.197.158.231.ssh: Flags [.], ack 2736788, win 4136, length 0
20:51:50.530827 IP cpe9050ca239d63-cm9050ca239d60.cpe.net.cable.rogers.com.55891 > 138.197.158.231.ssh: Flags [.], ack 2737568, win 4140, length 0
20:51:50.530834 IP cpe9050ca239d63-cm9050ca239d60.cpe.net.cable.rogers.com.55891 > 138.197.158.231.ssh: Flags [.], ack 2742872, win 4140, length 0
20:51:50.530856 IP cpe9050ca239d63-cm9050ca239d60.cpe.net.cable.rogers.com.55891 > 138.197.158.231.ssh: Flags [.], ack 2743524, win 4137, length 0
20:51:50.530863 IP cpe9050ca239d63-cm9050ca239d60.cpe.net.cable.rogers.com.55891 > 138.197.158.231.ssh: Flags [.], ack 2744544, win 4140, length 0
20:51:50.530871 IP cpe9050ca239d63-cm9050ca239d60.cpe.net.cable.rogers.com.55891 > 138.197.158.231.ssh: Flags [.], ack 2746380, win 4140, length 0
20:51:50.530881 IP cpe9050ca239d63-cm9050ca239d60.cpe.net.cable.rogers.com.55891 > 138.197.158.231.ssh: Flags [.], ack 2746788, win 4138, length 0
20:51:50.530899 IP cpe9050ca239d63-cm9050ca239d60.cpe.net.cable.rogers.com.55891 > 138.197.158.231.ssh: Flags [.], ack 2747196, win 4137, length 0
20:51:50.530905 IP cpe9050ca239d63-cm9050ca239d60.cpe.net.cable.rogers.com.55891 > 138.197.158.231.ssh: Flags [.], ack 2752908, win 4140, length 0
20:51:50.530930 IP cpe9050ca239d63-cm9050ca239d60.cpe.net.cable.rogers.com.55891 > 138.197.158.231.ssh: Flags [.], ack 2759640, win 4140, length 0
20:51:50.530952 IP cpe9050ca239d63-cm9050ca239d60.cpe.net.cable.rogers.com.55891 > 138.197.158.231.ssh: Flags [.], ack 2759844, win 4139, length 0
20:51:50.530955 IP cpe9050ca239d63-cm9050ca239d60.cpe.net.cable.rogers.com.55891 > 138.197.158.231.ssh: Flags [.], ack 2762904, win 4140, length 0
20:51:50.530964 IP cpe9050ca239d63-cm9050ca239d60.cpe.net.cable.rogers.com.55891 > 138.197.158.231.ssh: Flags [.], ack 2763996, win 4136, length 0
20:51:50.530967 IP cpe9050ca239d63-cm9050ca239d60.cpe.net.cable.rogers.com.55891 > 138.197.158.231.ssh: Flags [.], ack 2767260, win 4140, length 0
20:51:50.530977 IP cpe9050ca239d63-cm9050ca239d60.cpe.net.cable.rogers.com.55891 > 138.197.158.231.ssh: Flags [.], ack 2771136, win 4140, length 0
20:51:50.530997 IP cpe9050ca239d63-cm9050ca239d60.cpe.net.cable.rogers.com.55891 > 138.197.158.231.ssh: Flags [.], ack 2775216, win 4140, length 0
20:51:50.531017 IP cpe9050ca239d63-cm9050ca239d60.cpe.net.cable.rogers.com.55891 > 138.197.158.231.ssh: Flags [.], ack 2781744, win 4140, length 0
20:51:50.531057 IP cpe9050ca239d63-cm9050ca239d60.cpe.net.cable.rogers.com.55891 > 138.197.158.231.ssh: Flags [.], ack 2781948, win 4139, length 0
20:51:50.531065 IP cpe9050ca239d63-cm9050ca239d60.cpe.net.cable.rogers.com.55891 > 138.197.158.231.ssh: Flags [P.], seq 1549:1585, ack 2781948, win 4139, length 36
20:51:50.531580 IP 138.197.158.231.ssh > cpe9050ca239d63-cm9050ca239d60.cpe.net.cable.rogers.com.55891: Flags [.], ack 1585, win 501, length 0
20:51:50.531680 IP 138.197.158.231.ssh > cpe9050ca239d63-cm9050ca239d60.cpe.net.cable.rogers.com.55891: Flags [P.], seq 2810864:2814652, ack 1585, win 501, length 3788
20:51:50.531791 IP 138.197.158.231.ssh > cpe9050ca239d63-cm9050ca239d60.cpe.net.cable.rogers.com.55891: Flags [P.], seq 2814652:2815000, ack 1585, win 501, length 348
20:51:50.531872 IP 138.197.158.231.ssh > cpe9050ca239d63-cm9050ca239d60.cpe.net.cable.rogers.com.55891: Flags [P.], seq 2815000:2815204, ack 1585, win 501, length 204
20:51:50.531952 IP 138.197.158.231.ssh > cpe9050ca239d63-cm9050ca239d60.cpe.net.cable.rogers.com.55891: Flags [P.], seq 2815204:2815408, ack 1585, win 501, length 204
20:51:50.532043 IP 138.197.158.231.ssh > cpe9050ca239d63-cm9050ca239d60.cpe.net.cable.rogers.com.55891: Flags [P.], seq 2815408:2815612, ack 1585, win 501, length 204
20:51:50.532128 IP 138.197.158.231.ssh > cpe9050ca239d63-cm9050ca239d60.cpe.net.cable.rogers.com.55891: Flags [P.], seq 2815612:2815816, ack 1585, win 501, length 204
20:51:50.532331 IP 138.197.158.231.ssh > cpe9050ca239d63-cm9050ca239d60.cpe.net.cable.rogers.com.55891: Flags [P.], seq 2815816:2816020, ack 1585, win 501, length 204
20:51:50.532446 IP 138.197.158.231.ssh > cpe9050ca239d63-cm9050ca239d60.cpe.net.cable.rogers.com.55891: Flags [P.], seq 2816020:2816224, ack 1585, win 501, length 204
20:51:50.532557 IP 138.197.158.231.ssh > cpe9050ca239d63-cm9050ca239d60.cpe.net.cable.rogers.com.55891: Flags [P.], seq 2816224:2816428, ack 1585, win 501, length 204
20:51:50.532631 IP 138.197.158.231.ssh > cpe9050ca239d63-cm9050ca239d60.cpe.net.cable.rogers.com.55891: Flags [P.], seq 2816428:2816632, ack 1585, win 501, length 204
20:51:50.532699 IP 138.197.158.231.ssh > cpe9050ca239d63-cm9050ca239d60.cpe.net.cable.rogers.com.55891: Flags [P.], seq 2816632:2816836, ack 1585, win 501, length 204
20:51:50.532765 IP 138.197.158.231.ssh > cpe9050ca239d63-cm9050ca239d60.cpe.net.cable.rogers.com.55891: Flags [P.], seq 2816836:2817040, ack 1585, win 501, length 204
20:51:50.532831 IP 138.197.158.231.ssh > cpe9050ca239d63-cm9050ca239d60.cpe.net.cable.rogers.com.55891: Flags [P.], seq 2817040:2817244, ack 1585, win 501, length 204
20:51:50.532910 IP 138.197.158.231.ssh > cpe9050ca239d63-cm9050ca239d60.cpe.net.cable.rogers.com.55891: Flags [P.], seq 2817244:2817448, ack 1585, win 501, length 204
20:51:50.533008 IP 138.197.158.231.ssh > cpe9050ca239d63-cm9050ca239d60.cpe.net.cable.rogers.com.55891: Flags [P.], seq 2817448:2817652, ack 1585, win 501, length 204
20:51:50.533094 IP 138.197.158.231.ssh > cpe9050ca239d63-cm9050ca239d60.cpe.net.cable.rogers.com.55891: Flags [P.], seq 2817652:2817856, ack 1585, win 501, length 204
20:51:50.533198 IP 138.197.158.231.ssh > cpe9050ca239d63-cm9050ca239d60.cpe.net.cable.rogers.com.55891: Flags [P.], seq 2817856:2818060, ack 1585, win 501, length 204
20:51:50.533292 IP 138.197.158.231.ssh > cpe9050ca239d63-cm9050ca239d60.cpe.net.cable.rogers.com.55891: Flags [P.], seq 2818060:2818264, ack 1585, win 501, length 204
20:51:50.533370 IP 138.197.158.231.ssh > cpe9050ca239d63-cm9050ca239d60.cpe.net.cable.rogers.com.55891: Flags [P.], seq 2818264:2818468, ack 1585, win 501, length 204
20:51:50.533452 IP 138.197.158.231.ssh > cpe9050ca239d63-cm9050ca239d60.cpe.net.cable.rogers.com.55891: Flags [P.], seq 2818468:2818672, ack 1585, win 501, length 204
20:51:50.533534 IP 138.197.158.231.ssh > cpe9050ca239d63-cm9050ca239d60.cpe.net.cable.rogers.com.55891: Flags [P.], seq 2818672:2818876, ack 1585, win 501, length 204
20:51:50.533614 IP 138.197.158.231.ssh > cpe9050ca239d63-cm9050ca239d60.cpe.net.cable.rogers.com.55891: Flags [P.], seq 2818876:2819080, ack 1585, win 501, length 204
20:51:50.533688 IP 138.197.158.231.ssh > cpe9050ca239d63-cm9050ca239d60.cpe.net.cable.rogers.com.55891: Flags [P.], seq 2819080:2819284, ack 1585, win 501, length 204
20:51:50.533763 IP 138.197.158.231.ssh > cpe9050ca239d63-cm9050ca239d60.cpe.net.cable.rogers.com.55891: Flags [P.], seq 2819284:2819488, ack 1585, win 501, length 204
20:51:50.533836 IP 138.197.158.231.ssh > cpe9050ca239d63-cm9050ca239d60.cpe.net.cable.rogers.com.55891: Flags [P.], seq 2819488:2819692, ack 1585, win 501, length 204
20:51:50.533910 IP 138.197.158.231.ssh > cpe9050ca239d63-cm9050ca239d60.cpe.net.cable.rogers.com.55891: Flags [P.], seq 2819692:2819896, ack 1585, win 501, length 204
20:51:50.533983 IP 138.197.158.231.ssh > cpe9050ca239d63-cm9050ca239d60.cpe.net.cable.rogers.com.55891: Flags [P.], seq 2819896:2820100, ack 1585, win 501, length 204
20:51:50.534057 IP 138.197.158.231.ssh > cpe9050ca239d63-cm9050ca239d60.cpe.net.cable.rogers.com.55891: Flags [P.], seq 2820100:2820304, ack 1585, win 501, length 204
20:51:50.534139 IP 138.197.158.231.ssh > cpe9050ca239d63-cm9050ca239d60.cpe.net.cable.rogers.com.55891: Flags [P.], seq 2820304:2820508, ack 1585, win 501, length 204
20:51:50.534225 IP 138.197.158.231.ssh > cpe9050ca239d63-cm9050ca239d60.cpe.net.cable.rogers.com.55891: Flags [P.], seq 2820508:2820712, ack 1585, win 501, length 204
20:51:50.534298 IP 138.197.158.231.ssh > cpe9050ca239d63-cm9050ca239d60.cpe.net.cable.rogers.com.55891: Flags [P.], seq 2820712:2820916, ack 1585, win 501, length 204
20:51:50.534372 IP 138.197.158.231.ssh > cpe9050ca239d63-cm9050ca239d60.cpe.net.cable.rogers.com.55891: Flags [P.], seq 2820916:2821120, ack 1585, win 501, length 204
20:51:50.534446 IP 138.197.158.231.ssh > cpe9050ca239d63-cm9050ca239d60.cpe.net.cable.rogers.com.55891: Flags [P.], seq 2821120:2821324, ack 1585, win 501, length 204
20:51:50.534519 IP 138.197.158.231.ssh > cpe9050ca239d63-cm9050ca239d60.cpe.net.cable.rogers.com.55891: Flags [P.], seq 2821324:2821528, ack 1585, win 501, length 204
20:51:50.534595 IP 138.197.158.231.ssh > cpe9050ca239d63-cm9050ca239d60.cpe.net.cable.rogers.com.55891: Flags [P.], seq 2821528:2821732, ack 1585, win 501, length 204
20:51:50.534668 IP 138.197.158.231.ssh > cpe9050ca239d63-cm9050ca239d60.cpe.net.cable.rogers.com.55891: Flags [P.], seq 2821732:2821936, ack 1585, win 501, length 204
20:51:50.534744 IP 138.197.158.231.ssh > cpe9050ca239d63-cm9050ca239d60.cpe.net.cable.rogers.com.55891: Flags [P.], seq 2821936:2822140, ack 1585, win 501, length 204
20:51:50.534820 IP 138.197.158.231.ssh > cpe9050ca239d63-cm9050ca239d60.cpe.net.cable.rogers.com.55891: Flags [P.], seq 2822140:2822344, ack 1585, win 501, length 204
20:51:50.534892 IP 138.197.158.231.ssh > cpe9050ca239d63-cm9050ca239d60.cpe.net.cable.rogers.com.55891: Flags [P.], seq 2822344:2822548, ack 1585, win 501, length 204
20:51:50.534956 IP 138.197.158.231.ssh > cpe9050ca239d63-cm9050ca239d60.cpe.net.cable.rogers.com.55891: Flags [P.], seq 2822548:2822752, ack 1585, win 501, length 204
20:51:50.535013 IP 138.197.158.231.ssh > cpe9050ca239d63-cm9050ca239d60.cpe.net.cable.rogers.com.55891: Flags [P.], seq 2822752:2822956, ack 1585, win 501, length 204
20:51:50.535072 IP 138.197.158.231.ssh > cpe9050ca239d63-cm9050ca239d60.cpe.net.cable.rogers.com.55891: Flags [P.], seq 2822956:2823160, ack 1585, win 501, length 204
20:51:50.535129 IP 138.197.158.231.ssh > cpe9050ca239d63-cm9050ca239d60.cpe.net.cable.rogers.com.55891: Flags [P.], seq 2823160:2823364, ack 1585, win 501, length 204
20:51:50.535210 IP 138.197.158.231.ssh > cpe9050ca239d63-cm9050ca239d60.cpe.net.cable.rogers.com.55891: Flags [P.], seq 2823364:2823568, ack 1585, win 501, length 204
20:51:50.535314 IP 138.197.158.231.ssh > cpe9050ca239d63-cm9050ca239d60.cpe.net.cable.rogers.com.55891: Flags [P.], seq 2823568:2823772, ack 1585, win 501, length 204
20:51:50.535384 IP 138.197.158.231.ssh > cpe9050ca239d63-cm9050ca239d60.cpe.net.cable.rogers.com.55891: Flags [P.], seq 2823772:2823976, ack 1585, win 501, length 204
20:51:50.535443 IP 138.197.158.231.ssh > cpe9050ca239d63-cm9050ca239d60.cpe.net.cable.rogers.com.55891: Flags [P.], seq 2823976:2824180, ack 1585, win 501, length 204
20:51:50.535498 IP 138.197.158.231.ssh > cpe9050ca239d63-cm9050ca239d60.cpe.net.cable.rogers.com.55891: Flags [P.], seq 2824180:2824384, ack 1585, win 501, length 204
20:51:50.535556 IP 138.197.158.231.ssh > cpe9050ca239d63-cm9050ca239d60.cpe.net.cable.rogers.com.55891: Flags [P.], seq 2824384:2824588, ack 1585, win 501, length 204
20:51:50.535608 IP 138.197.158.231.ssh > cpe9050ca239d63-cm9050ca239d60.cpe.net.cable.rogers.com.55891: Flags [P.], seq 2824588:2824792, ack 1585, win 501, length 204
20:51:50.535662 IP 138.197.158.231.ssh > cpe9050ca239d63-cm9050ca239d60.cpe.net.cable.rogers.com.55891: Flags [P.], seq 2824792:2824996, ack 1585, win 501, length 204
20:51:50.535719 IP 138.197.158.231.ssh > cpe9050ca239d63-cm9050ca239d60.cpe.net.cable.rogers.com.55891: Flags [P.], seq 2824996:2825200, ack 1585, win 501, length 204
20:51:50.535773 IP 138.197.158.231.ssh > cpe9050ca239d63-cm9050ca239d60.cpe.net.cable.rogers.com.55891: Flags [P.], seq 2825200:2825404, ack 1585, win 501, length 204
20:51:50.535825 IP 138.197.158.231.ssh > cpe9050ca239d63-cm9050ca239d60.cpe.net.cable.rogers.com.55891: Flags [P.], seq 2825404:2825608, ack 1585, win 501, length 204
20:51:50.535881 IP 138.197.158.231.ssh > cpe9050ca239d63-cm9050ca239d60.cpe.net.cable.rogers.com.55891: Flags [P.], seq 2825608:2825812, ack 1585, win 501, length 204
20:51:50.535934 IP 138.197.158.231.ssh > cpe9050ca239d63-cm9050ca239d60.cpe.net.cable.rogers.com.55891: Flags [P.], seq 2825812:2826016, ack 1585, win 501, length 204
20:51:50.535991 IP 138.197.158.231.ssh > cpe9050ca239d63-cm9050ca239d60.cpe.net.cable.rogers.com.55891: Flags [P.], seq 2826016:2826220, ack 1585, win 501, length 204
20:51:50.536048 IP 138.197.158.231.ssh > cpe9050ca239d63-cm9050ca239d60.cpe.net.cable.rogers.com.55891: Flags [P.], seq 2826220:2826424, ack 1585, win 501, length 204
20:51:50.536104 IP 138.197.158.231.ssh > cpe9050ca239d63-cm9050ca239d60.cpe.net.cable.rogers.com.55891: Flags [P.], seq 2826424:2826628, ack 1585, win 501, length 204
20:51:50.536157 IP 138.197.158.231.ssh > cpe9050ca239d63-cm9050ca239d60.cpe.net.cable.rogers.com.55891: Flags [P.], seq 2826628:2826832, ack 1585, win 501, length 204
20:51:50.536214 IP 138.197.158.231.ssh > cpe9050ca239d63-cm9050ca239d60.cpe.net.cable.rogers.com.55891: Flags [P.], seq 2826832:2827036, ack 1585, win 501, length 204
20:51:50.536272 IP 138.197.158.231.ssh > cpe9050ca239d63-cm9050ca239d60.cpe.net.cable.rogers.com.55891: Flags [P.], seq 2827036:2827240, ack 1585, win 501, length 204
20:51:50.536327 IP 138.197.158.231.ssh > cpe9050ca239d63-cm9050ca239d60.cpe.net.cable.rogers.com.55891: Flags [P.], seq 2827240:2827444, ack 1585, win 501, length 204
20:51:50.536380 IP 138.197.158.231.ssh > cpe9050ca239d63-cm9050ca239d60.cpe.net.cable.rogers.com.55891: Flags [P.], seq 2827444:2827648, ack 1585, win 501, length 204
20:51:50.536434 IP 138.197.158.231.ssh > cpe9050ca239d63-cm9050ca239d60.cpe.net.cable.rogers.com.55891: Flags [P.], seq 2827648:2827852, ack 1585, win 501, length 204
20:51:50.536486 IP 138.197.158.231.ssh > cpe9050ca239d63-cm9050ca239d60.cpe.net.cable.rogers.com.55891: Flags [P.], seq 2827852:2828056, ack 1585, win 501, length 204
20:51:50.536543 IP 138.197.158.231.ssh > cpe9050ca239d63-cm9050ca239d60.cpe.net.cable.rogers.com.55891: Flags [P.], seq 2828056:2828260, ack 1585, win 501, length 204
20:51:50.536595 IP 138.197.158.231.ssh > cpe9050ca239d63-cm9050ca239d60.cpe.net.cable.rogers.com.55891: Flags [P.], seq 2828260:2828464, ack 1585, win 501, length 204
20:51:50.536656 IP 138.197.158.231.ssh > cpe9050ca239d63-cm9050ca239d60.cpe.net.cable.rogers.com.55891: Flags [P.], seq 2828464:2828668, ack 1585, win 501, length 204
20:51:50.536710 IP 138.197.158.231.ssh > cpe9050ca239d63-cm9050ca239d60.cpe.net.cable.rogers.com.55891: Flags [P.], seq 2828668:2828872, ack 1585, win 501, length 204
20:51:50.536763 IP 138.197.158.231.ssh > cpe9050ca239d63-cm9050ca239d60.cpe.net.cable.rogers.com.55891: Flags [P.], seq 2828872:2829076, ack 1585, win 501, length 204
20:51:50.536887 IP 138.197.158.231.ssh > cpe9050ca239d63-cm9050ca239d60.cpe.net.cable.rogers.com.55891: Flags [P.], seq 2829076:2829280, ack 1585, win 501, length 204
20:51:50.536954 IP 138.197.158.231.ssh > cpe9050ca239d63-cm9050ca239d60.cpe.net.cable.rogers.com.55891: Flags [P.], seq 2829280:2829484, ack 1585, win 501, length 204
