root@lamp-ubuntu-s-1vcpu-1gb-tor1-01:~# tcpdump -c 5 -i eth0
tcpdump: verbose output suppressed, use -v or -vv for full protocol decode
listening on eth0, link-type EN10MB (Ethernet), capture size 262144 bytes
20:56:48.324163 IP 138.197.158.231.ssh > cpe9050ca239d63-cm9050ca239d60.cpe.net.cable.rogers.com.55891: Flags [P.], seq 4217842660:4217842768, ack 4080930828, win 501, length 108
20:56:48.324226 IP 138.197.158.231.ssh > cpe9050ca239d63-cm9050ca239d60.cpe.net.cable.rogers.com.55891: Flags [P.], seq 108:144, ack 1, win 501, length 36
20:56:48.324275 IP 138.197.158.231.ssh > cpe9050ca239d63-cm9050ca239d60.cpe.net.cable.rogers.com.55891: Flags [P.], seq 144:252, ack 1, win 501, length 108
20:56:48.324315 IP 138.197.158.231.ssh > cpe9050ca239d63-cm9050ca239d60.cpe.net.cable.rogers.com.55891: Flags [P.], seq 252:288, ack 1, win 501, length 36
20:56:48.324709 IP 138.197.158.231.45239 > dns.google.domain: 45640+ PTR? 83.102.237.99.in-addr.arpa. (44)
5 packets captured
22 packets received by filter
0 packets dropped by kernel
