root@lamp-ubuntu-s-1vcpu-1gb-tor1-01:~# tcpdump -n -i eth0

21:10:16.064656 IP 138.197.158.231.22 > 99.237.102.83.55891: Flags [P.], seq 6942756:6942920, ack 3745, win 501, length 164
21:10:16.064714 IP 138.197.158.231.22 > 99.237.102.83.55891: Flags [P.], seq 6942920:6943084, ack 3745, win 501, length 164
21:10:16.064782 IP 138.197.158.231.22 > 99.237.102.83.55891: Flags [P.], seq 6943084:6943248, ack 3745, win 501, length 164
21:10:16.064851 IP 138.197.158.231.22 > 99.237.102.83.55891: Flags [P.], seq 6943248:6943412, ack 3745, win 501, length 164
21:10:16.064932 IP 138.197.158.231.22 > 99.237.102.83.55891: Flags [P.], seq 6943412:6943576, ack 3745, win 501, length 164
21:10:16.064993 IP 138.197.158.231.22 > 99.237.102.83.55891: Flags [P.], seq 6943576:6943740, ack 3745, win 501, length 164
21:10:16.065052 IP 138.197.158.231.22 > 99.237.102.83.55891: Flags [P.], seq 6943740:6943904, ack 3745, win 501, length 164
21:10:16.065106 IP 138.197.158.231.22 > 99.237.102.83.55891: Flags [P.], seq 6943904:6944068, ack 3745, win 501, length 164
21:10:16.065165 IP 138.197.158.231.22 > 99.237.102.83.55891: Flags [P.], seq 6944068:6944232, ack 3745, win 501, length 164
21:10:16.065220 IP 138.197.158.231.22 > 99.237.102.83.55891: Flags [P.], seq 6944232:6944396, ack 3745, win 501, length 164
21:10:16.065291 IP 138.197.158.231.22 > 99.237.102.83.55891: Flags [P.], seq 6944396:6944560, ack 3745, win 501, length 164
21:10:16.065361 IP 138.197.158.231.22 > 99.237.102.83.55891: Flags [P.], seq 6944560:6944724, ack 3745, win 501, length 164
21:10:16.065433 IP 138.197.158.231.22 > 99.237.102.83.55891: Flags [P.], seq 6944724:6944888, ack 3745, win 501, length 164
21:10:16.065498 IP 138.197.158.231.22 > 99.237.102.83.55891: Flags [P.], seq 6944888:6945052, ack 3745, win 501, length 164
21:10:16.065556 IP 138.197.158.231.22 > 99.237.102.83.55891: Flags [P.], seq 6945052:6945216, ack 3745, win 501, length 164
21:10:16.065614 IP 138.197.158.231.22 > 99.237.102.83.55891: Flags [P.], seq 6945216:6945380, ack 3745, win 501, length 164
21:10:16.065668 IP 138.197.158.231.22 > 99.237.102.83.55891: Flags [P.], seq 6945380:6945544, ack 3745, win 501, length 164
21:10:16.065725 IP 138.197.158.231.22 > 99.237.102.83.55891: Flags [P.], seq 6945544:6945708, ack 3745, win 501, length 164
21:10:16.065782 IP 138.197.158.231.22 > 99.237.102.83.55891: Flags [P.], seq 6945708:6945872, ack 3745, win 501, length 164
21:10:16.065847 IP 138.197.158.231.22 > 99.237.102.83.55891: Flags [P.], seq 6945872:6946036, ack 3745, win 501, length 164
21:10:16.065918 IP 138.197.158.231.22 > 99.237.102.83.55891: Flags [P.], seq 6946036:6946200, ack 3745, win 501, length 164
21:10:16.065995 IP 138.197.158.231.22 > 99.237.102.83.55891: Flags [P.], seq 6946200:6946364, ack 3745, win 501, length 164
21:10:16.066012 IP 99.237.102.83.55891 > 138.197.158.231.22: Flags [.], ack 6868196, win 4139, length 0
21:10:16.066024 IP 99.237.102.83.55891 > 138.197.158.231.22: Flags [.], ack 6869672, win 4140, length 0
21:10:16.066028 IP 99.237.102.83.55891 > 138.197.158.231.22: Flags [.], ack 6870164, win 4138, length 0
21:10:16.066133 IP 138.197.158.231.22 > 99.237.102.83.55891: Flags [P.], seq 6946364:6946840, ack 3745, win 501, length 476
21:10:16.066217 IP 138.197.158.231.22 > 99.237.102.83.55891: Flags [P.], seq 6946840:6947004, ack 3745, win 501, length 164
21:10:16.066296 IP 138.197.158.231.22 > 99.237.102.83.55891: Flags [P.], seq 6947004:6947168, ack 3745, win 501, length 164
21:10:16.066371 IP 138.197.158.231.22 > 99.237.102.83.55891: Flags [P.], seq 6947168:6947332, ack 3745, win 501, length 164
21:10:16.066438 IP 138.197.158.231.22 > 99.237.102.83.55891: Flags [P.], seq 6947332:6947496, ack 3745, win 501, length 164
21:10:16.066507 IP 138.197.158.231.22 > 99.237.102.83.55891: Flags [P.], seq 6947496:6947660, ack 3745, win 501, length 164
21:10:16.066580 IP 138.197.158.231.22 > 99.237.102.83.55891: Flags [P.], seq 6947660:6947824, ack 3745, win 501, length 164
21:10:16.066649 IP 138.197.158.231.22 > 99.237.102.83.55891: Flags [P.], seq 6947824:6947988, ack 3745, win 501, length 164
21:10:16.066725 IP 138.197.158.231.22 > 99.237.102.83.55891: Flags [P.], seq 6947988:6948152, ack 3745, win 501, length 164
21:10:16.066795 IP 138.197.158.231.22 > 99.237.102.83.55891: Flags [P.], seq 6948152:6948316, ack 3745, win 501, length 164
21:10:16.066856 IP 138.197.158.231.22 > 99.237.102.83.55891: Flags [P.], seq 6948316:6948480, ack 3745, win 501, length 164
21:10:16.066916 IP 138.197.158.231.22 > 99.237.102.83.55891: Flags [P.], seq 6948480:6948644, ack 3745, win 501, length 164
21:10:16.066978 IP 138.197.158.231.22 > 99.237.102.83.55891: Flags [P.], seq 6948644:6948808, ack 3745, win 501, length 164
21:10:16.067049 IP 138.197.158.231.22 > 99.237.102.83.55891: Flags [P.], seq 6948808:6948972, ack 3745, win 501, length 164
21:10:16.067110 IP 138.197.158.231.22 > 99.237.102.83.55891: Flags [P.], seq 6948972:6949136, ack 3745, win 501, length 164
21:10:16.067142 IP 99.237.102.83.55891 > 138.197.158.231.22: Flags [.], ack 6870492, win 4137, length 0
21:10:16.067152 IP 99.237.102.83.55891 > 138.197.158.231.22: Flags [.], ack 6872788, win 4140, length 0
21:10:16.067163 IP 99.237.102.83.55891 > 138.197.158.231.22: Flags [.], ack 6873280, win 4138, length 0
21:10:16.067166 IP 99.237.102.83.55891 > 138.197.158.231.22: Flags [.], ack 6873444, win 4137, length 0
21:10:16.067169 IP 99.237.102.83.55891 > 138.197.158.231.22: Flags [.], ack 6873772, win 4136, length 0
21:10:16.067172 IP 99.237.102.83.55891 > 138.197.158.231.22: Flags [.], ack 6878528, win 4140, length 0
21:10:16.067306 IP 138.197.158.231.22 > 99.237.102.83.55891: Flags [P.], seq 6949136:6949932, ack 3745, win 501, length 796
21:10:16.067388 IP 138.197.158.231.22 > 99.237.102.83.55891: Flags [P.], seq 6949932:6950096, ack 3745, win 501, length 164
21:10:16.067456 IP 138.197.158.231.22 > 99.237.102.83.55891: Flags [P.], seq 6950096:6950260, ack 3745, win 501, length 164
21:10:16.067517 IP 138.197.158.231.22 > 99.237.102.83.55891: Flags [P.], seq 6950260:6950424, ack 3745, win 501, length 164
21:10:16.067574 IP 138.197.158.231.22 > 99.237.102.83.55891: Flags [P.], seq 6950424:6950588, ack 3745, win 501, length 164
21:10:16.067632 IP 138.197.158.231.22 > 99.237.102.83.55891: Flags [P.], seq 6950588:6950752, ack 3745, win 501, length 164
21:10:16.067698 IP 138.197.158.231.22 > 99.237.102.83.55891: Flags [P.], seq 6950752:6950916, ack 3745, win 501, length 164
21:10:16.067770 IP 138.197.158.231.22 > 99.237.102.83.55891: Flags [P.], seq 6950916:6951080, ack 3745, win 501, length 164
21:10:16.067833 IP 138.197.158.231.22 > 99.237.102.83.55891: Flags [P.], seq 6951080:6951244, ack 3745, win 501, length 164
21:10:16.067892 IP 138.197.158.231.22 > 99.237.102.83.55891: Flags [P.], seq 6951244:6951408, ack 3745, win 501, length 164
21:10:16.067957 IP 138.197.158.231.22 > 99.237.102.83.55891: Flags [P.], seq 6951408:6951572, ack 3745, win 501, length 164
21:10:16.068022 IP 138.197.158.231.22 > 99.237.102.83.55891: Flags [P.], seq 6951572:6951736, ack 3745, win 501, length 164
21:10:16.068090 IP 138.197.158.231.22 > 99.237.102.83.55891: Flags [P.], seq 6951736:6951900, ack 3745, win 501, length 164
21:10:16.068147 IP 138.197.158.231.22 > 99.237.102.83.55891: Flags [P.], seq 6951900:6952064, ack 3745, win 501, length 164
21:10:16.068206 IP 138.197.158.231.22 > 99.237.102.83.55891: Flags [P.], seq 6952064:6952228, ack 3745, win 501, length 164
21:10:16.068261 IP 138.197.158.231.22 > 99.237.102.83.55891: Flags [P.], seq 6952228:6952392, ack 3745, win 501, length 164
21:10:16.068329 IP 138.197.158.231.22 > 99.237.102.83.55891: Flags [P.], seq 6952392:6952556, ack 3745, win 501, length 164
21:10:16.068389 IP 138.197.158.231.22 > 99.237.102.83.55891: Flags [P.], seq 6952556:6952720, ack 3745, win 501, length 164
21:10:16.068445 IP 138.197.158.231.22 > 99.237.102.83.55891: Flags [P.], seq 6952720:6952884, ack 3745, win 501, length 164
21:10:16.068520 IP 138.197.158.231.22 > 99.237.102.83.55891: Flags [P.], seq 6952884:6953048, ack 3745, win 501, length 164
21:10:16.068602 IP 138.197.158.231.22 > 99.237.102.83.55891: Flags [P.], seq 6953048:6953212, ack 3745, win 501, length 164
21:10:16.068677 IP 138.197.158.231.22 > 99.237.102.83.55891: Flags [P.], seq 6953212:6953376, ack 3745, win 501, length 164
21:10:16.068757 IP 138.197.158.231.22 > 99.237.102.83.55891: Flags [P.], seq 6953376:6953540, ack 3745, win 501, length 164
21:10:16.068819 IP 138.197.158.231.22 > 99.237.102.83.55891: Flags [P.], seq 6953540:6953704, ack 3745, win 501, length 164
21:10:16.068877 IP 138.197.158.231.22 > 99.237.102.83.55891: Flags [P.], seq 6953704:6953868, ack 3745, win 501, length 164
21:10:16.068933 IP 138.197.158.231.22 > 99.237.102.83.55891: Flags [P.], seq 6953868:6954032, ack 3745, win 501, length 164
21:10:16.068988 IP 138.197.158.231.22 > 99.237.102.83.55891: Flags [P.], seq 6954032:6954196, ack 3745, win 501, length 164
21:10:16.069042 IP 138.197.158.231.22 > 99.237.102.83.55891: Flags [P.], seq 6954196:6954360, ack 3745, win 501, length 164
21:10:16.069144 IP 138.197.158.231.22 > 99.237.102.83.55891: Flags [P.], seq 6954360:6954524, ack 3745, win 501, length 164
21:10:16.069202 IP 138.197.158.231.22 > 99.237.102.83.55891: Flags [P.], seq 6954524:6954688, ack 3745, win 501, length 164
21:10:16.069269 IP 138.197.158.231.22 > 99.237.102.83.55891: Flags [P.], seq 6954688:6954852, ack 3745, win 501, length 164
21:10:16.069342 IP 138.197.158.231.22 > 99.237.102.83.55891: Flags [P.], seq 6954852:6955016, ack 3745, win 501, length 164
21:10:16.069410 IP 138.197.158.231.22 > 99.237.102.83.55891: Flags [P.], seq 6955016:6955180, ack 3745, win 501, length 164
21:10:16.069491 IP 138.197.158.231.22 > 99.237.102.83.55891: Flags [P.], seq 6955180:6955344, ack 3745, win 501, length 164
21:10:16.069564 IP 138.197.158.231.22 > 99.237.102.83.55891: Flags [P.], seq 6955344:6955508, ack 3745, win 501, length 164
21:10:16.069627 IP 138.197.158.231.22 > 99.237.102.83.55891: Flags [P.], seq 6955508:6955672, ack 3745, win 501, length 164
21:10:16.069687 IP 138.197.158.231.22 > 99.237.102.83.55891: Flags [P.], seq 6955672:6955836, ack 3745, win 501, length 164
21:10:16.069742 IP 138.197.158.231.22 > 99.237.102.83.55891: Flags [P.], seq 6955836:6956000, ack 3745, win 501, length 164
21:10:16.069795 IP 138.197.158.231.22 > 99.237.102.83.55891: Flags [P.], seq 6956000:6956164, ack 3745, win 501, length 164
21:10:16.069861 IP 138.197.158.231.22 > 99.237.102.83.55891: Flags [P.], seq 6956164:6956328, ack 3745, win 501, length 164
21:10:16.069925 IP 138.197.158.231.22 > 99.237.102.83.55891: Flags [P.], seq 6956328:6956492, ack 3745, win 501, length 164
21:10:16.069983 IP 138.197.158.231.22 > 99.237.102.83.55891: Flags [P.], seq 6956492:6956656, ack 3745, win 501, length 164
21:10:16.070038 IP 138.197.158.231.22 > 99.237.102.83.55891: Flags [P.], seq 6956656:6956820, ack 3745, win 501, length 164
21:10:16.070054 IP 99.237.102.83.55891 > 138.197.158.231.22: Flags [.], ack 6880168, win 4140, length 0
21:10:16.070062 IP 99.237.102.83.55891 > 138.197.158.231.22: Flags [.], ack 6880332, win 4139, length 0
21:10:16.070064 IP 99.237.102.83.55891 > 138.197.158.231.22: Flags [.], ack 6880660, win 4138, length 0
21:10:16.070072 IP 99.237.102.83.55891 > 138.197.158.231.22: Flags [.], ack 6880988, win 4137, length 0
21:10:16.070076 IP 99.237.102.83.55891 > 138.197.158.231.22: Flags [.], ack 6882136, win 4140, length 0
21:10:16.070078 IP 99.237.102.83.55891 > 138.197.158.231.22: Flags [.], ack 6882932, win 4137, length 0
21:10:16.070080 IP 99.237.102.83.55891 > 138.197.158.231.22: Flags [.], ack 6886048, win 4140, length 0
21:10:16.070082 IP 99.237.102.83.55891 > 138.197.158.231.22: Flags [.], ack 6890312, win 4140, length 0
21:10:16.070083 IP 99.237.102.83.55891 > 138.197.158.231.22: Flags [.], ack 6891460, win 4135, length 0
21:10:16.070085 IP 99.237.102.83.55891 > 138.197.158.231.22: Flags [.], ack 6896708, win 4140, length 0
21:10:16.070087 IP 99.237.102.83.55891 > 138.197.158.231.22: Flags [.], ack 6899824, win 4140, length 0
21:10:16.070089 IP 99.237.102.83.55891 > 138.197.158.231.22: Flags [.], ack 6902940, win 4140, length 0
21:10:16.070319 IP 138.197.158.231.22 > 99.237.102.83.55891: Flags [P.], seq 6956820:6958240, ack 3745, win 501, length 1420
21:10:16.070396 IP 138.197.158.231.22 > 99.237.102.83.55891: Flags [P.], seq 6958240:6958404, ack 3745, win 501, length 164
21:10:16.070651 IP 138.197.158.231.22 > 99.237.102.83.55891: Flags [P.], seq 6958404:6958568, ack 3745, win 501, length 164
21:10:16.070768 IP 99.237.102.83.55891 > 138.197.158.231.22: Flags [P.], seq 3745:3781, ack 6902940, win 4140, length 36
21:10:16.070782 IP 99.237.102.83.55891 > 138.197.158.231.22: Flags [.], ack 6906604, win 4140, length 0
21:10:16.070864 IP 138.197.158.231.22 > 99.237.102.83.55891: Flags [P.], seq 6958568:6958732, ack 3781, win 501, length 164
21:10:16.070937 IP 138.197.158.231.22 > 99.237.102.83.55891: Flags [P.], seq 6958732:6959000, ack 3781, win 501, length 268
21:10:16.070993 IP 138.197.158.231.22 > 99.237.102.83.55891: Flags [P.], seq 6959000:6959164, ack 3781, win 501, length 164
21:10:16.071023 IP 138.197.158.231.22 > 99.237.102.83.55891: Flags [P.], seq 6959164:6959328, ack 3781, win 501, length 164
21:10:16.071089 IP 138.197.158.231.22 > 99.237.102.83.55891: Flags [P.], seq 6959328:6959612, ack 3781, win 501, length 284
21:10:16.071146 IP 138.197.158.231.22 > 99.237.102.83.55891: Flags [P.], seq 6959612:6959776, ack 3781, win 501, length 164
21:10:16.071203 IP 138.197.158.231.22 > 99.237.102.83.55891: Flags [P.], seq 6959776:6959940, ack 3781, win 501, length 164
21:10:16.071283 IP 138.197.158.231.22 > 99.237.102.83.55891: Flags [P.], seq 6959940:6960104, ack 3781, win 501, length 164
21:10:16.071340 IP 138.197.158.231.22 > 99.237.102.83.55891: Flags [P.], seq 6960104:6960268, ack 3781, win 501, length 164
21:10:16.071400 IP 138.197.158.231.22 > 99.237.102.83.55891: Flags [P.], seq 6960268:6960432, ack 3781, win 501, length 164
21:10:16.071453 IP 138.197.158.231.22 > 99.237.102.83.55891: Flags [P.], seq 6960432:6960596, ack 3781, win 501, length 164
21:10:16.071506 IP 138.197.158.231.22 > 99.237.102.83.55891: Flags [P.], seq 6960596:6960760, ack 3781, win 501, length 164
21:10:16.071560 IP 138.197.158.231.22 > 99.237.102.83.55891: Flags [P.], seq 6960760:6960924, ack 3781, win 501, length 164
21:10:16.071617 IP 138.197.158.231.22 > 99.237.102.83.55891: Flags [P.], seq 6960924:6961088, ack 3781, win 501, length 164
21:10:16.071672 IP 138.197.158.231.22 > 99.237.102.83.55891: Flags [P.], seq 6961088:6961252, ack 3781, win 501, length 164
21:10:16.071729 IP 138.197.158.231.22 > 99.237.102.83.55891: Flags [P.], seq 6961252:6961416, ack 3781, win 501, length 164
21:10:16.071782 IP 138.197.158.231.22 > 99.237.102.83.55891: Flags [P.], seq 6961416:6961580, ack 3781, win 501, length 164
21:10:16.071872 IP 138.197.158.231.22 > 99.237.102.83.55891: Flags [P.], seq 6961580:6961744, ack 3781, win 501, length 164
21:10:16.071937 IP 138.197.158.231.22 > 99.237.102.83.55891: Flags [P.], seq 6961744:6961908, ack 3781, win 501, length 164
21:10:16.071994 IP 138.197.158.231.22 > 99.237.102.83.55891: Flags [P.], seq 6961908:6962072, ack 3781, win 501, length 164
21:10:16.072063 IP 138.197.158.231.22 > 99.237.102.83.55891: Flags [P.], seq 6962072:6962236, ack 3781, win 501, length 164
21:10:16.072120 IP 138.197.158.231.22 > 99.237.102.83.55891: Flags [P.], seq 6962236:6962400, ack 3781, win 501, length 164
21:10:16.072177 IP 138.197.158.231.22 > 99.237.102.83.55891: Flags [P.], seq 6962400:6962564, ack 3781, win 501, length 164
21:10:16.072231 IP 138.197.158.231.22 > 99.237.102.83.55891: Flags [P.], seq 6962564:6962728, ack 3781, win 501, length 164
21:10:16.072289 IP 138.197.158.231.22 > 99.237.102.83.55891: Flags [P.], seq 6962728:6962892, ack 3781, win 501, length 164
21:10:16.072344 IP 138.197.158.231.22 > 99.237.102.83.55891: Flags [P.], seq 6962892:6963056, ack 3781, win 501, length 164
21:10:16.072397 IP 138.197.158.231.22 > 99.237.102.83.55891: Flags [P.], seq 6963056:6963220, ack 3781, win 501, length 164
21:10:16.072453 IP 138.197.158.231.22 > 99.237.102.83.55891: Flags [P.], seq 6963220:6963384, ack 3781, win 501, length 164
21:10:16.072507 IP 138.197.158.231.22 > 99.237.102.83.55891: Flags [P.], seq 6963384:6963548, ack 3781, win 501, length 164
21:10:16.072563 IP 138.197.158.231.22 > 99.237.102.83.55891: Flags [P.], seq 6963548:6963712, ack 3781, win 501, length 164
21:10:16.072616 IP 138.197.158.231.22 > 99.237.102.83.55891: Flags [P.], seq 6963712:6963876, ack 3781, win 501, length 164
21:10:16.072669 IP 138.197.158.231.22 > 99.237.102.83.55891: Flags [P.], seq 6963876:6964040, ack 3781, win 501, length 164
21:10:16.072724 IP 138.197.158.231.22 > 99.237.102.83.55891: Flags [P.], seq 6964040:6964204, ack 3781, win 501, length 164
21:10:16.072821 IP 138.197.158.231.22 > 99.237.102.83.55891: Flags [P.], seq 6964204:6964368, ack 3781, win 501, length 164
21:10:16.072880 IP 138.197.158.231.22 > 99.237.102.83.55891: Flags [P.], seq 6964368:6964532, ack 3781, win 501, length 164
21:10:16.072942 IP 138.197.158.231.22 > 99.237.102.83.55891: Flags [P.], seq 6964532:6964696, ack 3781, win 501, length 164
21:10:16.073020 IP 138.197.158.231.22 > 99.237.102.83.55891: Flags [P.], seq 6964696:6964860, ack 3781, win 501, length 164
21:10:16.073085 IP 138.197.158.231.22 > 99.237.102.83.55891: Flags [P.], seq 6964860:6965024, ack 3781, win 501, length 164
21:10:16.073151 IP 138.197.158.231.22 > 99.237.102.83.55891: Flags [P.], seq 6965024:6965188, ack 3781, win 501, length 164
21:10:16.073206 IP 138.197.158.231.22 > 99.237.102.83.55891: Flags [P.], seq 6965188:6965352, ack 3781, win 501, length 164
21:10:16.073272 IP 138.197.158.231.22 > 99.237.102.83.55891: Flags [P.], seq 6965352:6965516, ack 3781, win 501, length 164
21:10:16.073336 IP 138.197.158.231.22 > 99.237.102.83.55891: Flags [P.], seq 6965516:6965680, ack 3781, win 501, length 164
21:10:16.073399 IP 138.197.158.231.22 > 99.237.102.83.55891: Flags [P.], seq 6965680:6965844, ack 3781, win 501, length 164
21:10:16.073458 IP 138.197.158.231.22 > 99.237.102.83.55891: Flags [P.], seq 6965844:6966008, ack 3781, win 501, length 164
21:10:16.073516 IP 138.197.158.231.22 > 99.237.102.83.55891: Flags [P.], seq 6966008:6966172, ack 3781, win 501, length 164
21:10:16.073569 IP 138.197.158.231.22 > 99.237.102.83.55891: Flags [P.], seq 6966172:6966336, ack 3781, win 501, length 164
21:10:16.073657 IP 138.197.158.231.22 > 99.237.102.83.55891: Flags [P.], seq 6966336:6966500, ack 3781, win 501, length 164
21:10:16.073719 IP 138.197.158.231.22 > 99.237.102.83.55891: Flags [P.], seq 6966500:6966664, ack 3781, win 501, length 164
21:10:16.073799 IP 138.197.158.231.22 > 99.237.102.83.55891: Flags [P.], seq 6966664:6966828, ack 3781, win 501, length 164
21:10:16.073915 IP 138.197.158.231.22 > 99.237.102.83.55891: Flags [P.], seq 6966828:6966992, ack 3781, win 501, length 164
21:10:16.074020 IP 138.197.158.231.22 > 99.237.102.83.55891: Flags [P.], seq 6966992:6967156, ack 3781, win 501, length 164
21:10:16.074093 IP 138.197.158.231.22 > 99.237.102.83.55891: Flags [P.], seq 6967156:6967320, ack 3781, win 501, length 164
21:10:16.074159 IP 138.197.158.231.22 > 99.237.102.83.55891: Flags [P.], seq 6967320:6967484, ack 3781, win 501, length 164
21:10:16.074225 IP 138.197.158.231.22 > 99.237.102.83.55891: Flags [P.], seq 6967484:6967648, ack 3781, win 501, length 164
21:10:16.074313 IP 138.197.158.231.22 > 99.237.102.83.55891: Flags [P.], seq 6967648:6967812, ack 3781, win 501, length 164
21:10:16.074397 IP 138.197.158.231.22 > 99.237.102.83.55891: Flags [P.], seq 6967812:6967976, ack 3781, win 501, length 164
21:10:16.074455 IP 138.197.158.231.22 > 99.237.102.83.55891: Flags [P.], seq 6967976:6968140, ack 3781, win 501, length 164
21:10:16.074512 IP 138.197.158.231.22 > 99.237.102.83.55891: Flags [P.], seq 6968140:6968304, ack 3781, win 501, length 164
21:10:16.074569 IP 138.197.158.231.22 > 99.237.102.83.55891: Flags [P.], seq 6968304:6968468, ack 3781, win 501, length 164
21:10:16.074626 IP 138.197.158.231.22 > 99.237.102.83.55891: Flags [P.], seq 6968468:6968632, ack 3781, win 501, length 164
21:10:16.074679 IP 138.197.158.231.22 > 99.237.102.83.55891: Flags [P.], seq 6968632:6968796, ack 3781, win 501, length 164
21:10:16.074732 IP 138.197.158.231.22 > 99.237.102.83.55891: Flags [P.], seq 6968796:6968960, ack 3781, win 501, length 164
21:10:16.074794 IP 138.197.158.231.22 > 99.237.102.83.55891: Flags [P.], seq 6968960:6969124, ack 3781, win 501, length 164
21:10:16.074847 IP 138.197.158.231.22 > 99.237.102.83.55891: Flags [P.], seq 6969124:6969288, ack 3781, win 501, length 164
21:10:16.074902 IP 138.197.158.231.22 > 99.237.102.83.55891: Flags [P.], seq 6969288:6969452, ack 3781, win 501, length 164
21:10:16.074955 IP 138.197.158.231.22 > 99.237.102.83.55891: Flags [P.], seq 6969452:6969616, ack 3781, win 501, length 164
21:10:16.075011 IP 138.197.158.231.22 > 99.237.102.83.55891: Flags [P.], seq 6969616:6969780, ack 3781, win 501, length 164
21:10:16.075078 IP 138.197.158.231.22 > 99.237.102.83.55891: Flags [P.], seq 6969780:6969944, ack 3781, win 501, length 164
21:10:16.075153 IP 138.197.158.231.22 > 99.237.102.83.55891: Flags [P.], seq 6969944:6970108, ack 3781, win 501, length 164
21:10:16.075212 IP 138.197.158.231.22 > 99.237.102.83.55891: Flags [P.], seq 6970108:6970272, ack 3781, win 501, length 164
21:10:16.075291 IP 138.197.158.231.22 > 99.237.102.83.55891: Flags [P.], seq 6970272:6970436, ack 3781, win 501, length 164
21:10:16.075351 IP 138.197.158.231.22 > 99.237.102.83.55891: Flags [P.], seq 6970436:6970600, ack 3781, win 501, length 164
21:10:16.075425 IP 138.197.158.231.22 > 99.237.102.83.55891: Flags [P.], seq 6970600:6970764, ack 3781, win 501, length 164
21:10:16.075490 IP 138.197.158.231.22 > 99.237.102.83.55891: Flags [P.], seq 6970764:6970928, ack 3781, win 501, length 164
21:10:16.075549 IP 138.197.158.231.22 > 99.237.102.83.55891: Flags [P.], seq 6970928:6971092, ack 3781, win 501, length 164
21:10:16.075604 IP 138.197.158.231.22 > 99.237.102.83.55891: Flags [P.], seq 6971092:6971256, ack 3781, win 501, length 164
21:10:16.075657 IP 138.197.158.231.22 > 99.237.102.83.55891: Flags [P.], seq 6971256:6971420, ack 3781, win 501, length 164
21:10:16.075713 IP 138.197.158.231.22 > 99.237.102.83.55891: Flags [P.], seq 6971420:6971584, ack 3781, win 501, length 164
21:10:16.075773 IP 138.197.158.231.22 > 99.237.102.83.55891: Flags [P.], seq 6971584:6971748, ack 3781, win 501, length 164
21:10:16.075866 IP 138.197.158.231.22 > 99.237.102.83.55891: Flags [P.], seq 6971748:6971912, ack 3781, win 501, length 164
21:10:16.075965 IP 138.197.158.231.22 > 99.237.102.83.55891: Flags [P.], seq 6971912:6972076, ack 3781, win 501, length 164
21:10:16.076053 IP 138.197.158.231.22 > 99.237.102.83.55891: Flags [P.], seq 6972076:6972240, ack 3781, win 501, length 164
21:10:16.076116 IP 138.197.158.231.22 > 99.237.102.83.55891: Flags [P.], seq 6972240:6972404, ack 3781, win 501, length 164
21:10:16.076213 IP 138.197.158.231.22 > 99.237.102.83.55891: Flags [P.], seq 6972404:6972568, ack 3781, win 501, length 164
21:10:16.076280 IP 138.197.158.231.22 > 99.237.102.83.55891: Flags [P.], seq 6972568:6972732, ack 3781, win 501, length 164
21:10:16.076339 IP 138.197.158.231.22 > 99.237.102.83.55891: Flags [P.], seq 6972732:6972896, ack 3781, win 501, length 164
21:10:16.076393 IP 138.197.158.231.22 > 99.237.102.83.55891: Flags [P.], seq 6972896:6973060, ack 3781, win 501, length 164
21:10:16.076447 IP 138.197.158.231.22 > 99.237.102.83.55891: Flags [P.], seq 6973060:6973224, ack 3781, win 501, length 164
21:10:16.076504 IP 138.197.158.231.22 > 99.237.102.83.55891: Flags [P.], seq 6973224:6973388, ack 3781, win 501, length 164
21:10:16.076557 IP 138.197.158.231.22 > 99.237.102.83.55891: Flags [P.], seq 6973388:6973552, ack 3781, win 501, length 164
21:10:16.076653 IP 138.197.158.231.22 > 99.237.102.83.55891: Flags [P.], seq 6973552:6973716, ack 3781, win 501, length 164
21:10:16.076760 IP 138.197.158.231.22 > 99.237.102.83.55891: Flags [P.], seq 6973716:6973880, ack 3781, win 501, length 164
21:10:16.076849 IP 138.197.158.231.22 > 99.237.102.83.55891: Flags [P.], seq 6973880:6974044, ack 3781, win 501, length 164
21:10:16.076940 IP 138.197.158.231.22 > 99.237.102.83.55891: Flags [P.], seq 6974044:6974208, ack 3781, win 501, length 164
21:10:16.077001 IP 138.197.158.231.22 > 99.237.102.83.55891: Flags [P.], seq 6974208:6974372, ack 3781, win 501, length 164
21:10:16.077059 IP 138.197.158.231.22 > 99.237.102.83.55891: Flags [P.], seq 6974372:6974536, ack 3781, win 501, length 164
21:10:16.077113 IP 138.197.158.231.22 > 99.237.102.83.55891: Flags [P.], seq 6974536:6974700, ack 3781, win 501, length 164
21:10:16.077170 IP 138.197.158.231.22 > 99.237.102.83.55891: Flags [P.], seq 6974700:6974864, ack 3781, win 501, length 164
21:10:16.077227 IP 138.197.158.231.22 > 99.237.102.83.55891: Flags [P.], seq 6974864:6975028, ack 3781, win 501, length 164
21:10:16.077301 IP 138.197.158.231.22 > 99.237.102.83.55891: Flags [P.], seq 6975028:6975192, ack 3781, win 501, length 164
21:10:16.077370 IP 138.197.158.231.22 > 99.237.102.83.55891: Flags [P.], seq 6975192:6975356, ack 3781, win 501, length 164
21:10:16.077429 IP 138.197.158.231.22 > 99.237.102.83.55891: Flags [P.], seq 6975356:6975520, ack 3781, win 501, length 164
21:10:16.077488 IP 138.197.158.231.22 > 99.237.102.83.55891: Flags [P.], seq 6975520:6975684, ack 3781, win 501, length 164
21:10:16.077552 IP 138.197.158.231.22 > 99.237.102.83.55891: Flags [P.], seq 6975684:6975848, ack 3781, win 501, length 164
21:10:16.077611 IP 138.197.158.231.22 > 99.237.102.83.55891: Flags [P.], seq 6975848:6976012, ack 3781, win 501, length 164
21:10:16.077762 IP 138.197.158.231.22 > 99.237.102.83.55891: Flags [P.], seq 6976012:6976176, ack 3781, win 501, length 164
21:10:16.077830 IP 138.197.158.231.22 > 99.237.102.83.55891: Flags [P.], seq 6976176:6976340, ack 3781, win 501, length 164
21:10:16.077886 IP 138.197.158.231.22 > 99.237.102.83.55891: Flags [P.], seq 6976340:6976504, ack 3781, win 501, length 164
21:10:16.077944 IP 138.197.158.231.22 > 99.237.102.83.55891: Flags [P.], seq 6976504:6976668, ack 3781, win 501, length 164
21:10:16.077997 IP 138.197.158.231.22 > 99.237.102.83.55891: Flags [P.], seq 6976668:6976832, ack 3781, win 501, length 164
21:10:16.078051 IP 138.197.158.231.22 > 99.237.102.83.55891: Flags [P.], seq 6976832:6976996, ack 3781, win 501, length 164
21:10:16.078107 IP 138.197.158.231.22 > 99.237.102.83.55891: Flags [P.], seq 6976996:6977160, ack 3781, win 501, length 164
21:10:16.078161 IP 138.197.158.231.22 > 99.237.102.83.55891: Flags [P.], seq 6977160:6977324, ack 3781, win 501, length 164
21:10:16.078218 IP 138.197.158.231.22 > 99.237.102.83.55891: Flags [P.], seq 6977324:6977488, ack 3781, win 501, length 164
21:10:16.078273 IP 138.197.158.231.22 > 99.237.102.83.55891: Flags [P.], seq 6977488:6977652, ack 3781, win 501, length 164
21:10:16.078327 IP 138.197.158.231.22 > 99.237.102.83.55891: Flags [P.], seq 6977652:6977816, ack 3781, win 501, length 164
21:10:16.078396 IP 138.197.158.231.22 > 99.237.102.83.55891: Flags [P.], seq 6977816:6977980, ack 3781, win 501, length 164
21:10:16.078452 IP 138.197.158.231.22 > 99.237.102.83.55891: Flags [P.], seq 6977980:6978144, ack 3781, win 501, length 164
21:10:16.078509 IP 138.197.158.231.22 > 99.237.102.83.55891: Flags [P.], seq 6978144:6978308, ack 3781, win 501, length 164
21:10:16.078601 IP 138.197.158.231.22 > 99.237.102.83.55891: Flags [P.], seq 6978308:6978472, ack 3781, win 501, length 164
21:10:16.078690 IP 138.197.158.231.22 > 99.237.102.83.55891: Flags [P.], seq 6978472:6978636, ack 3781, win 501, length 164
21:10:16.078780 IP 138.197.158.231.22 > 99.237.102.83.55891: Flags [P.], seq 6978636:6978800, ack 3781, win 501, length 164
21:10:16.078855 IP 138.197.158.231.22 > 99.237.102.83.55891: Flags [P.], seq 6978800:6978964, ack 3781, win 501, length 164
21:10:16.078923 IP 138.197.158.231.22 > 99.237.102.83.55891: Flags [P.], seq 6978964:6979128, ack 3781, win 501, length 164
21:10:16.078982 IP 138.197.158.231.22 > 99.237.102.83.55891: Flags [P.], seq 6979128:6979292, ack 3781, win 501, length 164
21:10:16.079036 IP 138.197.158.231.22 > 99.237.102.83.55891: Flags [P.], seq 6979292:6979456, ack 3781, win 501, length 164
21:10:16.079093 IP 138.197.158.231.22 > 99.237.102.83.55891: Flags [P.], seq 6979456:6979620, ack 3781, win 501, length 164
21:10:16.079146 IP 138.197.158.231.22 > 99.237.102.83.55891: Flags [P.], seq 6979620:6979784, ack 3781, win 501, length 164
21:10:16.079204 IP 138.197.158.231.22 > 99.237.102.83.55891: Flags [P.], seq 6979784:6979948, ack 3781, win 501, length 164
21:10:16.079276 IP 138.197.158.231.22 > 99.237.102.83.55891: Flags [P.], seq 6979948:6980112, ack 3781, win 501, length 164
21:10:16.079361 IP 138.197.158.231.22 > 99.237.102.83.55891: Flags [P.], seq 6980112:6980276, ack 3781, win 501, length 164
21:10:16.079438 IP 138.197.158.231.22 > 99.237.102.83.55891: Flags [P.], seq 6980276:6980440, ack 3781, win 501, length 164
21:10:16.079496 IP 138.197.158.231.22 > 99.237.102.83.55891: Flags [P.], seq 6980440:6980604, ack 3781, win 501, length 164
21:10:16.079554 IP 138.197.158.231.22 > 99.237.102.83.55891: Flags [P.], seq 6980604:6980768, ack 3781, win 501, length 164
21:10:16.079610 IP 138.197.158.231.22 > 99.237.102.83.55891: Flags [P.], seq 6980768:6980932, ack 3781, win 501, length 164
21:10:16.079667 IP 138.197.158.231.22 > 99.237.102.83.55891: Flags [P.], seq 6980932:6981096, ack 3781, win 501, length 164
21:10:16.079721 IP 138.197.158.231.22 > 99.237.102.83.55891: Flags [P.], seq 6981096:6981260, ack 3781, win 501, length 164
21:10:16.079792 IP 138.197.158.231.22 > 99.237.102.83.55891: Flags [P.], seq 6981260:6981424, ack 3781, win 501, length 164
21:10:16.079913 IP 138.197.158.231.22 > 99.237.102.83.55891: Flags [P.], seq 6981424:6981588, ack 3781, win 501, length 164
21:10:16.079979 IP 138.197.158.231.22 > 99.237.102.83.55891: Flags [P.], seq 6981588:6981752, ack 3781, win 501, length 164
21:10:16.080038 IP 138.197.158.231.22 > 99.237.102.83.55891: Flags [P.], seq 6981752:6981916, ack 3781, win 501, length 164
21:10:16.080092 IP 138.197.158.231.22 > 99.237.102.83.55891: Flags [P.], seq 6981916:6982080, ack 3781, win 501, length 164
21:10:16.080145 IP 138.197.158.231.22 > 99.237.102.83.55891: Flags [P.], seq 6982080:6982244, ack 3781, win 501, length 164
21:10:16.080205 IP 138.197.158.231.22 > 99.237.102.83.55891: Flags [P.], seq 6982244:6982408, ack 3781, win 501, length 164
21:10:16.080259 IP 138.197.158.231.22 > 99.237.102.83.55891: Flags [P.], seq 6982408:6982572, ack 3781, win 501, length 164
21:10:16.080347 IP 138.197.158.231.22 > 99.237.102.83.55891: Flags [P.], seq 6982572:6982736, ack 3781, win 501, length 164
21:10:16.080435 IP 138.197.158.231.22 > 99.237.102.83.55891: Flags [P.], seq 6982736:6982900, ack 3781, win 501, length 164
21:10:16.080506 IP 138.197.158.231.22 > 99.237.102.83.55891: Flags [P.], seq 6982900:6983064, ack 3781, win 501, length 164
21:10:16.080565 IP 138.197.158.231.22 > 99.237.102.83.55891: Flags [P.], seq 6983064:6983228, ack 3781, win 501, length 164
21:10:16.080622 IP 138.197.158.231.22 > 99.237.102.83.55891: Flags [P.], seq 6983228:6983392, ack 3781, win 501, length 164
21:10:16.080679 IP 138.197.158.231.22 > 99.237.102.83.55891: Flags [P.], seq 6983392:6983556, ack 3781, win 501, length 164
21:10:16.080733 IP 138.197.158.231.22 > 99.237.102.83.55891: Flags [P.], seq 6983556:6983720, ack 3781, win 501, length 164
21:10:16.080830 IP 138.197.158.231.22 > 99.237.102.83.55891: Flags [P.], seq 6983720:6983884, ack 3781, win 501, length 164
21:10:16.080913 IP 138.197.158.231.22 > 99.237.102.83.55891: Flags [P.], seq 6983884:6984048, ack 3781, win 501, length 164
21:10:16.080981 IP 138.197.158.231.22 > 99.237.102.83.55891: Flags [P.], seq 6984048:6984212, ack 3781, win 501, length 164
21:10:16.081036 IP 138.197.158.231.22 > 99.237.102.83.55891: Flags [P.], seq 6984212:6984376, ack 3781, win 501, length 164
21:10:16.081090 IP 138.197.158.231.22 > 99.237.102.83.55891: Flags [P.], seq 6984376:6984540, ack 3781, win 501, length 164
21:10:16.081145 IP 138.197.158.231.22 > 99.237.102.83.55891: Flags [P.], seq 6984540:6984704, ack 3781, win 501, length 164
21:10:16.081200 IP 138.197.158.231.22 > 99.237.102.83.55891: Flags [P.], seq 6984704:6984868, ack 3781, win 501, length 164
21:10:16.081254 IP 138.197.158.231.22 > 99.237.102.83.55891: Flags [P.], seq 6984868:6985032, ack 3781, win 501, length 164
21:10:16.081311 IP 138.197.158.231.22 > 99.237.102.83.55891: Flags [P.], seq 6985032:6985196, ack 3781, win 501, length 164
21:10:16.081365 IP 138.197.158.231.22 > 99.237.102.83.55891: Flags [P.], seq 6985196:6985360, ack 3781, win 501, length 164
21:10:16.081422 IP 138.197.158.231.22 > 99.237.102.83.55891: Flags [P.], seq 6985360:6985524, ack 3781, win 501, length 164
21:10:16.081480 IP 138.197.158.231.22 > 99.237.102.83.55891: Flags [P.], seq 6985524:6985688, ack 3781, win 501, length 164
21:10:16.081569 IP 138.197.158.231.22 > 99.237.102.83.55891: Flags [P.], seq 6985688:6985852, ack 3781, win 501, length 164
21:10:16.081662 IP 138.197.158.231.22 > 99.237.102.83.55891: Flags [P.], seq 6985852:6986016, ack 3781, win 501, length 164
21:10:16.081754 IP 138.197.158.231.22 > 99.237.102.83.55891: Flags [P.], seq 6986016:6986180, ack 3781, win 501, length 164
21:10:16.081837 IP 138.197.158.231.22 > 99.237.102.83.55891: Flags [P.], seq 6986180:6986344, ack 3781, win 501, length 164
21:10:16.081923 IP 138.197.158.231.22 > 99.237.102.83.55891: Flags [P.], seq 6986344:6986508, ack 3781, win 501, length 164
21:10:16.081997 IP 138.197.158.231.22 > 99.237.102.83.55891: Flags [P.], seq 6986508:6986672, ack 3781, win 501, length 164
21:10:16.082068 IP 138.197.158.231.22 > 99.237.102.83.55891: Flags [P.], seq 6986672:6986836, ack 3781, win 501, length 164
21:10:16.082164 IP 138.197.158.231.22 > 99.237.102.83.55891: Flags [P.], seq 6986836:6987000, ack 3781, win 501, length 164
21:10:16.082246 IP 138.197.158.231.22 > 99.237.102.83.55891: Flags [P.], seq 6987000:6987164, ack 3781, win 501, length 164
21:10:16.082308 IP 138.197.158.231.22 > 99.237.102.83.55891: Flags [P.], seq 6987164:6987328, ack 3781, win 501, length 164
21:10:16.082363 IP 138.197.158.231.22 > 99.237.102.83.55891: Flags [P.], seq 6987328:6987492, ack 3781, win 501, length 164
21:10:16.082417 IP 138.197.158.231.22 > 99.237.102.83.55891: Flags [P.], seq 6987492:6987656, ack 3781, win 501, length 164
21:10:16.082473 IP 138.197.158.231.22 > 99.237.102.83.55891: Flags [P.], seq 6987656:6987820, ack 3781, win 501, length 164
21:10:16.082526 IP 138.197.158.231.22 > 99.237.102.83.55891: Flags [P.], seq 6987820:6987984, ack 3781, win 501, length 164
21:10:16.082584 IP 138.197.158.231.22 > 99.237.102.83.55891: Flags [P.], seq 6987984:6988148, ack 3781, win 501, length 164
21:10:16.082644 IP 138.197.158.231.22 > 99.237.102.83.55891: Flags [P.], seq 6988148:6988312, ack 3781, win 501, length 164
21:10:16.082698 IP 138.197.158.231.22 > 99.237.102.83.55891: Flags [P.], seq 6988312:6988476, ack 3781, win 501, length 164
21:10:16.082753 IP 138.197.158.231.22 > 99.237.102.83.55891: Flags [P.], seq 6988476:6988640, ack 3781, win 501, length 164
21:10:16.082843 IP 138.197.158.231.22 > 99.237.102.83.55891: Flags [P.], seq 6988640:6988804, ack 3781, win 501, length 164
21:10:16.082932 IP 138.197.158.231.22 > 99.237.102.83.55891: Flags [P.], seq 6988804:6988968, ack 3781, win 501, length 164
21:10:16.083040 IP 138.197.158.231.22 > 99.237.102.83.55891: Flags [P.], seq 6988968:6989132, ack 3781, win 501, length 164
21:10:16.083146 IP 138.197.158.231.22 > 99.237.102.83.55891: Flags [P.], seq 6989132:6989296, ack 3781, win 501, length 164
21:10:16.083258 IP 138.197.158.231.22 > 99.237.102.83.55891: Flags [P.], seq 6989296:6989460, ack 3781, win 501, length 164
21:10:16.083345 IP 138.197.158.231.22 > 99.237.102.83.55891: Flags [P.], seq 6989460:6989624, ack 3781, win 501, length 164
21:10:16.083425 IP 138.197.158.231.22 > 99.237.102.83.55891: Flags [P.], seq 6989624:6989788, ack 3781, win 501, length 164
21:10:16.083506 IP 138.197.158.231.22 > 99.237.102.83.55891: Flags [P.], seq 6989788:6989952, ack 3781, win 501, length 164
21:10:16.083602 IP 138.197.158.231.22 > 99.237.102.83.55891: Flags [P.], seq 6989952:6990116, ack 3781, win 501, length 164
21:10:16.083693 IP 138.197.158.231.22 > 99.237.102.83.55891: Flags [P.], seq 6990116:6990280, ack 3781, win 501, length 164
21:10:16.083785 IP 138.197.158.231.22 > 99.237.102.83.55891: Flags [P.], seq 6990280:6990444, ack 3781, win 501, length 164
21:10:16.083876 IP 138.197.158.231.22 > 99.237.102.83.55891: Flags [P.], seq 6990444:6990608, ack 3781, win 501, length 164
21:10:16.083977 IP 138.197.158.231.22 > 99.237.102.83.55891: Flags [P.], seq 6990608:6990772, ack 3781, win 501, length 164
21:10:16.084083 IP 138.197.158.231.22 > 99.237.102.83.55891: Flags [P.], seq 6990772:6990936, ack 3781, win 501, length 164
21:10:16.084175 IP 138.197.158.231.22 > 99.237.102.83.55891: Flags [P.], seq 6990936:6991100, ack 3781, win 501, length 164
21:10:16.084256 IP 138.197.158.231.22 > 99.237.102.83.55891: Flags [P.], seq 6991100:6991264, ack 3781, win 501, length 164
21:10:16.084348 IP 138.197.158.231.22 > 99.237.102.83.55891: Flags [P.], seq 6991264:6991428, ack 3781, win 501, length 164
21:10:16.084430 IP 138.197.158.231.22 > 99.237.102.83.55891: Flags [P.], seq 6991428:6991592, ack 3781, win 501, length 164
21:10:16.084522 IP 138.197.158.231.22 > 99.237.102.83.55891: Flags [P.], seq 6991592:6991756, ack 3781, win 501, length 164
21:10:16.084593 IP 138.197.158.231.22 > 99.237.102.83.55891: Flags [P.], seq 6991756:6991920, ack 3781, win 501, length 164
21:10:16.084680 IP 138.197.158.231.22 > 99.237.102.83.55891: Flags [P.], seq 6991920:6992084, ack 3781, win 501, length 164
21:10:16.084788 IP 138.197.158.231.22 > 99.237.102.83.55891: Flags [P.], seq 6992084:6992248, ack 3781, win 501, length 164
21:10:16.084896 IP 138.197.158.231.22 > 99.237.102.83.55891: Flags [P.], seq 6992248:6992412, ack 3781, win 501, length 164
21:10:16.084991 IP 138.197.158.231.22 > 99.237.102.83.55891: Flags [P.], seq 6992412:6992576, ack 3781, win 501, length 164
21:10:16.085084 IP 138.197.158.231.22 > 99.237.102.83.55891: Flags [P.], seq 6992576:6992740, ack 3781, win 501, length 164
21:10:16.085176 IP 138.197.158.231.22 > 99.237.102.83.55891: Flags [P.], seq 6992740:6992904, ack 3781, win 501, length 164
21:10:16.085267 IP 138.197.158.231.22 > 99.237.102.83.55891: Flags [P.], seq 6992904:6993068, ack 3781, win 501, length 164
21:10:16.085359 IP 138.197.158.231.22 > 99.237.102.83.55891: Flags [P.], seq 6993068:6993232, ack 3781, win 501, length 164
21:10:16.085460 IP 138.197.158.231.22 > 99.237.102.83.55891: Flags [P.], seq 6993232:6993396, ack 3781, win 501, length 164
21:10:16.085544 IP 138.197.158.231.22 > 99.237.102.83.55891: Flags [P.], seq 6993396:6993560, ack 3781, win 501, length 164
21:10:16.085640 IP 138.197.158.231.22 > 99.237.102.83.55891: Flags [P.], seq 6993560:6993724, ack 3781, win 501, length 164
21:10:16.085727 IP 138.197.158.231.22 > 99.237.102.83.55891: Flags [P.], seq 6993724:6993888, ack 3781, win 501, length 164
21:10:16.085839 IP 138.197.158.231.22 > 99.237.102.83.55891: Flags [P.], seq 6993888:6994052, ack 3781, win 501, length 164
21:10:16.085906 IP 138.197.158.231.22 > 99.237.102.83.55891: Flags [P.], seq 6994052:6994216, ack 3781, win 501, length 164
21:10:16.085966 IP 138.197.158.231.22 > 99.237.102.83.55891: Flags [P.], seq 6994216:6994380, ack 3781, win 501, length 164
