root@lamp-ubuntu-s-1vcpu-1gb-tor1-01:~# tcpdump -r 0001.pcap
reading from file 0001.pcap, link-type EN10MB (Ethernet)
21:07:08.993505 IP 138.197.158.231.ssh > cpe9050ca239d63-cm9050ca239d60.cpe.net.cable.rogers.com.55891: Flags [P.], seq 4239888600:4239888644, ack 4080947080, win 501, length 44
21:07:08.993564 IP 138.197.158.231.ssh > cpe9050ca239d63-cm9050ca239d60.cpe.net.cable.rogers.com.55891: Flags [P.], seq 44:152, ack 1, win 501, length 108
21:07:08.993612 IP 138.197.158.231.ssh > cpe9050ca239d63-cm9050ca239d60.cpe.net.cable.rogers.com.55891: Flags [P.], seq 152:188, ack 1, win 501, length 36
21:07:09.014441 IP cpe9050ca239d63-cm9050ca239d60.cpe.net.cable.rogers.com.55891 > 138.197.158.231.ssh: Flags [.], ack 44, win 4140, length 0
21:07:09.020422 IP cpe9050ca239d63-cm9050ca239d60.cpe.net.cable.rogers.com.55891 > 138.197.158.231.ssh: Flags [.], ack 188, win 4139, length 0
21:07:13.478064 IP 111.205.170.240.64785 > 138.197.158.231.ms-sql-s: Flags [S], seq 3624789494, win 8192, options [mss 1460,nop,wscale 8,nop,nop,sackOK], length 0
21:07:26.510954 IP 119.6.253.56.33784 > 138.197.158.231.ssh: Flags [S], seq 682861394, win 29200, options [mss 1460,sackOK,TS val 869972830 ecr 0,nop,wscale 7], length 0
21:07:26.511016 IP 138.197.158.231.ssh > 119.6.253.56.33784: Flags [S.], seq 87772972, ack 682861395, win 65160, options [mss 1460,sackOK,TS val 2800304911 ecr 869972830,nop,wscale 7], length 0
21:07:26.767572 IP 119.6.253.56.33784 > 138.197.158.231.ssh: Flags [.], ack 1, win 229, options [nop,nop,TS val 869973087 ecr 2800304911], length 0
21:07:26.783768 IP 138.197.158.231.ssh > 119.6.253.56.33784: Flags [P.], seq 1:42, ack 1, win 510, options [nop,nop,TS val 2800305184 ecr 869973087], length 41
21:07:27.079334 IP 138.197.158.231.ssh > 213.6.118.170.38828: Flags [P.], seq 1531922318:1531922386, ack 1705255745, win 507, options [nop,nop,TS val 2124179059 ecr 3191223106], length 68
21:07:27.527320 IP 138.197.158.231.ssh > 119.6.253.56.33784: Flags [P.], seq 1:42, ack 1, win 510, options [nop,nop,TS val 2800305928 ecr 869973087], length 41
21:07:27.777146 IP 119.6.253.56.33784 > 138.197.158.231.ssh: Flags [.], ack 42, win 229, options [nop,nop,TS val 869974097 ecr 2800305928], length 0
21:07:27.782529 IP 119.6.253.56.33784 > 138.197.158.231.ssh: Flags [P.], seq 1:22, ack 42, win 229, options [nop,nop,TS val 869974102 ecr 2800305928], length 21
21:07:27.782574 IP 138.197.158.231.ssh > 119.6.253.56.33784: Flags [.], ack 22, win 510, options [nop,nop,TS val 2800306183 ecr 869974102], length 0
21:07:27.784474 IP 138.197.158.231.ssh > 119.6.253.56.33784: Flags [P.], seq 42:1098, ack 22, win 510, options [nop,nop,TS val 2800306185 ecr 869974102], length 1056
21:07:28.073186 IP 119.6.253.56.33784 > 138.197.158.231.ssh: Flags [P.], seq 22:462, ack 1098, win 245, options [nop,nop,TS val 869974392 ecr 2800306185], length 440
21:07:28.073261 IP 138.197.158.231.ssh > 119.6.253.56.33784: Flags [.], ack 462, win 507, options [nop,nop,TS val 2800306473 ecr 869974392], length 0
21:07:28.353804 IP 119.6.253.56.33784 > 138.197.158.231.ssh: Flags [P.], seq 462:510, ack 1098, win 245, options [nop,nop,TS val 869974673 ecr 2800306473], length 48
21:07:28.353872 IP 138.197.158.231.ssh > 119.6.253.56.33784: Flags [.], ack 510, win 507, options [nop,nop,TS val 2800306754 ecr 869974673], length 0
21:07:28.359611 IP 138.197.158.231.ssh > 119.6.253.56.33784: Flags [P.], seq 1098:1378, ack 510, win 507, options [nop,nop,TS val 2800306760 ecr 869974673], length 280
21:07:28.624459 IP 119.6.253.56.33784 > 138.197.158.231.ssh: Flags [P.], seq 510:526, ack 1378, win 262, options [nop,nop,TS val 869974944 ecr 2800306760], length 16
21:07:28.624530 IP 138.197.158.231.ssh > 119.6.253.56.33784: Flags [.], ack 526, win 507, options [nop,nop,TS val 2800307025 ecr 869974944], length 0
21:07:28.878510 IP 119.6.253.56.33784 > 138.197.158.231.ssh: Flags [P.], seq 526:578, ack 1378, win 262, options [nop,nop,TS val 869975198 ecr 2800307025], length 52
21:07:28.878549 IP 138.197.158.231.ssh > 119.6.253.56.33784: Flags [.], ack 578, win 507, options [nop,nop,TS val 2800307279 ecr 869975198], length 0
21:07:28.878718 IP 138.197.158.231.ssh > 119.6.253.56.33784: Flags [P.], seq 1378:1430, ack 578, win 507, options [nop,nop,TS val 2800307279 ecr 869975198], length 52
21:07:29.165076 IP 119.6.253.56.33784 > 138.197.158.231.ssh: Flags [P.], seq 578:662, ack 1430, win 262, options [nop,nop,TS val 869975485 ecr 2800307279], length 84
21:07:29.207308 IP 138.197.158.231.ssh > 119.6.253.56.33784: Flags [.], ack 662, win 507, options [nop,nop,TS val 2800307608 ecr 869975485], length 0
21:07:30.823371 IP 138.197.158.231.ssh > 119.6.253.56.33784: Flags [P.], seq 1430:1498, ack 662, win 507, options [nop,nop,TS val 2800309224 ecr 869975485], length 68
21:07:31.086141 IP 119.6.253.56.33784 > 138.197.158.231.ssh: Flags [P.], seq 662:714, ack 1498, win 262, options [nop,nop,TS val 869977405 ecr 2800309224], length 52
21:07:31.086213 IP 138.197.158.231.ssh > 119.6.253.56.33784: Flags [.], ack 714, win 507, options [nop,nop,TS val 2800309486 ecr 869977405], length 0
21:07:31.086253 IP 119.6.253.56.33784 > 138.197.158.231.ssh: Flags [F.], seq 714, ack 1498, win 262, options [nop,nop,TS val 869977405 ecr 2800309224], length 0
21:07:31.090263 IP 138.197.158.231.ssh > 119.6.253.56.33784: Flags [F.], seq 1498, ack 715, win 507, options [nop,nop,TS val 2800309490 ecr 869977405], length 0
21:07:31.371813 IP 119.6.253.56.33784 > 138.197.158.231.ssh: Flags [.], ack 1499, win 262, options [nop,nop,TS val 869977691 ecr 2800309490], length 0
21:07:38.699121 IP static41-209-250-249-250.adsl41-16.iam.net.ma.52202 > 138.197.158.231.ssh: Flags [S], seq 125731874, win 64240, options [mss 1412,sackOK,TS val 2619343490 ecr 0,nop,wscale 7], length 0
21:07:38.699187 IP 138.197.158.231.ssh > static41-209-250-249-250.adsl41-16.iam.net.ma.52202: Flags [S.], seq 2373855795, ack 125731875, win 65160, options [mss 1460,sackOK,TS val 1272689581 ecr 2619343490,nop,wscale 7], length 0
21:07:38.837748 IP static41-209-250-249-250.adsl41-16.iam.net.ma.52202 > 138.197.158.231.ssh: Flags [.], ack 1, win 502, options [nop,nop,TS val 2619343629 ecr 1272689581], length 0
21:07:38.848766 IP 138.197.158.231.ssh > static41-209-250-249-250.adsl41-16.iam.net.ma.52202: Flags [P.], seq 1:42, ack 1, win 510, options [nop,nop,TS val 1272689731 ecr 2619343629], length 41
21:07:38.987017 IP static41-209-250-249-250.adsl41-16.iam.net.ma.52202 > 138.197.158.231.ssh: Flags [.], ack 42, win 502, options [nop,nop,TS val 2619343779 ecr 1272689731], length 0
21:07:38.987287 IP static41-209-250-249-250.adsl41-16.iam.net.ma.52202 > 138.197.158.231.ssh: Flags [P.], seq 1:22, ack 42, win 502, options [nop,nop,TS val 2619343779 ecr 1272689731], length 21
21:07:38.987310 IP 138.197.158.231.ssh > static41-209-250-249-250.adsl41-16.iam.net.ma.52202: Flags [.], ack 22, win 510, options [nop,nop,TS val 1272689870 ecr 2619343779], length 0
21:07:38.988694 IP 138.197.158.231.ssh > static41-209-250-249-250.adsl41-16.iam.net.ma.52202: Flags [P.], seq 42:1098, ack 22, win 510, options [nop,nop,TS val 1272689871 ecr 2619343779], length 1056
21:07:39.126308 IP static41-209-250-249-250.adsl41-16.iam.net.ma.52202 > 138.197.158.231.ssh: Flags [.], ack 1098, win 501, options [nop,nop,TS val 2619343918 ecr 1272689871], length 0
21:07:39.128402 IP static41-209-250-249-250.adsl41-16.iam.net.ma.52202 > 138.197.158.231.ssh: Flags [P.], seq 22:462, ack 1098, win 501, options [nop,nop,TS val 2619343920 ecr 1272689871], length 440
21:07:39.128425 IP 138.197.158.231.ssh > static41-209-250-249-250.adsl41-16.iam.net.ma.52202: Flags [.], ack 462, win 507, options [nop,nop,TS val 1272690011 ecr 2619343920], length 0
21:07:39.265807 IP static41-209-250-249-250.adsl41-16.iam.net.ma.52202 > 138.197.158.231.ssh: Flags [P.], seq 462:510, ack 1098, win 501, options [nop,nop,TS val 2619344057 ecr 1272690011], length 48
21:07:39.265844 IP 138.197.158.231.ssh > static41-209-250-249-250.adsl41-16.iam.net.ma.52202: Flags [.], ack 510, win 507, options [nop,nop,TS val 1272690148 ecr 2619344057], length 0
21:07:39.271003 IP 138.197.158.231.ssh > static41-209-250-249-250.adsl41-16.iam.net.ma.52202: Flags [P.], seq 1098:1378, ack 510, win 507, options [nop,nop,TS val 1272690153 ecr 2619344057], length 280
21:07:39.408451 IP static41-209-250-249-250.adsl41-16.iam.net.ma.52202 > 138.197.158.231.ssh: Flags [.], ack 1378, win 501, options [nop,nop,TS val 2619344200 ecr 1272690153], length 0
21:07:39.416730 IP static41-209-250-249-250.adsl41-16.iam.net.ma.52202 > 138.197.158.231.ssh: Flags [P.], seq 510:526, ack 1378, win 501, options [nop,nop,TS val 2619344208 ecr 1272690153], length 16
21:07:39.416766 IP 138.197.158.231.ssh > static41-209-250-249-250.adsl41-16.iam.net.ma.52202: Flags [.], ack 526, win 507, options [nop,nop,TS val 1272690299 ecr 2619344208], length 0
21:07:39.554677 IP static41-209-250-249-250.adsl41-16.iam.net.ma.52202 > 138.197.158.231.ssh: Flags [P.], seq 526:578, ack 1378, win 501, options [nop,nop,TS val 2619344346 ecr 1272690299], length 52
21:07:39.554714 IP 138.197.158.231.ssh > static41-209-250-249-250.adsl41-16.iam.net.ma.52202: Flags [.], ack 578, win 507, options [nop,nop,TS val 1272690437 ecr 2619344346], length 0
21:07:39.554837 IP 138.197.158.231.ssh > static41-209-250-249-250.adsl41-16.iam.net.ma.52202: Flags [P.], seq 1378:1430, ack 578, win 507, options [nop,nop,TS val 1272690437 ecr 2619344346], length 52
21:07:39.698088 IP static41-209-250-249-250.adsl41-16.iam.net.ma.52202 > 138.197.158.231.ssh: Flags [P.], seq 578:662, ack 1430, win 501, options [nop,nop,TS val 2619344489 ecr 1272690437], length 84
21:07:39.739303 IP 138.197.158.231.ssh > static41-209-250-249-250.adsl41-16.iam.net.ma.52202: Flags [.], ack 662, win 507, options [nop,nop,TS val 1272690622 ecr 2619344489], length 0
