 
root@lamp-ubuntu-s-1vcpu-1gb-tor1-01:~# tcpdump -i eth0 port 22

Flags [P.], seq 3319420:3319624, ack 1801, win 501, length 204
21:15:47.564380 IP 138.197.158.231.ssh > cpe9050ca239d63-cm9050ca239d60.cpe.net.cable.rogers.com.55891: Flags [P.], seq 3319624:3319828, ack 1801, win 501, length 204
21:15:47.564435 IP 138.197.158.231.ssh > cpe9050ca239d63-cm9050ca239d60.cpe.net.cable.rogers.com.55891: Flags [P.], seq 3319828:3320032, ack 1801, win 501, length 204
21:15:47.564487 IP 138.197.158.231.ssh > cpe9050ca239d63-cm9050ca239d60.cpe.net.cable.rogers.com.55891: Flags [P.], seq 3320032:3320236, ack 1801, win 501, length 204
21:15:47.564543 IP 138.197.158.231.ssh > cpe9050ca239d63-cm9050ca239d60.cpe.net.cable.rogers.com.55891: Flags [P.], seq 3320236:3320440, ack 1801, win 501, length 204
21:15:47.564594 IP 138.197.158.231.ssh > cpe9050ca239d63-cm9050ca239d60.cpe.net.cable.rogers.com.55891: Flags [P.], seq 3320440:3320644, ack 1801, win 501, length 204
21:15:47.564659 IP 138.197.158.231.ssh > cpe9050ca239d63-cm9050ca239d60.cpe.net.cable.rogers.com.55891: Flags [P.], seq 3320644:3320848, ack 1801, win 501, length 204
21:15:47.564710 IP 138.197.158.231.ssh > cpe9050ca239d63-cm9050ca239d60.cpe.net.cable.rogers.com.55891: Flags [P.], seq 3320848:3321052, ack 1801, win 501, length 204
21:15:47.564774 IP 138.197.158.231.ssh > cpe9050ca239d63-cm9050ca239d60.cpe.net.cable.rogers.com.55891: Flags [P.], seq 3321052:3321256, ack 1801, win 501, length 204
21:15:47.564828 IP 138.197.158.231.ssh > cpe9050ca239d63-cm9050ca239d60.cpe.net.cable.rogers.com.55891: Flags [P.], seq 3321256:3321460, ack 1801, win 501, length 204
21:15:47.564889 IP cpe9050ca239d63-cm9050ca239d60.cpe.net.cable.rogers.com.55891 > 138.197.158.231.ssh: Flags [.], ack 3243068, win 4134, length 0
21:15:47.564900 IP cpe9050ca239d63-cm9050ca239d60.cpe.net.cable.rogers.com.55891 > 138.197.158.231.ssh: Flags [.], ack 3244160, win 4140, length 0
21:15:47.564903 IP cpe9050ca239d63-cm9050ca239d60.cpe.net.cable.rogers.com.55891 > 138.197.158.231.ssh: Flags [.], ack 3245588, win 4134, length 0
21:15:47.564905 IP cpe9050ca239d63-cm9050ca239d60.cpe.net.cable.rogers.com.55891 > 138.197.158.231.ssh: Flags [.], ack 3246200, win 4140, length 0
21:15:47.564906 IP cpe9050ca239d63-cm9050ca239d60.cpe.net.cable.rogers.com.55891 > 138.197.158.231.ssh: Flags [.], ack 3249260, win 4140, length 0
21:15:47.564909 IP cpe9050ca239d63-cm9050ca239d60.cpe.net.cable.rogers.com.55891 > 138.197.158.231.ssh: Flags [.], ack 3252524, win 4140, length 0
21:15:47.564910 IP cpe9050ca239d63-cm9050ca239d60.cpe.net.cable.rogers.com.55891 > 138.197.158.231.ssh: Flags [.], ack 3252932, win 4138, length 0
21:15:47.564920 IP cpe9050ca239d63-cm9050ca239d60.cpe.net.cable.rogers.com.55891 > 138.197.158.231.ssh: Flags [.], ack 3255992, win 4140, length 0
21:15:47.564921 IP cpe9050ca239d63-cm9050ca239d60.cpe.net.cable.rogers.com.55891 > 138.197.158.231.ssh: Flags [.], ack 3257452, win 4140, length 0
21:15:47.564923 IP cpe9050ca239d63-cm9050ca239d60.cpe.net.cable.rogers.com.55891 > 138.197.158.231.ssh: Flags [.], ack 3260792, win 4140, length 0
21:15:47.564925 IP cpe9050ca239d63-cm9050ca239d60.cpe.net.cable.rogers.com.55891 > 138.197.158.231.ssh: Flags [.], ack 3264260, win 4140, length 0
21:15:47.565021 IP 138.197.158.231.ssh > cpe9050ca239d63-cm9050ca239d60.cpe.net.cable.rogers.com.55891: Flags [P.], seq 3321460:3321664, ack 1801, win 501, length 204
21:15:47.565119 IP 138.197.158.231.ssh > cpe9050ca239d63-cm9050ca239d60.cpe.net.cable.rogers.com.55891: Flags [P.], seq 3321664:3323332, ack 1801, win 501, length 1668
21:15:47.565186 IP 138.197.158.231.ssh > cpe9050ca239d63-cm9050ca239d60.cpe.net.cable.rogers.com.55891: Flags [P.], seq 3323332:3323704, ack 1801, win 501, length 372
21:15:47.565239 IP 138.197.158.231.ssh > cpe9050ca239d63-cm9050ca239d60.cpe.net.cable.rogers.com.55891: Flags [P.], seq 3323704:3323908, ack 1801, win 501, length 204
21:15:47.565296 IP 138.197.158.231.ssh > cpe9050ca239d63-cm9050ca239d60.cpe.net.cable.rogers.com.55891: Flags [P.], seq 3323908:3324112, ack 1801, win 501, length 204
21:15:47.565348 IP 138.197.158.231.ssh > cpe9050ca239d63-cm9050ca239d60.cpe.net.cable.rogers.com.55891: Flags [P.], seq 3324112:3324316, ack 1801, win 501, length 204
21:15:47.565400 IP 138.197.158.231.ssh > cpe9050ca239d63-cm9050ca239d60.cpe.net.cable.rogers.com.55891: Flags [P.], seq 3324316:3324520, ack 1801, win 501, length 204
21:15:47.565456 IP 138.197.158.231.ssh > cpe9050ca239d63-cm9050ca239d60.cpe.net.cable.rogers.com.55891: Flags [P.], seq 3324520:3324724, ack 1801, win 501, length 204
21:15:47.565510 IP 138.197.158.231.ssh > cpe9050ca239d63-cm9050ca239d60.cpe.net.cable.rogers.com.55891: Flags [P.], seq 3324724:3324928, ack 1801, win 501, length 204
21:15:47.565564 IP 138.197.158.231.ssh > cpe9050ca239d63-cm9050ca239d60.cpe.net.cable.rogers.com.55891: Flags [P.], seq 3324928:3325132, ack 1801, win 501, length 204
21:15:47.565617 IP 138.197.158.231.ssh > cpe9050ca239d63-cm9050ca239d60.cpe.net.cable.rogers.com.55891: Flags [P.], seq 3325132:3325336, ack 1801, win 501, length 204
21:15:47.565669 IP 138.197.158.231.ssh > cpe9050ca239d63-cm9050ca239d60.cpe.net.cable.rogers.com.55891: Flags [P.], seq 3325336:3325540, ack 1801, win 501, length 204
21:15:47.565726 IP 138.197.158.231.ssh > cpe9050ca239d63-cm9050ca239d60.cpe.net.cable.rogers.com.55891: Flags [P.], seq 3325540:3325744, ack 1801, win 501, length 204
21:15:47.565780 IP 138.197.158.231.ssh > cpe9050ca239d63-cm9050ca239d60.cpe.net.cable.rogers.com.55891: Flags [P.], seq 3325744:3325948, ack 1801, win 501, length 204
21:15:47.565832 IP 138.197.158.231.ssh > cpe9050ca239d63-cm9050ca239d60.cpe.net.cable.rogers.com.55891: Flags [P.], seq 3325948:3326152, ack 1801, win 501, length 204
21:15:47.565884 IP 138.197.158.231.ssh > cpe9050ca239d63-cm9050ca239d60.cpe.net.cable.rogers.com.55891: Flags [P.], seq 3326152:3326356, ack 1801, win 501, length 204
21:15:47.565939 IP 138.197.158.231.ssh > cpe9050ca239d63-cm9050ca239d60.cpe.net.cable.rogers.com.55891: Flags [P.], seq 3326356:3326560, ack 1801, win 501, length 204
21:15:47.565991 IP 138.197.158.231.ssh > cpe9050ca239d63-cm9050ca239d60.cpe.net.cable.rogers.com.55891: Flags [P.], seq 3326560:3326764, ack 1801, win 501, length 204
21:15:47.566043 IP 138.197.158.231.ssh > cpe9050ca239d63-cm9050ca239d60.cpe.net.cable.rogers.com.55891: Flags [P.], seq 3326764:3326968, ack 1801, win 501, length 204
21:15:47.566099 IP 138.197.158.231.ssh > cpe9050ca239d63-cm9050ca239d60.cpe.net.cable.rogers.com.55891: Flags [P.], seq 3326968:3327172, ack 1801, win 501, length 204
21:15:47.566152 IP 138.197.158.231.ssh > cpe9050ca239d63-cm9050ca239d60.cpe.net.cable.rogers.com.55891: Flags [P.], seq 3327172:3327376, ack 1801, win 501, length 204
21:15:47.566205 IP 138.197.158.231.ssh > cpe9050ca239d63-cm9050ca239d60.cpe.net.cable.rogers.com.55891: Flags [P.], seq 3327376:3327580, ack 1801, win 501, length 204
21:15:47.566264 IP 138.197.158.231.ssh > cpe9050ca239d63-cm9050ca239d60.cpe.net.cable.rogers.com.55891: Flags [P.], seq 3327580:3327784, ack 1801, win 501, length 204
21:15:47.566319 IP 138.197.158.231.ssh > cpe9050ca239d63-cm9050ca239d60.cpe.net.cable.rogers.com.55891: Flags [P.], seq 3327784:3327988, ack 1801, win 501, length 204
21:15:47.566371 IP 138.197.158.231.ssh > cpe9050ca239d63-cm9050ca239d60.cpe.net.cable.rogers.com.55891: Flags [P.], seq 3327988:3328192, ack 1801, win 501, length 204
21:15:47.566425 IP 138.197.158.231.ssh > cpe9050ca239d63-cm9050ca239d60.cpe.net.cable.rogers.com.55891: Flags [P.], seq 3328192:3328396, ack 1801, win 501, length 204
21:15:47.566480 IP 138.197.158.231.ssh > cpe9050ca239d63-cm9050ca239d60.cpe.net.cable.rogers.com.55891: Flags [P.], seq 3328396:3328600, ack 1801, win 501, length 204
21:15:47.566534 IP 138.197.158.231.ssh > cpe9050ca239d63-cm9050ca239d60.cpe.net.cable.rogers.com.55891: Flags [P.], seq 3328600:3328804, ack 1801, win 501, length 204
21:15:47.566588 IP 138.197.158.231.ssh > cpe9050ca239d63-cm9050ca239d60.cpe.net.cable.rogers.com.55891: Flags [P.], seq 3328804:3329008, ack 1801, win 501, length 204
21:15:47.566641 IP 138.197.158.231.ssh > cpe9050ca239d63-cm9050ca239d60.cpe.net.cable.rogers.com.55891: Flags [P.], seq 3329008:3329212, ack 1801, win 501, length 204
21:15:47.566694 IP 138.197.158.231.ssh > cpe9050ca239d63-cm9050ca239d60.cpe.net.cable.rogers.com.55891: Flags [P.], seq 3329212:3329416, ack 1801, win 501, length 204
21:15:47.566749 IP 138.197.158.231.ssh > cpe9050ca239d63-cm9050ca239d60.cpe.net.cable.rogers.com.55891: Flags [P.], seq 3329416:3329620, ack 1801, win 501, length 204
21:15:47.566803 IP 138.197.158.231.ssh > cpe9050ca239d63-cm9050ca239d60.cpe.net.cable.rogers.com.55891: Flags [P.], seq 3329620:3329824, ack 1801, win 501, length 204
21:15:47.566857 IP 138.197.158.231.ssh > cpe9050ca239d63-cm9050ca239d60.cpe.net.cable.rogers.com.55891: Flags [P.], seq 3329824:3330028, ack 1801, win 501, length 204
21:15:47.566912 IP 138.197.158.231.ssh > cpe9050ca239d63-cm9050ca239d60.cpe.net.cable.rogers.com.55891: Flags [P.], seq 3330028:3330232, ack 1801, win 501, length 204
21:15:47.566964 IP 138.197.158.231.ssh > cpe9050ca239d63-cm9050ca239d60.cpe.net.cable.rogers.com.55891: Flags [P.], seq 3330232:3330436, ack 1801, win 501, length 204
21:15:47.567019 IP 138.197.158.231.ssh > cpe9050ca239d63-cm9050ca239d60.cpe.net.cable.rogers.com.55891: Flags [P.], seq 3330436:3330640, ack 1801, win 501, length 204
21:15:47.567070 IP 138.197.158.231.ssh > cpe9050ca239d63-cm9050ca239d60.cpe.net.cable.rogers.com.55891: Flags [P.], seq 3330640:3330844, ack 1801, win 501, length 204
21:15:47.567126 IP 138.197.158.231.ssh > cpe9050ca239d63-cm9050ca239d60.cpe.net.cable.rogers.com.55891: Flags [P.], seq 3330844:3331048, ack 1801, win 501, length 204
21:15:47.567178 IP 138.197.158.231.ssh > cpe9050ca239d63-cm9050ca239d60.cpe.net.cable.rogers.com.55891: Flags [P.], seq 3331048:3331252, ack 1801, win 501, length 204
21:15:47.567233 IP 138.197.158.231.ssh > cpe9050ca239d63-cm9050ca239d60.cpe.net.cable.rogers.com.55891: Flags [P.], seq 3331252:3331456, ack 1801, win 501, length 204
21:15:47.567299 IP 138.197.158.231.ssh > cpe9050ca239d63-cm9050ca239d60.cpe.net.cable.rogers.com.55891: Flags [P.], seq 3331456:3331660, ack 1801, win 501, length 204
21:15:47.567353 IP 138.197.158.231.ssh > cpe9050ca239d63-cm9050ca239d60.cpe.net.cable.rogers.com.55891: Flags [P.], seq 3331660:3331864, ack 1801, win 501, length 204
21:15:47.567407 IP 138.197.158.231.ssh > cpe9050ca239d63-cm9050ca239d60.cpe.net.cable.rogers.com.55891: Flags [P.], seq 3331864:3332068, ack 1801, win 501, length 204
21:15:47.567460 IP 138.197.158.231.ssh > cpe9050ca239d63-cm9050ca239d60.cpe.net.cable.rogers.com.55891: Flags [P.], seq 3332068:3332272, ack 1801, win 501, length 204
21:15:47.567516 IP 138.197.158.231.ssh > cpe9050ca239d63-cm9050ca239d60.cpe.net.cable.rogers.com.55891: Flags [P.], seq 3332272:3332476, ack 1801, win 501, length 204
21:15:47.567567 IP 138.197.158.231.ssh > cpe9050ca239d63-cm9050ca239d60.cpe.net.cable.rogers.com.55891: Flags [P.], seq 3332476:3332680, ack 1801, win 501, length 204
21:15:47.567623 IP 138.197.158.231.ssh > cpe9050ca239d63-cm9050ca239d60.cpe.net.cable.rogers.com.55891: Flags [P.], seq 3332680:3332884, ack 1801, win 501, length 204
21:15:47.567675 IP 138.197.158.231.ssh > cpe9050ca239d63-cm9050ca239d60.cpe.net.cable.rogers.com.55891: Flags [P.], seq 3332884:3333088, ack 1801, win 501, length 204
21:15:47.567726 IP 138.197.158.231.ssh > cpe9050ca239d63-cm9050ca239d60.cpe.net.cable.rogers.com.55891: Flags [P.], seq 3333088:3333292, ack 1801, win 501, length 204
21:15:47.567781 IP 138.197.158.231.ssh > cpe9050ca239d63-cm9050ca239d60.cpe.net.cable.rogers.com.55891: Flags [P.], seq 3333292:3333496, ack 1801, win 501, length 204
21:15:47.567832 IP 138.197.158.231.ssh > cpe9050ca239d63-cm9050ca239d60.cpe.net.cable.rogers.com.55891: Flags [P.], seq 3333496:3333700, ack 1801, win 501, length 204
21:15:47.567884 IP 138.197.158.231.ssh > cpe9050ca239d63-cm9050ca239d60.cpe.net.cable.rogers.com.55891: Flags [P.], seq 3333700:3333904, ack 1801, win 501, length 204
21:15:47.567940 IP 138.197.158.231.ssh > cpe9050ca239d63-cm9050ca239d60.cpe.net.cable.rogers.com.55891: Flags [P.], seq 3333904:3334108, ack 1801, win 501, length 204
21:15:47.567992 IP 138.197.158.231.ssh > cpe9050ca239d63-cm9050ca239d60.cpe.net.cable.rogers.com.55891: Flags [P.], seq 3334108:3334312, ack 1801, win 501, length 204
21:15:47.568048 IP 138.197.158.231.ssh > cpe9050ca239d63-cm9050ca239d60.cpe.net.cable.rogers.com.55891: Flags [P.], seq 3334312:3334516, ack 1801, win 501, length 204
21:15:47.568099 IP 138.197.158.231.ssh > cpe9050ca239d63-cm9050ca239d60.cpe.net.cable.rogers.com.55891: Flags [P.], seq 3334516:3334720, ack 1801, win 501, length 204
21:15:47.568153 IP 138.197.158.231.ssh > cpe9050ca239d63-cm9050ca239d60.cpe.net.cable.rogers.com.55891: Flags [P.], seq 3334720:3334924, ack 1801, win 501, length 204
21:15:47.568207 IP 138.197.158.231.ssh > cpe9050ca239d63-cm9050ca239d60.cpe.net.cable.rogers.com.55891: Flags [P.], seq 3334924:3335128, ack 1801, win 501, length 204
21:15:47.568994 IP 138.197.158.231.ssh > cpe9050ca239d63-cm9050ca239d60.cpe.net.cable.rogers.com.55891: Flags [P.], seq 3335128:3335332, ack 1801, win 501, length 204
21:15:47.569078 IP 138.197.158.231.ssh > cpe9050ca239d63-cm9050ca239d60.cpe.net.cable.rogers.com.55891: Flags [P.], seq 3335332:3335536, ack 1801, win 501, length 204
21:15:47.569140 IP 138.197.158.231.ssh > cpe9050ca239d63-cm9050ca239d60.cpe.net.cable.rogers.com.55891: Flags [P.], seq 3335536:3335740, ack 1801, win 501, length 204
21:15:47.569201 IP 138.197.158.231.ssh > cpe9050ca239d63-cm9050ca239d60.cpe.net.cable.rogers.com.55891: Flags [P.], seq 3335740:3335944, ack 1801, win 501, length 204
21:15:47.569258 IP 138.197.158.231.ssh > cpe9050ca239d63-cm9050ca239d60.cpe.net.cable.rogers.com.55891: Flags [P.], seq 3335944:3336148, ack 1801, win 501, length 204
21:15:47.569310 IP 138.197.158.231.ssh > cpe9050ca239d63-cm9050ca239d60.cpe.net.cable.rogers.com.55891: Flags [P.], seq 3336148:3336352, ack 1801, win 501, length 204
21:15:47.569364 IP 138.197.158.231.ssh > cpe9050ca239d63-cm9050ca239d60.cpe.net.cable.rogers.com.55891: Flags [P.], seq 3336352:3336556, ack 1801, win 501, length 204
21:15:47.569420 IP 138.197.158.231.ssh > cpe9050ca239d63-cm9050ca239d60.cpe.net.cable.rogers.com.55891: Flags [P.], seq 3336556:3336760, ack 1801, win 501, length 204
21:15:47.569474 IP 138.197.158.231.ssh > cpe9050ca239d63-cm9050ca239d60.cpe.net.cable.rogers.com.55891: Flags [P.], seq 3336760:3336964, ack 1801, win 501, length 204
21:15:47.569530 IP 138.197.158.231.ssh > cpe9050ca239d63-cm9050ca239d60.cpe.net.cable.rogers.com.55891: Flags [P.], seq 3336964:3337168, ack 1801, win 501, length 204
21:15:47.569584 IP 138.197.158.231.ssh > cpe9050ca239d63-cm9050ca239d60.cpe.net.cable.rogers.com.55891: Flags [P.], seq 3337168:3337372, ack 1801, win 501, length 204
21:15:47.569640 IP 138.197.158.231.ssh > cpe9050ca239d63-cm9050ca239d60.cpe.net.cable.rogers.com.55891: Flags [P.], seq 3337372:3337576, ack 1801, win 501, length 204
21:15:47.569697 IP 138.197.158.231.ssh > cpe9050ca239d63-cm9050ca239d60.cpe.net.cable.rogers.com.55891: Flags [P.], seq 3337576:3337780, ack 1801, win 501, length 204
21:15:47.569752 IP 138.197.158.231.ssh > cpe9050ca239d63-cm9050ca239d60.cpe.net.cable.rogers.com.55891: Flags [P.], seq 3337780:3337984, ack 1801, win 501, length 204
21:15:47.569804 IP 138.197.158.231.ssh > cpe9050ca239d63-cm9050ca239d60.cpe.net.cable.rogers.com.55891: Flags [P.], seq 3337984:3338188, ack 1801, win 501, length 204
21:15:47.569858 IP 138.197.158.231.ssh > cpe9050ca239d63-cm9050ca239d60.cpe.net.cable.rogers.com.55891: Flags [P.], seq 3338188:3338392, ack 1801, win 501, length 204
21:15:47.569913 IP 138.197.158.231.ssh > cpe9050ca239d63-cm9050ca239d60.cpe.net.cable.rogers.com.55891: Flags [P.], seq 3338392:3338596, ack 1801, win 501, length 204
21:15:47.569969 IP 138.197.158.231.ssh > cpe9050ca239d63-cm9050ca239d60.cpe.net.cable.rogers.com.55891: Flags [P.], seq 3338596:3338800, ack 1801, win 501, length 204
21:15:47.570024 IP 138.197.158.231.ssh > cpe9050ca239d63-cm9050ca239d60.cpe.net.cable.rogers.com.55891: Flags [P.], seq 3338800:3339004, ack 1801, win 501, length 204
21:15:47.570076 IP 138.197.158.231.ssh > cpe9050ca239d63-cm9050ca239d60.cpe.net.cable.rogers.com.55891: Flags [P.], seq 3339004:3339208, ack 1801, win 501, length 204
21:15:47.570132 IP 138.197.158.231.ssh > cpe9050ca239d63-cm9050ca239d60.cpe.net.cable.rogers.com.55891: Flags [P.], seq 3339208:3339412, ack 1801, win 501, length 204
21:15:47.570183 IP 138.197.158.231.ssh > cpe9050ca239d63-cm9050ca239d60.cpe.net.cable.rogers.com.55891: Flags [P.], seq 3339412:3339616, ack 1801, win 501, length 204
21:15:47.570238 IP 138.197.158.231.ssh > cpe9050ca239d63-cm9050ca239d60.cpe.net.cable.rogers.com.55891: Flags [P.], seq 3339616:3339820, ack 1801, win 501, length 204
21:15:47.570290 IP 138.197.158.231.ssh > cpe9050ca239d63-cm9050ca239d60.cpe.net.cable.rogers.com.55891: Flags [P.], seq 3339820:3340024, ack 1801, win 501, length 204
21:15:47.570347 IP 138.197.158.231.ssh > cpe9050ca239d63-cm9050ca239d60.cpe.net.cable.rogers.com.55891: Flags [P.], seq 3340024:3340228, ack 1801, win 501, length 204
21:15:47.570404 IP 138.197.158.231.ssh > cpe9050ca239d63-cm9050ca239d60.cpe.net.cable.rogers.com.55891: Flags [P.], seq 3340228:3340432, ack 1801, win 501, length 204
21:15:47.570461 IP 138.197.158.231.ssh > cpe9050ca239d63-cm9050ca239d60.cpe.net.cable.rogers.com.55891: Flags [P.], seq 3340432:3340636, ack 1801, win 501, length 204
21:15:47.570514 IP 138.197.158.231.ssh > cpe9050ca239d63-cm9050ca239d60.cpe.net.cable.rogers.com.55891: Flags [P.], seq 3340636:3340840, ack 1801, win 501, length 204
21:15:47.570568 IP 138.197.158.231.ssh > cpe9050ca239d63-cm9050ca239d60.cpe.net.cable.rogers.com.55891: Flags [P.], seq 3340840:3341044, ack 1801, win 501, length 204
21:15:47.570624 IP 138.197.158.231.ssh > cpe9050ca239d63-cm9050ca239d60.cpe.net.cable.rogers.com.55891: Flags [P.], seq 3341044:3341248, ack 1801, win 501, length 204
21:15:47.570682 IP 138.197.158.231.ssh > cpe9050ca239d63-cm9050ca239d60.cpe.net.cable.rogers.com.55891: Flags [P.], seq 3341248:3341452, ack 1801, win 501, length 204
21:15:47.570734 IP 138.197.158.231.ssh > cpe9050ca239d63-cm9050ca239d60.cpe.net.cable.rogers.com.55891: Flags [P.], seq 3341452:3341656, ack 1801, win 501, length 204
21:15:47.570792 IP 138.197.158.231.ssh > cpe9050ca239d63-cm9050ca239d60.cpe.net.cable.rogers.com.55891: Flags [P.], seq 3341656:3341860, ack 1801, win 501, length 204
21:15:47.570859 IP 138.197.158.231.ssh > cpe9050ca239d63-cm9050ca239d60.cpe.net.cable.rogers.com.55891: Flags [P.], seq 3341860:3342064, ack 1801, win 501, length 204
21:15:47.570913 IP 138.197.158.231.ssh > cpe9050ca239d63-cm9050ca239d60.cpe.net.cable.rogers.com.55891: Flags [P.], seq 3342064:3342268, ack 1801, win 501, length 204
21:15:47.570965 IP 138.197.158.231.ssh > cpe9050ca239d63-cm9050ca239d60.cpe.net.cable.rogers.com.55891: Flags [P.], seq 3342268:3342472, ack 1801, win 501, length 204
21:15:47.571017 IP 138.197.158.231.ssh > cpe9050ca239d63-cm9050ca239d60.cpe.net.cable.rogers.com.55891: Flags [P.], seq 3342472:3342676, ack 1801, win 501, length 204
21:15:47.571115 IP 138.197.158.231.ssh > cpe9050ca239d63-cm9050ca239d60.cpe.net.cable.rogers.com.55891: Flags [P.], seq 3342676:3342880, ack 1801, win 501, length 204
21:15:47.571202 IP 138.197.158.231.ssh > cpe9050ca239d63-cm9050ca239d60.cpe.net.cable.rogers.com.55891: Flags [P.], seq 3342880:3343084, ack 1801, win 501, length 204
21:15:47.571302 IP 138.197.158.231.ssh > cpe9050ca239d63-cm9050ca239d60.cpe.net.cable.rogers.com.55891: Flags [P.], seq 3343084:3343288, ack 1801, win 501, length 204
21:15:47.571374 IP 138.197.158.231.ssh > cpe9050ca239d63-cm9050ca239d60.cpe.net.cable.rogers.com.55891: Flags [P.], seq 3343288:3343492, ack 1801, win 501, length 204
21:15:47.571432 IP 138.197.158.231.ssh > cpe9050ca239d63-cm9050ca239d60.cpe.net.cable.rogers.com.55891: Flags [P.], seq 3343492:3343696, ack 1801, win 501, length 204
21:15:47.571487 IP 138.197.158.231.ssh > cpe9050ca239d63-cm9050ca239d60.cpe.net.cable.rogers.com.55891: Flags [P.], seq 3343696:3343900, ack 1801, win 501, length 204
21:15:47.571541 IP 138.197.158.231.ssh > cpe9050ca239d63-cm9050ca239d60.cpe.net.cable.rogers.com.55891: Flags [P.], seq 3343900:3344104, ack 1801, win 501, length 204
21:15:47.571595 IP 138.197.158.231.ssh > cpe9050ca239d63-cm9050ca239d60.cpe.net.cable.rogers.com.55891: Flags [P.], seq 3344104:3344308, ack 1801, win 501, length 204
21:15:47.571651 IP 138.197.158.231.ssh > cpe9050ca239d63-cm9050ca239d60.cpe.net.cable.rogers.com.55891: Flags [P.], seq 3344308:3344512, ack 1801, win 501, length 204
21:15:47.571703 IP 138.197.158.231.ssh > cpe9050ca239d63-cm9050ca239d60.cpe.net.cable.rogers.com.55891: Flags [P.], seq 3344512:3344716, ack 1801, win 501, length 204
21:15:47.571760 IP 138.197.158.231.ssh > cpe9050ca239d63-cm9050ca239d60.cpe.net.cable.rogers.com.55891: Flags [P.], seq 3344716:3344920, ack 1801, win 501, length 204
21:15:47.571812 IP 138.197.158.231.ssh > cpe9050ca239d63-cm9050ca239d60.cpe.net.cable.rogers.com.55891: Flags [P.], seq 3344920:3345124, ack 1801, win 501, length 204
21:15:47.571871 IP 138.197.158.231.ssh > cpe9050ca239d63-cm9050ca239d60.cpe.net.cable.rogers.com.55891: Flags [P.], seq 3345124:3345328, ack 1801, win 501, length 204
21:15:47.571939 IP 138.197.158.231.ssh > cpe9050ca239d63-cm9050ca239d60.cpe.net.cable.rogers.com.55891: Flags [P.], seq 3345328:3345532, ack 1801, win 501, length 204
21:15:47.571976 IP cpe9050ca239d63-cm9050ca239d60.cpe.net.cable.rogers.com.55891 > 138.197.158.231.ssh: Flags [.], ack 3265892, win 4140, length 0
21:15:47.571993 IP cpe9050ca239d63-cm9050ca239d60.cpe.net.cable.rogers.com.55891 > 138.197.158.231.ssh: Flags [.], ack 3266544, win 4137, length 0
21:15:47.571997 IP cpe9050ca239d63-cm9050ca239d60.cpe.net.cable.rogers.com.55891 > 138.197.158.231.ssh: Flags [.], ack 3268992, win 4140, length 0
21:15:47.572005 IP cpe9050ca239d63-cm9050ca239d60.cpe.net.cable.rogers.com.55891 > 138.197.158.231.ssh: Flags [.], ack 3273888, win 4140, length 0
21:15:47.572019 IP cpe9050ca239d63-cm9050ca239d60.cpe.net.cable.rogers.com.55891 > 138.197.158.231.ssh: Flags [.], ack 3280416, win 4140, length 0
21:15:47.572037 IP cpe9050ca239d63-cm9050ca239d60.cpe.net.cable.rogers.com.55891 > 138.197.158.231.ssh: Flags [.], ack 3281028, win 4138, length 0
21:15:47.572040 IP cpe9050ca239d63-cm9050ca239d60.cpe.net.cable.rogers.com.55891 > 138.197.158.231.ssh: Flags [.], ack 3287556, win 4140, length 0
21:15:47.572057 IP cpe9050ca239d63-cm9050ca239d60.cpe.net.cable.rogers.com.55891 > 138.197.158.231.ssh: Flags [.], ack 3287760, win 4139, length 0
21:15:47.572060 IP cpe9050ca239d63-cm9050ca239d60.cpe.net.cable.rogers.com.55891 > 138.197.158.231.ssh: Flags [.], ack 3288576, win 4136, length 0
21:15:47.572064 IP cpe9050ca239d63-cm9050ca239d60.cpe.net.cable.rogers.com.55891 > 138.197.158.231.ssh: Flags [.], ack 3291432, win 4140, length 0
21:15:47.572216 IP 138.197.158.231.ssh > cpe9050ca239d63-cm9050ca239d60.cpe.net.cable.rogers.com.55891: Flags [P.], seq 3345532:3347216, ack 1801, win 501, length 1684
21:15:47.572278 IP 138.197.158.231.ssh > cpe9050ca239d63-cm9050ca239d60.cpe.net.cable.rogers.com.55891: Flags [P.], seq 3347216:3347420, ack 1801, win 501, length 204
21:15:47.572333 IP 138.197.158.231.ssh > cpe9050ca239d63-cm9050ca239d60.cpe.net.cable.rogers.com.55891: Flags [P.], seq 3347420:3347624, ack 1801, win 501, length 204
21:15:47.572389 IP 138.197.158.231.ssh > cpe9050ca239d63-cm9050ca239d60.cpe.net.cable.rogers.com.55891: Flags [P.], seq 3347624:3347828, ack 1801, win 501, length 204
21:15:47.572455 IP 138.197.158.231.ssh > cpe9050ca239d63-cm9050ca239d60.cpe.net.cable.rogers.com.55891: Flags [P.], seq 3347828:3348032, ack 1801, win 501, length 204
21:15:47.572511 IP 138.197.158.231.ssh > cpe9050ca239d63-cm9050ca239d60.cpe.net.cable.rogers.com.55891: Flags [P.], seq 3348032:3348236, ack 1801, win 501, length 204
21:15:47.572568 IP 138.197.158.231.ssh > cpe9050ca239d63-cm9050ca239d60.cpe.net.cable.rogers.com.55891: Flags [P.], seq 3348236:3348440, ack 1801, win 501, length 204
21:15:47.572623 IP 138.197.158.231.ssh > cpe9050ca239d63-cm9050ca239d60.cpe.net.cable.rogers.com.55891: Flags [P.], seq 3348440:3348644, ack 1801, win 501, length 204
21:15:47.572678 IP 138.197.158.231.ssh > cpe9050ca239d63-cm9050ca239d60.cpe.net.cable.rogers.com.55891: Flags [P.], seq 3348644:3348848, ack 1801, win 501, length 204
21:15:47.572733 IP 138.197.158.231.ssh > cpe9050ca239d63-cm9050ca239d60.cpe.net.cable.rogers.com.55891: Flags [P.], seq 3348848:3349052, ack 1801, win 501, length 204
21:15:47.572805 IP 138.197.158.231.ssh > cpe9050ca239d63-cm9050ca239d60.cpe.net.cable.rogers.com.55891: Flags [P.], seq 3349052:3349256, ack 1801, win 501, length 204
21:15:47.572863 IP 138.197.158.231.ssh > cpe9050ca239d63-cm9050ca239d60.cpe.net.cable.rogers.com.55891: Flags [P.], seq 3349256:3349460, ack 1801, win 501, length 204
21:15:47.572920 IP 138.197.158.231.ssh > cpe9050ca239d63-cm9050ca239d60.cpe.net.cable.rogers.com.55891: Flags [P.], seq 3349460:3349664, ack 1801, win 501, length 204
21:15:47.572976 IP 138.197.158.231.ssh > cpe9050ca239d63-cm9050ca239d60.cpe.net.cable.rogers.com.55891: Flags [P.], seq 3349664:3349868, ack 1801, win 501, length 204
21:15:47.573032 IP 138.197.158.231.ssh > cpe9050ca239d63-cm9050ca239d60.cpe.net.cable.rogers.com.55891: Flags [P.], seq 3349868:3350072, ack 1801, win 501, length 204
21:15:47.573087 IP 138.197.158.231.ssh > cpe9050ca239d63-cm9050ca239d60.cpe.net.cable.rogers.com.55891: Flags [P.], seq 3350072:3350276, ack 1801, win 501, length 204
21:15:47.573140 IP 138.197.158.231.ssh > cpe9050ca239d63-cm9050ca239d60.cpe.net.cable.rogers.com.55891: Flags [P.], seq 3350276:3350480, ack 1801, win 501, length 204
21:15:47.573192 IP 138.197.158.231.ssh > cpe9050ca239d63-cm9050ca239d60.cpe.net.cable.rogers.com.55891: Flags [P.], seq 3350480:3350684, ack 1801, win 501, length 204
21:15:47.573247 IP 138.197.158.231.ssh > cpe9050ca239d63-cm9050ca239d60.cpe.net.cable.rogers.com.55891: Flags [P.], seq 3350684:3350888, ack 1801, win 501, length 204
21:15:47.573299 IP 138.197.158.231.ssh > cpe9050ca239d63-cm9050ca239d60.cpe.net.cable.rogers.com.55891: Flags [P.], seq 3350888:3351092, ack 1801, win 501, length 204
21:15:47.573350 IP 138.197.158.231.ssh > cpe9050ca239d63-cm9050ca239d60.cpe.net.cable.rogers.com.55891: Flags [P.], seq 3351092:3351296, ack 1801, win 501, length 204
21:15:47.573402 IP 138.197.158.231.ssh > cpe9050ca239d63-cm9050ca239d60.cpe.net.cable.rogers.com.55891: Flags [P.], seq 3351296:3351500, ack 1801, win 501, length 204
21:15:47.573458 IP 138.197.158.231.ssh > cpe9050ca239d63-cm9050ca239d60.cpe.net.cable.rogers.com.55891: Flags [P.], seq 3351500:3351704, ack 1801, win 501, length 204
21:15:47.573520 IP 138.197.158.231.ssh > cpe9050ca239d63-cm9050ca239d60.cpe.net.cable.rogers.com.55891: Flags [P.], seq 3351704:3351908, ack 1801, win 501, length 204
21:15:47.573572 IP 138.197.158.231.ssh > cpe9050ca239d63-cm9050ca239d60.cpe.net.cable.rogers.com.55891: Flags [P.], seq 3351908:3352112, ack 1801, win 501, length 204
21:15:47.573625 IP 138.197.158.231.ssh > cpe9050ca239d63-cm9050ca239d60.cpe.net.cable.rogers.com.55891: Flags [P.], seq 3352112:3352316, ack 1801, win 501, length 204
21:15:47.573676 IP 138.197.158.231.ssh > cpe9050ca239d63-cm9050ca239d60.cpe.net.cable.rogers.com.55891: Flags [P.], seq 3352316:3352520, ack 1801, win 501, length 204
21:15:47.573732 IP 138.197.158.231.ssh > cpe9050ca239d63-cm9050ca239d60.cpe.net.cable.rogers.com.55891: Flags [P.], seq 3352520:3352724, ack 1801, win 501, length 204
21:15:47.573784 IP 138.197.158.231.ssh > cpe9050ca239d63-cm9050ca239d60.cpe.net.cable.rogers.com.55891: Flags [P.], seq 3352724:3352928, ack 1801, win 501, length 204
21:15:47.573839 IP 138.197.158.231.ssh > cpe9050ca239d63-cm9050ca239d60.cpe.net.cable.rogers.com.55891: Flags [P.], seq 3352928:3353132, ack 1801, win 501, length 204
21:15:47.573892 IP 138.197.158.231.ssh > cpe9050ca239d63-cm9050ca239d60.cpe.net.cable.rogers.com.55891: Flags [P.], seq 3353132:3353336, ack 1801, win 501, length 204
21:15:47.573943 IP 138.197.158.231.ssh > cpe9050ca239d63-cm9050ca239d60.cpe.net.cable.rogers.com.55891: Flags [P.], seq 3353336:3353540, ack 1801, win 501, length 204
21:15:47.573996 IP 138.197.158.231.ssh > cpe9050ca239d63-cm9050ca239d60.cpe.net.cable.rogers.com.55891: Flags [P.], seq 3353540:3353744, ack 1801, win 501, length 204
21:15:47.574056 IP 138.197.158.231.ssh > cpe9050ca239d63-cm9050ca239d60.cpe.net.cable.rogers.com.55891: Flags [P.], seq 3353744:3353948, ack 1801, win 501, length 204
21:15:47.574109 IP 138.197.158.231.ssh > cpe9050ca239d63-cm9050ca239d60.cpe.net.cable.rogers.com.55891: Flags [P.], seq 3353948:3354152, ack 1801, win 501, length 204
21:15:47.574164 IP 138.197.158.231.ssh > cpe9050ca239d63-cm9050ca239d60.cpe.net.cable.rogers.com.55891: Flags [P.], seq 3354152:3354356, ack 1801, win 501, length 204
21:15:47.574216 IP 138.197.158.231.ssh > cpe9050ca239d63-cm9050ca239d60.cpe.net.cable.rogers.com.55891: Flags [P.], seq 3354356:3354560, ack 1801, win 501, length 204
21:15:47.574268 IP 138.197.158.231.ssh > cpe9050ca239d63-cm9050ca239d60.cpe.net.cable.rogers.com.55891: Flags [P.], seq 3354560:3354764, ack 1801, win 501, length 204
21:15:47.574324 IP 138.197.158.231.ssh > cpe9050ca239d63-cm9050ca239d60.cpe.net.cable.rogers.com.55891: Flags [P.], seq 3354764:3354968, ack 1801, win 501, length 204
21:15:47.574376 IP 138.197.158.231.ssh > cpe9050ca239d63-cm9050ca239d60.cpe.net.cable.rogers.com.55891: Flags [P.], seq 3354968:3355172, ack 1801, win 501, length 204
21:15:47.574427 IP 138.197.158.231.ssh > cpe9050ca239d63-cm9050ca239d60.cpe.net.cable.rogers.com.55891: Flags [P.], seq 3355172:3355376, ack 1801, win 501, length 204
21:15:47.574487 IP 138.197.158.231.ssh > cpe9050ca239d63-cm9050ca239d60.cpe.net.cable.rogers.com.55891: Flags [P.], seq 3355376:3355580, ack 1801, win 501, length 204
21:15:47.574542 IP 138.197.158.231.ssh > cpe9050ca239d63-cm9050ca239d60.cpe.net.cable.rogers.com.55891: Flags [P.], seq 3355580:3355784, ack 1801, win 501, length 204
21:15:47.574593 IP 138.197.158.231.ssh > cpe9050ca239d63-cm9050ca239d60.cpe.net.cable.rogers.com.55891: Flags [P.], seq 3355784:3355988, ack 1801, win 501, length 204
21:15:47.574650 IP 138.197.158.231.ssh > cpe9050ca239d63-cm9050ca239d60.cpe.net.cable.rogers.com.55891: Flags [P.], seq 3355988:3356192, ack 1801, win 501, length 204
21:15:47.574703 IP 138.197.158.231.ssh > cpe9050ca239d63-cm9050ca239d60.cpe.net.cable.rogers.com.55891: Flags [P.], seq 3356192:3356396, ack 1801, win 501, length 204
21:15:47.574754 IP 138.197.158.231.ssh > cpe9050ca239d63-cm9050ca239d60.cpe.net.cable.rogers.com.55891: Flags [P.], seq 3356396:3356600, ack 1801, win 501, length 204
21:15:47.574810 IP 138.197.158.231.ssh > cpe9050ca239d63-cm9050ca239d60.cpe.net.cable.rogers.com.55891: Flags [P.], seq 3356600:3356804, ack 1801, win 501, length 204
21:15:47.574862 IP 138.197.158.231.ssh > cpe9050ca239d63-cm9050ca239d60.cpe.net.cable.rogers.com.55891: Flags [P.], seq 3356804:3357008, ack 1801, win 501, length 204
21:15:47.574917 IP 138.197.158.231.ssh > cpe9050ca239d63-cm9050ca239d60.cpe.net.cable.rogers.com.55891: Flags [P.], seq 3357008:3357212, ack 1801, win 501, length 204
21:15:47.574968 IP 138.197.158.231.ssh > cpe9050ca239d63-cm9050ca239d60.cpe.net.cable.rogers.com.55891: Flags [P.], seq 3357212:3357416, ack 1801, win 501, length 204
21:15:47.575020 IP 138.197.158.231.ssh > cpe9050ca239d63-cm9050ca239d60.cpe.net.cable.rogers.com.55891: Flags [P.], seq 3357416:3357620, ack 1801, win 501, length 204
21:15:47.575075 IP 138.197.158.231.ssh > cpe9050ca239d63-cm9050ca239d60.cpe.net.cable.rogers.com.55891: Flags [P.], seq 3357620:3357824, ack 1801, win 501, length 204
21:15:47.575127 IP 138.197.158.231.ssh > cpe9050ca239d63-cm9050ca239d60.cpe.net.cable.rogers.com.55891: Flags [P.], seq 3357824:3358028, ack 1801, win 501, length 204
21:15:47.575180 IP 138.197.158.231.ssh > cpe9050ca239d63-cm9050ca239d60.cpe.net.cable.rogers.com.55891: Flags [P.], seq 3358028:3358232, ack 1801, win 501, length 204
21:15:47.575235 IP 138.197.158.231.ssh > cpe9050ca239d63-cm9050ca239d60.cpe.net.cable.rogers.com.55891: Flags [P.], seq 3358232:3358436, ack 1801, win 501, length 204
21:15:47.575301 IP 138.197.158.231.ssh > cpe9050ca239d63-cm9050ca239d60.cpe.net.cable.rogers.com.55891: Flags [P.], seq 3358436:3358640, ack 1801, win 501, length 204
21:15:47.575356 IP 138.197.158.231.ssh > cpe9050ca239d63-cm9050ca239d60.cpe.net.cable.rogers.com.55891: Flags [P.], seq 3358640:3358844, ack 1801, win 501, length 204
21:15:47.575408 IP 138.197.158.231.ssh > cpe9050ca239d63-cm9050ca239d60.cpe.net.cable.rogers.com.55891: Flags [P.], seq 3358844:3359048, ack 1801, win 501, length 204
21:15:47.575463 IP 138.197.158.231.ssh > cpe9050ca239d63-cm9050ca239d60.cpe.net.cable.rogers.com.55891: Flags [P.], seq 3359048:3359252, ack 1801, win 501, length 204
21:15:47.575515 IP 138.197.158.231.ssh > cpe9050ca239d63-cm9050ca239d60.cpe.net.cable.rogers.com.55891: Flags [P.], seq 3359252:3359456, ack 1801, win 501, length 204
21:15:47.575570 IP 138.197.158.231.ssh > cpe9050ca239d63-cm9050ca239d60.cpe.net.cable.rogers.com.55891: Flags [P.], seq 3359456:3359660, ack 1801, win 501, length 204
21:15:47.575625 IP 138.197.158.231.ssh > cpe9050ca239d63-cm9050ca239d60.cpe.net.cable.rogers.com.55891: Flags [P.], seq 3359660:3359864, ack 1801, win 501, length 204
21:15:47.575677 IP 138.197.158.231.ssh > cpe9050ca239d63-cm9050ca239d60.cpe.net.cable.rogers.com.55891: Flags [P.], seq 3359864:3360068, ack 1801, win 501, length 204
21:15:47.575729 IP 138.197.158.231.ssh > cpe9050ca239d63-cm9050ca239d60.cpe.net.cable.rogers.com.55891: Flags [P.], seq 3360068:3360272, ack 1801, win 501, length 204
21:15:47.575792 IP 138.197.158.231.ssh > cpe9050ca239d63-cm9050ca239d60.cpe.net.cable.rogers.com.55891: Flags [P.], seq 3360272:3360476, ack 1801, win 501, length 204
21:15:47.575945 IP 138.197.158.231.ssh > cpe9050ca239d63-cm9050ca239d60.cpe.net.cable.rogers.com.55891: Flags [P.], seq 3360476:3360680, ack 1801, win 501, length 204
21:15:47.576051 IP 138.197.158.231.ssh > cpe9050ca239d63-cm9050ca239d60.cpe.net.cable.rogers.com.55891: Flags [P.], seq 3360680:3360884, ack 1801, win 501, length 204
21:15:47.576129 IP 138.197.158.231.ssh > cpe9050ca239d63-cm9050ca239d60.cpe.net.cable.rogers.com.55891: Flags [P.], seq 3360884:3361088, ack 1801, win 501, length 204
21:15:47.576191 IP 138.197.158.231.ssh > cpe9050ca239d63-cm9050ca239d60.cpe.net.cable.rogers.com.55891: Flags [P.], seq 3361088:3361292, ack 1801, win 501, length 204
21:15:47.576288 IP 138.197.158.231.ssh > cpe9050ca239d63-cm9050ca239d60.cpe.net.cable.rogers.com.55891: Flags [P.], seq 3361292:3361496, ack 1801, win 501, length 204
21:15:47.576370 IP 138.197.158.231.ssh > cpe9050ca239d63-cm9050ca239d60.cpe.net.cable.rogers.com.55891: Flags [P.], seq 3361496:3361700, ack 1801, win 501, length 204
21:15:47.576427 IP 138.197.158.231.ssh > cpe9050ca239d63-cm9050ca239d60.cpe.net.cable.rogers.com.55891: Flags [P.], seq 3361700:3361904, ack 1801, win 501, length 204
21:15:47.576486 IP 138.197.158.231.ssh > cpe9050ca239d63-cm9050ca239d60.cpe.net.cable.rogers.com.55891: Flags [P.], seq 3361904:3362108, ack 1801, win 501, length 204
21:15:47.576540 IP 138.197.158.231.ssh > cpe9050ca239d63-cm9050ca239d60.cpe.net.cable.rogers.com.55891: Flags [P.], seq 3362108:3362312, ack 1801, win 501, length 204
21:15:47.576607 IP 138.197.158.231.ssh > cpe9050ca239d63-cm9050ca239d60.cpe.net.cable.rogers.com.55891: Flags [P.], seq 3362312:3362516, ack 1801, win 501, length 204
21:15:47.576663 IP 138.197.158.231.ssh > cpe9050ca239d63-cm9050ca239d60.cpe.net.cable.rogers.com.55891: Flags [P.], seq 3362516:3362720, ack 1801, win 501, length 204
21:15:47.576732 IP 138.197.158.231.ssh > cpe9050ca239d63-cm9050ca239d60.cpe.net.cable.rogers.com.55891: Flags [P.], seq 3362720:3362924, ack 1801, win 501, length 204
21:15:47.576813 IP 138.197.158.231.ssh > cpe9050ca239d63-cm9050ca239d60.cpe.net.cable.rogers.com.55891: Flags [P.], seq 3362924:3363128, ack 1801, win 501, length 204
21:15:47.576927 IP 138.197.158.231.ssh > cpe9050ca239d63-cm9050ca239d60.cpe.net.cable.rogers.com.55891: Flags [P.], seq 3363128:3363332, ack 1801, win 501, length 204
21:15:47.576996 IP 138.197.158.231.ssh > cpe9050ca239d63-cm9050ca239d60.cpe.net.cable.rogers.com.55891: Flags [P.], seq 3363332:3363536, ack 1801, win 501, length 204
21:15:47.577055 IP 138.197.158.231.ssh > cpe9050ca239d63-cm9050ca239d60.cpe.net.cable.rogers.com.55891: Flags [P.], seq 3363536:3363740, ack 1801, win 501, length 204
21:15:47.577110 IP 138.197.158.231.ssh > cpe9050ca239d63-cm9050ca239d60.cpe.net.cable.rogers.com.55891: Flags [P.], seq 3363740:3363944, ack 1801, win 501, length 204
21:15:47.577167 IP 138.197.158.231.ssh > cpe9050ca239d63-cm9050ca239d60.cpe.net.cable.rogers.com.55891: Flags [P.], seq 3363944:3364148, ack 1801, win 501, length 204
21:15:47.577221 IP 138.197.158.231.ssh > cpe9050ca239d63-cm9050ca239d60.cpe.net.cable.rogers.com.55891: Flags [P.], seq 3364148:3364352, ack 1801, win 501, length 204
21:15:47.577275 IP 138.197.158.231.ssh > cpe9050ca239d63-cm9050ca239d60.cpe.net.cable.rogers.com.55891: Flags [P.], seq 3364352:3364556, ack 1801, win 501, length 204
21:15:47.577331 IP 138.197.158.231.ssh > cpe9050ca239d63-cm9050ca239d60.cpe.net.cable.rogers.com.55891: Flags [P.], seq 3364556:3364760, ack 1801, win 501, length 204
21:15:47.577386 IP 138.197.158.231.ssh > cpe9050ca239d63-cm9050ca239d60.cpe.net.cable.rogers.com.55891: Flags [P.], seq 3364760:3364964, ack 1801, win 501, length 204
21:15:47.577440 IP 138.197.158.231.ssh > cpe9050ca239d63-cm9050ca239d60.cpe.net.cable.rogers.com.55891: Flags [P.], seq 3364964:3365168, ack 1801, win 501, length 204
21:15:47.577497 IP 138.197.158.231.ssh > cpe9050ca239d63-cm9050ca239d60.cpe.net.cable.rogers.com.55891: Flags [P.], seq 3365168:3365372, ack 1801, win 501, length 204
21:15:47.577550 IP 138.197.158.231.ssh > cpe9050ca239d63-cm9050ca239d60.cpe.net.cable.rogers.com.55891: Flags [P.], seq 3365372:3365576, ack 1801, win 501, length 204
21:15:47.577603 IP 138.197.158.231.ssh > cpe9050ca239d63-cm9050ca239d60.cpe.net.cable.rogers.com.55891: Flags [P.], seq 3365576:3365780, ack 1801, win 501, length 204
21:15:47.577659 IP 138.197.158.231.ssh > cpe9050ca239d63-cm9050ca239d60.cpe.net.cable.rogers.com.55891: Flags [P.], seq 3365780:3365984, ack 1801, win 501, length 204
21:15:47.577712 IP 138.197.158.231.ssh > cpe9050ca239d63-cm9050ca239d60.cpe.net.cable.rogers.com.55891: Flags [P.], seq 3365984:3366188, ack 1801, win 501, length 204
21:15:47.577768 IP 138.197.158.231.ssh > cpe9050ca239d63-cm9050ca239d60.cpe.net.cable.rogers.com.55891: Flags [P.], seq 3366188:3366392, ack 1801, win 501, length 204
21:15:47.577834 IP 138.197.158.231.ssh > cpe9050ca239d63-cm9050ca239d60.cpe.net.cable.rogers.com.55891: Flags [P.], seq 3366392:3366596, ack 1801, win 501, length 204
21:15:47.577889 IP 138.197.158.231.ssh > cpe9050ca239d63-cm9050ca239d60.cpe.net.cable.rogers.com.55891: Flags [P.], seq 3366596:3366800, ack 1801, win 501, length 204
21:15:47.577946 IP 138.197.158.231.ssh > cpe9050ca239d63-cm9050ca239d60.cpe.net.cable.rogers.com.55891: Flags [P.], seq 3366800:3367004, ack 1801, win 501, length 204
21:15:47.577999 IP 138.197.158.231.ssh > cpe9050ca239d63-cm9050ca239d60.cpe.net.cable.rogers.com.55891: Flags [P.], seq 3367004:3367208, ack 1801, win 501, length 204
